DOS,DOSDescription,DPR,DPRDescription,DTE,DTEDescription,DUC,DUCDescription
,,DPR0058,"Create a development library that all users must leverage in order to interact with any hosted databases. This library modifies queries to look difficult to write. Any queries made without the library will now be obvious to detect and are immediately investigated as malicious activity.",DTE0033,,,
,,,,DTE0034,,DUC0123,"A defender can monitor websites for unplanned content changes and generate alerts when activity is detected."
,,,,DTE0036,,DUC0075,"A defender can change the output of a recon commands to hide simulation elements you don’t want attacked and present simulation elements you want the adversary to engage with."
,,,,DTE0004,"DTE0004 - Application Diversity",DUC0180,"During an adversary engagement operation, a defender can open and use any particular subset of applications installed on a system to control what is presented to the adversary at any point in time."
,,,,DTE0004,"DTE0004 - Application Diversity",DUC0235,"A defender can install an array of various software packages on a system to make it look used and populated. This will give an adversary a collection of software to interact with and possibly expose additional techniques."
DOS0008,"There is an opportunity to present several public-facing application options to see what application(s) the adversary targets.",,,DTE0013,,,
,,,,DTE0027,,DUC0159,"A defender can monitor for systems establishing connections using encapsulated protocols not commonly used together such as RDP tunneled over TCP."
,,DPR0062,"Train users to report potentially compromised devices so they can be isolated or migrated into deception networks.",DTE0035,,,
,,,,DTE0007,,DUC0244,"Defenders can detect adversaries attempting to exfiltrate over web services by implementing behavioral analytics. This can detect a system connecting to these web services that it might not normally connect to, or during a time when it normally doesn't do so."
,,DPR0060,"Monitor Windows systems for event codes that reflect an adversary changing passwords, adding accounts to groups, etc.",DTE0034,,,
,,,,DTE0011,,DUC0113,"A defender can display decoy content on the screen which may be of interest to an adversary in an attempt to elicit further engagement."
DOS0188,"There is an opportunity to use decoy accounts of varying types to see what an adversary is most interested in.",,,DTE0013,,,
,,DPR0044,"Deploy a variety of systems which reflect the use of multiple operating systems, hardware platforms, network services, etc.",DTE0025,,,
,,,,DTE0006,,DUC0046,"A defender can force the removal of browser extensions that are not allowed by a corporate policy."
DOS0159,"There is an opportunity to manipulate the network to allow/deny certain types of traffic, to degrade network traffic, or otherwise impact an adversary's activity.",,,DTE0026,,,
,,,,DTE0011,,DUC0210,"A defender can use decoy content to give the false impression about the nature of the system in order to entice an adversary to continue engagement."
,,,,DTE0033,,DUC0061,"A defender can define operating procedures for modifying GPOs and alert when they are not followed."
,,,,DTE0007,,DUC0241,"Defenders can look for anomalies in where an account is authenticating and what it is authenticating to in order to detect potentially malicious intent."
,,DPR0022,"Create directories and files with names and contents using key words that may be relevant to an adversary to see if they examine or exfiltrate the data.",DTE0011,,,
DOS0148,"In an adversary engagement scenario, there is an opportunity to implement security controls to allow an adversary to accomplish a task and extend an engagement.",,,DTE0032,,,
DOS0001,"There is an opportunity to study the adversary and collect first-hand observations about them and their tools.",,,DTE0034,"DTE0034 - System Activity Monitoring",,
,,,,DTE0001,"DTE0001 - Admin Access",DUC0196,"A defender could remove admin access in an attempt to force an adversary to perform privilege escalation to install a rootkit."
,,DPR0031,"Create decoy processes on a system that mimic common antivirus process names. These processes when seen may prevent adversary malware from executing for fear of detection.",DTE0016,,,
DOS0074,"There is an opportunity to influence an adversary to move toward systems you want them to engage with.",,,DTE0011,,,
,,DPR0065,"Use information about an adversary's TTPs to perform retroactive searches for any activity that have gone undetected.",DTE0021,,,
,,,,DTE0033,,DUC0054,"A defender can define operating procedures for adding services and alert when they are not followed."
,,,,DTE0034,,DUC0060,"A defender can monitor for signs that security tools and other controls are being tampered with by an adversary."
,,,,DTE0006,,DUC0050,"A defender can store good copies of registry startup keys and restore them on a frequent basis. This can prevent an adversary from using them to launch malware on system startup."
DOS0160,"There is an opportunity to detect an unknown process that is being used for command and control and disrupt it.",,,DTE0022,,,
DOS0028,"There is an opportunity for the defender to observe the adversary and control what they can see, what effects they can have, and/or what data they can access.",,,DTE0036,,,
DOS0219,"There is an opportunity to provide a variety of applications to an adversary to see what things an adversary prefers or to influence their operations.",,,DTE0004,"DTE0004 - Application Diversity",,
DOS0002,"There is an opportunity to discover who or what is being targeting by an adversary.",,,DTE0004,"DTE0004 - Application Diversity",,
,,,,DTE0014,,DUC0251,"A defender can use a decoy network and seed it with cloud services to see how an adversary might exploit those resources."
,,,,DTE0020,,DUC0115,"A defender can physically remove or disable a system's web camera and remove any video capture applications so that video capture is not possible."
,,DPR0052,"When staging a decoy system and user account, populate a user's folders and web history to make it look realistic to an adversary.",DTE0030,,,
DOS0087,"In an adversary engagement scenario, there is an opportunity to test whether an adversary has the capability to steal or forge Kerberos tickets.",,,DTE0032,,,
,,,,DTE0017,,DUC0007,"A defender can use decoy system running a public-facing application to see if an adversary attempts to compromise the system and learn their TTPs."
,,,,DTE0034,,DUC0027,"A defender can capture system activity logs and generate alerts if the adversary creates new scheduled tasks or alters existing tasks."
DOS0006,"There is an opportunity to prepare user accounts so they look used and authentic.",,,DTE0008,"DTE0008 - Burn-In",,
,,,,DTE0036,,DUC0216,"A defender can alter the output of the password policy description so the adversary is unsure of exactly what the requirements are."
DOS0024,"There is an opportunity to determine adversary capabilities or preferences by controlling aspects of the engagement environment.",,,DTE0025,"DTE0025 - Network Diversity",,
DOS0098,"In an adversary engagement scenario, there is an opportunity to seed content to influence an adversary's behaviors, test their interest in specific topics, or add legitimacy to a system or environment.",,,DTE0030,"DTE0030 - Pocket Litter",,
,,,,DTE0032,,DUC0144,"A defender could implement security controls to have an effect on process injection techniques such as AppLocker or an Antivirus/EDR tool designed to watch for CreateRemoteThread events."
,,DPR0019,"Alter the output of adversary recon commands to not show important assets, such as a file server containing sensitive data.",DTE0036,,,
DOS0116,"There is an opportunity to detect adversary activity that uses obfuscated communication.",,,DTE0028,"DTE0028 - PCAP Collection",,
DOS0010,"There is an opportunity to test hardware additions in an isolated environment and ensure they can't be used by an adversary.",,,DTE0022,"DTE0022 - Isolation",,
,,,,DTE0030,,DUC0111,"A defender can stage a variety of pocket litter files with known hashes around a system. Detections can be put in place if these hashes are seen moving around a system or out of the network."
,,,,DTE0032,,DUC0088,"A defender can secure Kerberos in order to prevent an adversary from leveraging the tickets to authenticate or move laterally. This may result in the adversary exposing additional TTPs."
,,,,DTE0007,,DUC0130,"By looking for anomalies in system service states and alerting on suspect situations, the defender can detect potential malicious activity and triage the system to re-enable the services that have been stopped."
DOS0002,"There is an opportunity to discover who or what is being targeting by an adversary.",,,DTE0013,"DTE0013 - Decoy Diversity",,
,,,,DTE0014,,DUC0003,"A defender seeking to learn about post compromise adversary activity could visit the compromised website with a system in a decoy network that has been designed to sustain an adversary engagement past the initial compromise."
,,,,DTE0028,,DUC0170,"Collecting full packet capture of all network traffic allows you to review what happened over the connection and identify command and control traffic and/or exfiltration activity."
,,,,DTE0036,,DUC0041,"A defender can manipulate commands on system so that an adversary is unable to hide artifacts in ways they normally would."
,,DPR0046,"Introduce intermittent network packet loss on a decoy network to interfere with an adversary's activities.",DTE0026,,,
DOS0198,"There is an opportunity to monitor network traffic for different protocols, anomalous traffic patterns, transfer of data, etc. to determine the presence of an adversary.",,,DTE0027,"DTE0027 - Network Monitoring",,
DOS0141,"There is an opportunity to monitor logs on a system for common ways adversaries behave and detect on that activity.",,,DTE0034,,,
,,,,DTE0032,,DUC0045,"A defender can enforce strong authentication requirements such as password changes, two factor authentication, etc. to impact or disrupt an adversary's activity."
,,DPR0063,"In an adversary engagement situation, if an adversary deletes or alters files on a machine they are controlling, restore the data to it original state and location to see how the adversary reacts.",DTE0005,,,
,,,,DTE0011,,DUC0258,"A defender can expose decoy information about their organization to try and influence an adversary's future activity."
DOS0012,"There is an opportunity to prevent an adversary from using removable media to compromise disconnected or air-gapped systems.",,,DTE0022,,,
,,,,DTE0008,,DUC0093,"A defender can authenticate to a collection of decoy sites (as a decoy user) to give the adversary a set of session cookies to harvest and potentially use during adversary engagement."
,,,,DTE0017,,DUC0009,"A defender can setup a decoy VPN server and see if an adversary attempts to use valid account to authenticate to it."
,,DPR0053,"Stage a USB device with documents on a specific topic in order to see if they are exfiltrated by an adversary.",DTE0030,,,
DOS0027,"There is an opportunity to create a detection with a moderately high probability of success.",,,DTE0033,"DTE0033 - Standard Operating Procedure",,
,,,,DTE0007,,DUC0243,"A defender can look for anomalies in accounts being active with other services/systems during hours they are normally not active. This can indicate malicious activity."
DOS0231,"There is an opportunity to extend an adversary's engagement period by creating a decoy network that systems can discover when performing trust discovery.",,,DTE0014,,,
,,,,DTE0026,,DUC0161,"A defender could implement a protocol aware IPS to limit systems communicating to unknown locations on the internet."
,,,,DTE0032,,DUC0094,"In an adversary engagement operation, a defender can intentionally increase the time window that a token is valid to see if the adversary is able to acquire and leverage the token."
DOS0182,"There is an opportunity to present decoy processes to an adversary to influence their behaviors, test their interest, or add legitimacy to a system or environment.",,,DTE0016,"DTE0016 - Decoy Process",,
,,,,DTE0016,,DUC0255,"A defender can deploy a diverse set of decoy systems to impact an adversary's level of effort during recon activity."
,,DPR0066,"Run all user applications in isolated containers to prevent a compromise from expanding beyond the container's boundaries.",DTE0022,,,
,,,,DTE0029,,DUC0023,"A defender can connect one or more peripheral devices to a decoy system to see if an adversary has any interest in them."
,,,,DTE0022,,DUC0014,"A defender can setup protections so removeable media cannot be mounted until an isolated review process has cleared the drive."
,,,,DTE0036,,DUC0181,"A defender can modify commands such that the true list of running processes is not revealed, hiding necessary active defense processes from the adversary."
,,,,DTE0013,,DUC0191,"A defender can make a variety of decoy network shares available to an adversary and see if the adversary seems to be drawn to shares with specific names, permissions, etc."
DOS0028,"There is an opportunity for the defender to observe the adversary and control what they can see, what effects they can have, and/or what data they can access.",,,DTE0003,"DTE0003 - API Monitoring",,
DOS0118,"There is an opportunity to test what an adversary might do if destroyed data is selectively replaced by the defender.",,,DTE0005,,,
,,,,DTE0011,,DUC0207,"A defender can use decoy content to give the false impression about the system when an adversary performs system information discovery."
,,,,DTE0018,,DUC0040,"A defender can execute adversary malware on a decoy system and examine its behaviors or potentially engage with the adversary to obtain further intelligence."
DOS0091,"Users trained and encouraged to report unsolicited application authorization requests can detect attacks that other defenses do not.",,,DTE0035,,,
,,,,DTE0007,,DUC0212,"A defender can detect the use of non-standard protocols. By implementing behavior analytics specific to a rise in protocol traffic to a system or set of systems, one might be able to detect malicious communications from an adversary."
,,,,DTE0013,,DUC0078,"A defender can add decoy systems to the network so an adversary can have a variety of network services available to them. The defender can observe which network services the adversary attempts to use."
DOS0146,"In an adversary engagement scenario, there is an opportunity to implement security controls to support your defensive objectives over a prolonged engagement.",,,DTE0032,,,
,,DPR0018,"Alter the output of an adversary's profiling commands to make newly-built systems look like the operating system was installed months earlier.",DTE0036,,,
DOS0028,"There is an opportunity for the defender to observe the adversary and control what they can see, what effects they can have, and/or what data they can access.",,,DTE0034,,,
,,,,DTE0035,,DUC0018,"A program to train and exercise the anti-phishing skills of users can create ""Human Sensors"" that help detect phishing attacks."
,,,,DTE0005,,DUC0118,"A defender can ensure data is backed up on a regular basis and backups are stored offline from the system. If an adversary is detected destroying or altering data, the defender could selectively restore data from backup to see how the adversary reacts."
DOS0131,"There is an opportunity to detect the presence of an adversary by identifying and alerting on anomalous behaviors.",,,DTE0007,"DTE0007 - Behavioral Analytics",,
DOS0001,"There is an opportunity to study the adversary and collect first-hand observations about them and their tools.",,,DTE0018,"DTE0018 - Detonate Malware",,
,,,,DTE0011,,DUC0103,"A defender can insert into a system's clipboard decoy content for the adversary to find."
,,,,DTE0012,,DUC0084,"A defender can plant decoy credentials across an array of locations to increase the chances of an adversary finding and using them."
DOS0004,"There is an opportunity to introduce user accounts that are used to make a system look more realistic.",,,DTE0010,,,
,,,,DTE0026,,DUC0174,"A defender can prevent or enable use of alternate protocols for exfiltration by blocking/unblocking unnecessary ports and protocols."
,,,,DTE0007,,DUC0240,"Defenders can detect adversaries attempting to open a port by analyzing incoming network connections. By looking for anomalies in what network traffic comes in, as well as patterns that might indicate intentional sequences, one can potentially identify malicious traffic. One can also look at anomalies in services suddenly listening on ports that were not being used before."
,,DPR0021,"Create a user that has a valid email account. Use this account in such a way that the email address could be harvested by the adversary. This can be monitored to see if it is used in future attacks.",DTE0010,,,
,,,,DTE0011,,DUC0208,"A defender could seed decoy network shares within an adversary engagement network to see if an adversary uses them for payload delivery or lateral movement."
,,,,DTE0017,,DUC0200,"A defender could implement a decoy system to study how and when an adversary obfuscate files and hides information."
,,,,DTE0017,,DUC0078,"A defender can add decoy systems to the network so an adversary can have a variety of network services available to them. The defender can observe which network services the adversary attempts to use."
DOS0137,"There is an opportunity to implement security controls which will prevent an adversary from using Windows Management Instrumentation (WMI), in order to entice them to reveal new TTPs.",,,DTE0032,,,
,,,,DTE0036,,DUC0125,"A defender can modify the functionality of commands that are used to delete files or format drives so they fail when used in a specific manner."
DOS0005,"There is an opportunity to deploy a tripwire that triggers an alert when an adversary touches a network resource or uses a specific technique.",,,DTE0012,"DTE0012 - Decoy Credentials",,
,,,,DTE0013,,DUC0002,"A defender could use a decoy or set of decoys with different network addresses, operating systems, web browsers, language settings, and etc. to determine if every system that visits a compromised website receives its malicious payload or only specific systems receive it."
,,DPR0030,"Create a persona that represents an employee's projects and job scope. This persona information can be leveraged in conjunction with Burn-In and Pocket Litter.",DTE0015,,,
DOS0019,"A phishing email can be detected and moved from the intended recipient to a decoy account for reading and execution.",,,DTE0023,,,
,,,,DTE0026,,DUC0153,"A defender can identify and block specific adversary Command and Control (C2) traffic to see how an adversary responds, possibly exposing additional C2 information."
,,,,DTE0032,,DUC0066,"In an adversary engagement scenario, a defender can implement weak security controls that an adversary could subvert in order to further their attack."
DOS0029,"There is an opportunity to block an adversary's intended action and force them to reveal additional TTPs.",,,DTE0036,,,
,,,,DTE0004,"DTE0004 - Application Diversity",DUC0035,"A defender can install one or more applications on a decoy system with a variety of patch levels to see how an adversary might exploit those applications."
DOS0003,"There is an opportunity to use a compromised drive-by site to start long term engagement with the adversary and observe the adversary's post-exploit TTPs.",,,DTE0014,"DTE0014 - Decoy Network",,
DOS0124,"There is an opportunity to disrupt an adversary's defacement activity by quickly restoring altered content.",,,DTE0005,,,
DOS0082,"There is an opportunity to introduce data to an adversary to influence their future behaviors.",,,DTE0015,,,
,,,,DTE0015,,DUC0259,"A defender can use a decoy persona to engage with online communities or to purchase/download information about their organization and review for exposure."
,,,,DTE0001,"DTE0001 - Admin Access",DUC0025,"A defender can enable Admin Access on a system to see if the adversary utilizes that access to create scheduled tasks to launch their malware or tools."
DOS0084,"In order to prolong an adversary engagement operation or enable detections, there is an opportunity to introduce credentials to an adversary that you want them to collect and use.",,,DTE0012,,,
DOS0169,"There is an opportunity to deploy virtual decoy systems and see if an adversary discovers or reacts to the virtualization.",,,DTE0017,,,
,,,,DTE0034,,DUC0043,"A defender can implement monitoring to alert if a user account is altered outside normal business hours, from remote locations, etc."
,,DPR0005,"Trace activity through WinSock TCP API functions to view potentially malicious network events. Log it such that it can be pushed to a centralized location and analyzed further.",DTE0003,"DTE0003 - API Monitoring",,
,,,,DTE0015,,DUC0019,"A defender can seed information about the decoy persona's personal accounts on systems to see if the adversary collects and uses that information in future activity."
,,DPR0037,"Remove the microphone from a laptop to prevent an adversary from capturing audio from the device.",DTE0020,,,
DOS0081,"There is an opportunity to entice the adversary to expose additional TTPs.",,,DTE0025,,,
,,,,DTE0030,,DUC0098,"A defender can stage a variety of pocket litter files on an attached storage space. This data may include topics that align to a persona, topics an adversary is interested in, etc."
DOS0001,"There is an opportunity to study the adversary and collect first-hand observations about them and their tools.",,,DTE0010,"DTE0010 - Decoy Account",,
DOS0082,"There is an opportunity to introduce data to an adversary to influence their future behaviors.",,,DTE0011,,,
,,,,DTE0014,,DUC0020,"A defender can install any suspect hardware or software on an isolated system or network and monitor for non-standard behaviors."
DOS0016,"There is an opportunity to use security controls to stop or allow an adversary's activity.",,,DTE0032,,,
,,,,DTE0008,,DUC0006,"A defender can prepare a Decoy System by logging in to the Decoy Account and using it in ways consistent with the deception story, creating artifacts in the system that make it look legitimate."
,,DPR0043,"Deploy a mix of network devices (systems, servers, printers, phones, etc.) to make a decoy network look realistic.",DTE0025,,,
,,,,DTE0034,,DUC0052,"A defender can collect system process information and look for abnormal activity tied to Office processes."
,,,,DTE0034,,DUC0120,"A defender can use process monitoring to look for the execution of utilities commonly used for data destruction, such as SDelete."
,,,,DTE0008,,DUC0112,"A defender can perform web browsing tasks on a decoy system over time to give the adversary a robust set of browser data that looks realistic and could potentially be used during adversary engagement."
DOS0001,"There is an opportunity to study the adversary and collect first-hand observations about them and their tools.",,,DTE0001,"DTE0001 - Admin Access",,
,,DPR0050,"Introduce external devices (e.g. a USB drive) to a machine in an adversary engagement scenario to see how quickly an adversary gains awareness to its presence and if they attempt to leverage the device.",DTE0029,,,
,,,,DTE0032,,DUC0049,"A defender can choose to harden or weaken security controls on a system to affect an adversaries ability to modify or create system processes."
,,,,DTE0007,,DUC0131,"The defender can use behavioral analytics detect an XSL process doing something abnormal."
DOS0199,"In an adversary engagement scenario, there is an opportunity to introduce decoy systems that can influence an adversary's behavior or allow you to observe how they perform a specific task.",,,DTE0017,,,
,,,,DTE0013,,DUC0008,"A defender can use a diverse set of decoy systems to study an adversary and determine which types of public-facing applications they choose to exploit."
,,,,DTE0022,,DUC0160,"A defender can isolate unknown processes that are being used for command and control and prevent them from being able to access the internet."
,,DPR0028,"Use a segregated network to visit a compromised site. If the machine becomes infected, allow the machine to remain on with internet access to see if an adversary engages and takes action on the system.",DTE0014,,,
,,,,DTE0031,,DUC0248,"Defenders can reverse engineer malware and develop protocol decoders that can decrypt and expose adversary communications"
,,,,DTE0007,,DUC0221,"A defender can look for anomalies in how commands are being executed on a system. This can expose potentially malicious activity."
,,DPR0014,"Use behavioral analytics to identify a system running development tools, but is not used by someone who does development.",DTE0007,,,
,,DPR0027,"Create an isolated network populated with decoy systems that can be used to study an adversary's tactics, techniques, and procedures (TTPs).",DTE0014,,,
DOS0253,"There is an opportunity to introduce decoy information, users, systems, etc. to influence an adversary's future actions.",,,DTE0017,,,
DOS0024,"There is an opportunity to determine adversary capabilities or preferences by controlling aspects of the engagement environment.",,,DTE0023,,,
,,DPR0001,,DTE0001,"DTE0001 - Admin Access",,
,,,,DTE0030,,DUC0226,"A defender can seed content interesting files to an adversary, but lock the permissions down. The goal would be to force the adversary to expose their TTPs for circumventing the restrictions."
DOS0015,"There is an opportunity to use tools and controls to stop an adversary's activity.",,,DTE0031,"DTE0031 - Protocol Decoder",,
