DOS,DOSDescription,DPR,DPRDescription,DTE,DTEDescription,DUC,DUCDescription
,,,,DTE0001,"DTE0001 - Admin Access",DUC0042,"A defender can allow Admin access on a decoy system or network to allow an adversary to use event triggered execution."
,,,,DTE0011,,DUC0074,"A defender can create breadcrumbs or honeytokens to lure the attackers toward the decoy systems or network services."
,,,,DTE0011,,DUC0260,"A defender can insert decoy content into external sources or resources that adversaries may leverage for intelligence gathering."
,,,,DTE0011,,DUC0261,"A defender can deploy a decoy website to support a deception operation or piece of the organization's deception strategy."
DOS0251,"There is an opportunity to introduce services in a decoy network to determine if an adversary notices and tries to learn more about them.",,,DTE0014,,,
,,,,DTE0017,,DUC0169,"A defender can deploy a virtual decoy system to see if the adversary recognizes the virtualization and reacts."
,,,,DTE0011,,DUC0257,"A defender can seed decoy content into network service configuration files which may be consumed during an adversary's recon activity."
,,DPR0006,"Hook the Win32 DeleteFile() function to log all attempts at deleting a given file. This information can be used to trigger restoration attempts on critical data, reducing potential disruption if those files are unavailable for prolonged periods of time.",DTE0003,"DTE0003 - API Monitoring",ID,Description
,,,,DTE0028,,DUC0116,"A defender can capture network traffic for a compromised system and look for abnormal network traffic that may signal data obfuscation."
DOS0133,"In an adversary engagement scenario, there is an opportunity to observe how an adversary might manipulate data on a system.",,,DTE0011,,,
,,,,DTE0034,,DUC0238,"A defender could monitor logs off-system in order to detect adversary activities even when logs have been deleted on the system."
,,DPR0061,"Train users to immediately report suspicious emails. Those emails could then be used for malware detonation or adversary engagement purposes.",DTE0035,,,
,,,,DTE0032,,DUC0127,"A defender can configure systems to block any system with a number of authentication failures in a certain window of time."
DOS0027,"There is an opportunity to create a detection with a moderately high probability of success.",,,DTE0034,,,
,,,,DTE0034,,DUC0021,"Defenders can monitor trusted partner access, detecting unauthorized activity."
,,DPR0040,"Unplug an infected system from the network and disable any other means of communication.",DTE0022,,,
,,DPR0041,"When malware is received via spearphishing, move the email message onto a decoy system prior to detonating the malicious file attachment.",DTE0023,,,
,,,,DTE0033,,DUC0254,"A defender can define operating procedures for interacting with cloud services and alert when they are not followed."
,,,,DTE0034,,DUC0128,"A defender can collect system activity and detect commands that interact with firmware. This can speed up the recovery of a system."
DOS0112,"In an adversary engagement scenario, there is an opportunity to prepare a user's browser data (sessions, cookies, etc.) so it looks authentic and fully populated.",,,DTE0008,,,
DOS0187,"In an adversary engagement operation, there is an opportunity to present decoy accounts to the adversary during the enumeration process.",,,DTE0010,,,
,,DPR0032,"Use an isolated system to visit a suspected compromised website. Collect any associated scripting code or files dropped onto the system.",DTE0017,,,
,,DPR0035,"Detonate a malware sample in a decoy network to engage with an adversary and study their TTPs.",DTE0018,,,
,,DPR0054,"Create and apply a decoder which allows you to view encrypted and/or encoded network traffic in a human-readable format.",DTE0031,,,
,,,,DTE0032,,DUC0179,"A defender can prevent an adversary from enabling Wi-Fi or Bluetooth interfaces which could be connected to surrounding access points or devices and used for exfiltration."
,,,,DTE0003,"DTE0003 - API Monitoring",DUC0031,"A defender can monitor and analyze operating system functions calls for detection and alerting."
,,,,DTE0036,,DUC0194,"A defender could manipulate the command to display services an adversary would expect to see on a system, or to shown them unexpected services."
,,DPR0007,"Use a mix of vulnerable and nonvulnerable software on a system to allow you to see what exploits the adversary leverages in their attacks.",DTE0004,"DTE0004 - Application Diversity",,
,,,,DTE0012,,DUC0151,"A defender can use adversary attempts at forced authentication exploits to seed adversary servers with decoy credentials."
,,DPR0029,"Create a persona that represents an employee with hobbies, outside interests, personal accounts, etc. This persona may be used in conjunction with decoy accounts and credentials.",DTE0015,,,
,,,,DTE0034,,DUC0063,"A defender could monitor for known commands used to hide artifacts on a system and for activity associated with those hidden artifacts."
DOS0122,"There is an opportunity to test what an adversary might do if encrypted data is selectively replaced by the defender.",,,DTE0005,,,
,,,,DTE0007,,DUC0213,"A defender can detect the use of external web services for communication relay. By implementing behavior analytics anomalies in what domains a system is communicating with, how frequently, and at what times, a defender can potentially identify malicious traffic."
,,,,DTE0007,,DUC0217,"A defender can implement behavior analytics which would indicate activity on a system executing commands in non-standard ways. This could indicate malicious activity."
,,,,DTE0018,,DUC0037,"A defender can detonate malicious code leveraging a signed binary on a decoy system or within a decoy network to see how it behaves or for adversary engagement purposes."
,,,,DTE0032,,DUC0143,"A defender can use Trusted Platform Module technology and a secure boot process to prevent system integrity from being compromised."
,,,,DTE0010,,DUC0187,"During an adversary engagement operation, a defender can utilize decoy accounts to provide content to an adversary and encourage additional activity."
,,,,DTE0011,,DUC0190,"A defender can utilize decoy network shares to provide content that could be used by the adversary."
,,,,DTE0021,,DUC0245,"A defender can use information about how an identified dynamic resolution works to hunt for previously undetected adversary resolutions that work in the same manner."
DOS0246,"An adversary may attempt to dynamically determine the C2 address to communicate with. This gives a defender an opportunity to discover additional infrastructure.",,,DTE0026,,,
,,,,DTE0007,,DUC0239,"Defenders can detect adversaries attempting to exfiltrate to a cloud account. This can detect a system connecting to these cloud providers that it might not normally connect to, not using an account that it normally does, or during a time when it normally doesn't do so."
,,,,DTE0021,,DUC0259,"A defender can use a decoy persona to engage with online communities or to purchase/download information about their organization and review for exposure."
,,,,DTE0035,,DUC0236,"A program to train users to report emails that they did not send but appear in their sent folder."
,,,,DTE0011,,DUC0234,"A defender can plant files, registry entries, software, processes, etc. to make a system look like a VM when it is not."
,,DPR0024,"Create user credentials for a decoy account, such as 'User ABC'. Store those credentials in the browser and other places on the system to see if an adversary attempts to harvest them.",DTE0012,,,
DOS0249,"There is an opportunity to reveal data that the adversary has tried to protect from defenders",,,DTE0031,,,
DOS0005,"There is an opportunity to deploy a tripwire that triggers an alert when an adversary touches a network resource or uses a specific technique.",,,DTE0034,,,
,,,,DTE0011,,DUC0082,"A defender can feed decoy data to an adversary that is using a key-logger or other tool, so as to shape the encounter."
,,,,DTE0036,,DUC0189,"If the defender knows the specific regions an adversary is targeting, they can alter the output of commands which return systems times to return data consistent with what an adversary would want to see."
,,,,DTE0004,"DTE0004 - Application Diversity",DUC0219,"A defender can stand up decoy systems or processes using a wide array of applications. These applications can be hardened to test an adversary's capabilities, or easily exploited to entice an adversary to move in that direction."
DOS0069,"There is an opportunity to utilize known good copies of registry information and restore it if an adversary makes any changes.",,,DTE0006,,,
,,DPR0048,"Capture all network device (router, switches, proxy, etc.) logs on a decoy network and send those logs to a central collection location.",DTE0027,,,
,,,,DTE0030,,DUC0099,"A defender can stage a variety of pocket litter files in order to determine if an adversary is interested in specific file types, subjects, etc."
,,DPR0004,"Hook the Win32 NetUserChangePassword() and modify it such that the new password is different from the one provided. The data passed into the function is encrypted along with the modified new password, then logged so a defender can get alerted about the change as well as decrypt the new password for use.",DTE0036,,,
,,DPR0008,"Install Anti-virus or other end-point detection tools on systems to see if an adversary takes note of them and if so, how they react.",DTE0004,"DTE0004 - Application Diversity",,
,,DPR0009,"Backup data on public facing websites and retain the files offline. In the event of data damage or loss, restore the data from backup.",DTE0005,,,
,,,,DTE0007,,DUC0237,"A defender can detect adversaries leveraging unused cloud regions. By implementing behavioral analytics for cloud hosts interacting with the network from regions that are not normal, one can detect potential malicious activity."
,,,,DTE0011,,DUC0114,"A defender can introduce video content designed to make the adversary believe that their capture efforts are working."
,,,,DTE0011,,DUC0133,"A defender can deploy decoy content to see if an adversary attempts to manipulate data on the system or connected storage devices."
,,,,DTE0001,"DTE0001 - Admin Access",DUC0055,"A defender can configure system users to not have admin access in order to ensure privilege escalation requires exploitation."
DOS0024,"There is an opportunity to determine adversary capabilities or preferences by controlling aspects of the engagement environment.",,,DTE0032,,,
,,,,DTE0032,,DUC0138,"A defender can harden accounts which have admin access and also restrict any users from being able to connect remotely using WMI."
,,,,DTE0036,,DUC0192,"A defender can use API calls associated with direct volume access to either see what activity and data is being passed through, or to influence how that API call functions."
,,,,DTE0026,,DUC0164,"A defender could block traffic to known anonymity networks and C2 infrastructure through the use of network allow and block lists."
,,DPR0023,"Seed a file system with content that is of no value to the company but reinforces the legitimacy of the system if viewed by an adversary.",DTE0011,,,
DOS0001,"There is an opportunity to study the adversary and collect first-hand observations about them and their tools.",,,DTE0004,"DTE0004 - Application Diversity",,
DOS0051,"There is an opportunity to utilize confirmed good copies of login scripts and restoring on a frequent basis to prevent an adversary from using them to launch malware on a recurring basis.",,,DTE0006,,,
DOS0028,"There is an opportunity for the defender to observe the adversary and control what they can see, what effects they can have, and/or what data they can access.",,,DTE0011,"DTE0011 - Decoy Content",,
,,,,DTE0017,,DUC0034,"A defender can use a decoy system to see if an adversary exploits vulnerable software in order to compromise the system."
,,,,DTE0017,,DUC0134,"A defender can deploy a decoy system to see if an adversary attempts to shutdown or reboot the device."
,,,,DTE0023,,DUC0013,"A defender can connect a suspect removeable media device to a decoy system and see what happens when autorun is enabled."
,,,,DTE0007,,DUC0220,"A defender can look for known files in non-standard locations or files that are creating anomalous processes or connections."
DOS0002,"There is an opportunity to discover who or what is being targeting by an adversary.",,,DTE0015,"DTE0015 - Decoy Persona",,
,,,,DTE0034,,DUC0033,"A defender can detect the presence of an adversary by monitoring for processes that are created by commands and/or scripts they execute on a system."
,,,,DTE0014,,DUC0231,"A defender can create a decoy network that contains systems which are easily discoverable and appealing to an adversary."
,,,,DTE0017,,DUC0225,"A defender can have decoy systems that are easy to gain access to and have Office installed. The decoy system can be monitored to see if an adversary attempts to inject anything malicious into Office templates."
,,,,DTE0011,,DUC0076,"A defender can create entries in a decoy system's ARP cache, hosts file, etc. to add to the legitimacy of the device."
DOS0095,"There is an opportunity to detect an adversary's activity if they are unable to follow a company's documented standard operating procedures.",,,DTE0033,,,
DOS0026,"In an adversary engagement operation, there is an opportunity to impact what an adversary sees when they execute commands on a system.",,,DTE0036,"DTE0036 - Software Manipulation",,
,,,,DTE0004,"DTE0004 - Application Diversity",DUC0085,"A defender can use a variety of applications on a decoy system or in a decoy network to see what an adversary tries to exploit in order to acquire credentials."
,,,,DTE0017,,DUC0223,"A defender can install remote access tools on decoy systems across the network to see if the adversary uses these tools for command and control."
,,,,DTE0022,,DUC0010,"A defender can install any suspect hardware on an isolated system and monitor for non-standard behaviors."
DOS0013,"There is an opportunity to study removable media to see if it's infected and what happens when it is plugged into a decoy system or network.",,,DTE0023,"DTE0023 - Migrate Attack Vector",,
,,DPR0059,"Ensure that systems capture and retain common system level activity artifacts that might be produced.",DTE0034,,,
,,,,DTE0036,,DUC0186,"A defender could alter the output from account enumeration commands to hide accounts or show the presence of accounts which do not exist."
,,DPR0034,"Take malware received via spearphishing and detonate it on an isolated system in order to collect execution and network communication artifacts.",DTE0018,,,
DOS0085,"In an adversary engagement scenario, there is an opportunity to use a variety of applications on a system to see what an adversary tries to exploit in order to acquire credentials.",,,DTE0004,"DTE0004 - Application Diversity",,
DOS0002,"There is an opportunity to discover who or what is being targeting by an adversary.",,,DTE0021,"DTE0021 - Hunting",,
DOS0130,"There is an opportunity to alter the network configuration in order to disrupt an adversary who is trying to saturate the network or a system via denial of service.",,,DTE0026,"DTE0026 - Network Manipulation",,
,,,,DTE0026,,DUC0126,"A defender can configure network devices to analyze network traffic, detect a potential DoS attack, and make appropriate adjustments to mitigate the situation."
,,,,DTE0036,,DUC0030,"A defender can modify system calls to break communications, route things to decoy systems, prevent full execution, etc."
DOS0093,"There is an opportunity to seed systems with decoy cookies that will lead adversaries to decoy targets.",,,DTE0008,,,
DOS0245,"If you can determine how an adversary is dynamically resolving command and control (C2) addresses, there is an opportunity to use that information to identify additional adversary infrastructure or tools.",,,DTE0021,,,
,,,,DTE0036,,DUC0029,"A defender can modify the functionality of commands used to delete files so that the files are copied to a safe location before they are deleted."
,,DPR0003,"Hook the Win32 Sleep() function so that it always performs a Sleep(1) instead of the intended duration. This can increase the speed at which dynamic analysis can be performed when a normal malicious file sleeps for long periods before attempting additional capabilities.",DTE0036,,,
,,,,DTE0001,"DTE0001 - Admin Access",DUC0232,"A defender can restrict admin access to force an adversary to escalate privileges in order to delete logs and captured artifacts from a system."
DOS0058,"Although adversaries may attempt to delete or change important artifacts, there may be a window of time to retrieve them before that happens.",,,DTE0005,"DTE0005 - Backup and Recovery",,
,,,,DTE0023,,DUC0211,"A defender who intercepts removable media being used by an adversary for relaying commands can plug the removal media into a decoy system or network to watch what commands are being relayed and what the adversary continues to do."
DOS0024,"There is an opportunity to determine adversary capabilities or preferences by controlling aspects of the engagement environment.",,,DTE0029,,,
DOS0131,"There is an opportunity to detect the presence of an adversary by identifying and alerting on anomalous behaviors.",,,DTE0035,,,
,,,,DTE0011,,DUC0073,"A defender can create decoy registry objects and monitor access to them using Windows Registry Auditing."
,,,,DTE0010,,DUC0004,"A defender can create decoy user accounts which are used to make a decoy system or network look more realistic."
,,,,DTE0029,,DUC0211,"A defender who intercepts removable media being used by an adversary for relaying commands can plug the removal media into a decoy system or network to watch what commands are being relayed and what the adversary continues to do."
,,,,DTE0035,,DUC0091,"A program to train users on how to recognize and report third-party applications requesting authorization can create ""Human Sensors"" that help detect application token theft."
,,DPR0015,"Use behavioral analytics to identify abnormal system processes being used to launch a different process.",DTE0007,,,
,,,,DTE0017,,DUC0026,"A defender can configure a decoy system with limited restrictions to see if the adversary creates or alters scheduled tasks to launch their malware."
DOS0115,"There is an opportunity to alter the system to prevent an adversary from capturing video content.",,,DTE0020,,,
,,,,DTE0016,,DUC0182,"A defender can run decoy processes on a system to entice an adversary."
,,DPR0038,"Remove the Wi-Fi hardware from a device to prevent an adversary from enabling and using a Wi-Fi connection.",DTE0020,,,
DOS0252,"There is an opportunity to gain visibility into newly created or previously unknown adversary infrastructure",,,DTE0021,,,
,,DPR0051,"Configure controls (such as AutoRun) which would require an adversary to take additional steps when leveraging a peripheral device to execute their tools.",DTE0029,,,
DOS0015,"There is an opportunity to use tools and controls to stop an adversary's activity.",,,DTE0006,"DTE0006 - Baseline",,
,,,,DTE0031,,DUC0249,"Defenders can develop protocol decoders that can decrypt network capture data and expose an adversary's command and control traffic as well as their exfiltration activity."
,,,,DTE0036,,DUC0028,"A defender can manipulate the output of system commands issued to alter information the adversary might use during their activity."
,,,,DTE0005,,DUC0058,"A defender can backup system information on a regular basis and send it to an alternate location for storage."
,,DPR0016,"Configure a decoy system and allow it to be used in an manner such that it collects activity logs and appears to be to be a legitimate system.",DTE0008,,,
,,DPR0026,"Deploy multiple decoy systems, each with a unique network fingerprint (ports, services, connections, etc.) in order to provide an adversary a wide range of targets.",DTE0013,,,
DOS0029,"There is an opportunity to block an adversary's intended action and force them to reveal additional TTPs.",,,DTE0001,"DTE0001 - Admin Access",,
,,DPR0064,"Modify the contents of an email message to maintain continuity when it is used for adversary engagement purposes.",DTE0019,,,
,,DPR0045,"Add a kill switch to a decoy network that can be used to shutdown all network communication if an adversary takes an action that is out of the desired scope.",DTE0026,,,
,,,,DTE0033,,DUC0047,"A defender can detect user accounts created outside the acceptable process."
,,,,DTE0033,,DUC0095,"A defender can implement a standard operating procedure which restricts users from using 2FA or MFA more than once without another process being invoked."
,,,,DTE0017,,DUC0199,"A defender could implement a decoy system running a remote service (such as telnet, SSH, and VNC) and see if the adversary attempts to login to the service."
,,,,DTE0032,,DUC0048,"A defender can block execution of untrusted software."
,,,,DTE0011,,DUC0184,"A defender can utilize decoy files and directories to provide content that could be used by the adversary."
,,,,DTE0017,,DUC0097,"A defender can deploy a decoy software deployment tool within an adversary engagement environment to see how the adversary attempts to use the device during their activity."
,,DPR0036,"Modify the destination of inbound email to facilitate the collection of inbound spearphishing messages.",DTE0019,,,
,,,,DTE0026,,DUC0158,"A defender can block certain adversary used protocols used between systems in order to prevent lateral tool transfer."
,,,,DTE0030,,DUC0165,"A defender can stage a variety of pocket litter files to bolster the legitimacy of the local system."
,,,,DTE0026,,DUC0246,"A defender can block primary C2 domains and IPs to determine if the malware or adversary has the ability to reach out to additional infrastructure."
,,,,DTE0034,,DUC0011,"A defender can monitor systems for the use of removeable media."
,,,,DTE0034,,DUC0065,"A defender could monitor for directory service changes using Windows event logs. This can alert to the presence of an adversary in the network."
,,,,DTE0036,,DUC0203,"A defender can impact an adversary's activity by manipulating or replacing the commands commonly used to display users on a system."
,,,,DTE0021,,DUC0252,"A defender could use information about an adversary's TTPs in order to monitor for new adversary infrastructure and files."
,,,,DTE0026,,DUC0152,"A defender could allow or deny outbound SMB requests from a network to affect the success of forced authentication. Alternative a defender could redirect outbound SMB requests to a decoy system to thwart attempted credential theft"
,,,,DTE0036,,DUC0242,"A defender might alter APIs to expose data that is being archived, encoded, and/or encrypted. This can also be used to corrupt the action so the data isn't usable."
,,,,DTE0014,,DUC0232,"A defender can restrict admin access to force an adversary to escalate privileges in order to delete logs and captured artifacts from a system."
DOS0140,"There is an opportunity to use security controls on systems in order to affect the success of an adversary.",,,DTE0032,,,
,,,,DTE0001,"DTE0001 - Admin Access",DUC0137,"A defender can remove admin access from the local user to prevent an adversary from being able to utilize WMI."
,,,,DTE0006,,DUC0051,"A defender can revert a system to a verified baseline a frequent, recurring basis in order to remove adversary persistence mechanisms."
,,,,DTE0016,,DUC0080,"The defender can run processes on legitimate systems that create network artifacts for an adversary to collect. These artifacts may contain data such as credentials, hostnames, etc., that would lead an adversary to target decoy systems and networks."
,,,,DTE0007,,DUC0218,"A defender can implement behavioral analytics which would indicate activity on or against a domain controller. Activity which is out of sync with scheduled domain tasks, or results in an uptick in traffic with a particular system on the network could indicate malicious activity."
,,DPR0013,"Use behavioral analytics to detect Living Off The Land Binaries (LOLBins) being used to download and execute a file.",DTE0007,,,
,,,,DTE0034,,DUC0072,"A defender can monitor for user login activity that may reveal an adversary leveraging brute force techniques."
,,DPR0012,"Maintain a verified list of group policies enforced on a system and use that copy if an adversary attempts to deviate from the baseline.",DTE0006,,,
,,DPR0049,"Collect PCAP on a decoy network to improve visibility into an adversary's network activity.",DTE0028,,,
,,,,DTE0032,,DUC0142,"A defender could use a host-based tool in order to have an effect on the success of an adversary abusing elevation control mechanisms."
,,DPR0057,"Require approvals and waivers for users to make changes to their system which requires administrative access. Any changes not made through this process are suspect and immediately investigated as malicious activity.",DTE0033,,,
,,,,DTE0007,,DUC0129,"By looking for anomalies in host resource consumption and alerting on suspect activity, the defender can detect the use of system resources at odd times or at odd levels."
,,DPR0025,"Use a Windows Virtual Machine (VM) and a Mac VM to visit a malicious website and note any differences in how the site functions based on the client that was used.",DTE0013,,,
DOS0164,"There is an opportunity to block an adversary that is seeking to use a proxied connection.",,,DTE0026,,,
DOS0165,"In an adversary engagement scenario, there is an opportunity to add legitimacy by ensuring the local system is with fully populated with content.",,,DTE0030,,,
