"solution_name","solution_folder","solution_github_url","solution_publisher_id","solution_offer_id","solution_first_publish_date","solution_last_publish_date","solution_version","solution_support_name","solution_support_tier","solution_support_link","solution_author_name","solution_categories","solution_readme_file","solution_logo_url","solution_description","solution_dependencies","has_connectors","is_deprecated","deprecation_date","is_published","marketplace_url","mp_is_published","mp_url","mp_display_name","mp_summary","mp_long_summary","mp_publisher_display_name","mp_is_preview","mp_is_stop_sell","mp_creation_date","mp_last_modified_date","mp_categories","mp_keywords","mp_popularity","mp_rating_average","mp_rating_count","mp_is_free","mp_is_byol","mp_is_microsoft_product","mp_last_checked"
"CyeraDSPM","CyeraDSPM","https://github.com/Azure/Azure-Sentinel/blob/master/Solutions/CyeraDSPM","cyera1658314682323","azure-sentinel-solution-cyeradspm","2025-10-15","2025-10-29","3.0.0","Cyera Inc","Partner","https://support.cyera.io","Cyera DSPM OCTO Team - support@cyera.io","domains","","https://raw.githubusercontent.com/Azure/Azure-Sentinel/master/Logos/cyera_icon.svg","The [Cyera DSPM](https://api.cyera.io/) data connector allows you to connect to your Cyera's DSPM instance and ingesting Classifications, Assets, Issues, and Identity Definitions into Microsoft Sentinel. The data connector is built on Microsoft Sentinel's Codeless Connector Platform and uses the Cyera's API to fetch Cyera's [DSPM Telemetry](https://www.cyera.com/) once recieced can be correlated with security events creating custom columns so that queries don't need to parse it again, thus resulting in better performance.","","true","false","","false","","false","","","","","","","","","","","","","","","","","","2026-04-02"
"Cyfirma Attack Surface","Cyfirma Attack Surface","https://github.com/Azure/Azure-Sentinel/blob/master/Solutions/Cyfirma%20Attack%20Surface","cyfirmaholdingspteltd1742879329545","azure-sentinel-solution-cyfirma-attack-surface","2025-03-27","","3.0.0","CYFIRMA","Partner","https://www.cyfirma.com/contact-us/","Microsoft","domains","","https://raw.githubusercontent.com/Azure/Azure-Sentinel/master/Logos/Cyfirma_logo.svg","The CYFIRMA Attack Surface solution provides ability to gain continuous visibility into their external digital footprint directly within Microsoft Sentinel. This integration enhances your security posture by identifying exposed assets, misconfigurations, and vulnerabilities across internet-facing infrastructure—enabling faster response to potential threats and reducing the attack surface before adversaries can exploit it. By ingesting enriched attack surface intelligence—covering open ports, vulnerable IPs, cloud misconfigurations, certificate issues, and more—into Microsoft Sentinel, security teams can correlate findings with other threat indicators, automate incident response, and drive proactive defense measures.","","true","false","","true","https://azuremarketplace.microsoft.com/en-us/marketplace/apps/cyfirmaholdingspteltd1742879329545.azure-sentinel-solution-cyfirma-attack-surface","true","https://azuremarketplace.microsoft.com/en-us/marketplace/apps/cyfirmaholdingspteltd1742879329545.azure-sentinel-solution-cyfirma-attack-surface","CYFIRMA Attack Surface","Attack Surface Intelligence provides open ports, cloud weaknesses, vulnerable IPs, and certificates","CYFIRMA Attack Surface Intelligence provides continuous monitoring and risk assessment to identify vulnerabilities, misconfigurations, and exposed assets, enabling organizations to proactively secure their external attack surface.","CYFIRMA","false","false","2025-05-12","2025-12-13","security;identity-and-access-management;threat-protection;azureCertified;fromPublishingPortal;multiResourceSolution;readonlytemplate;virtualMachine;virtualMachine-Arm","CYFIRMA;DeCYFIR;f1de974b-f438-4719-b423-8bf704ba2aef;CYFIRMA Attack Surface","0.097","0.0","0","false","false","true","2026-04-02"
"Cyfirma Brand Intelligence","Cyfirma Brand Intelligence","https://github.com/Azure/Azure-Sentinel/blob/master/Solutions/Cyfirma%20Brand%20Intelligence","cyfirmaholdingspteltd1742879329545","azure-sentinel-solution-cyfirma-brand-intelligence","2025-03-27","","3.0.0","CYFIRMA","Partner","https://www.cyfirma.com/contact-us/","Microsoft","domains","","https://raw.githubusercontent.com/Azure/Azure-Sentinel/master/Logos/Cyfirma_logo.svg","The CYFIRMA Brand Intelligence solution integrates with Microsoft Sentinel to provide real-time insights into brand-related threats such as impersonation, fake domains, malicious social media profiles, and fraudulent mobile apps. This integration enables security teams to monitor and respond to digital brand abuse, protecting customers, employees, and reputation. Enriched intelligence is ingested into Microsoft Sentinel for threat correlation, alerting, and automation—helping organizations detect and mitigate brand threats quickly and efficiently.","","true","false","","true","https://azuremarketplace.microsoft.com/en-us/marketplace/apps/cyfirmaholdingspteltd1742879329545.azure-sentinel-solution-cyfirma-brand-intelligence","true","https://azuremarketplace.microsoft.com/en-us/marketplace/apps/cyfirmaholdingspteltd1742879329545.azure-sentinel-solution-cyfirma-brand-intelligence","CYFIRMA Brand Intelligence","Brand Intelligence provides brand impersonation, fraud, reputation risks across domains.","CYFIRMA Brand Intelligence provides real-time monitoring and threat intelligence to detect and mitigate brand impersonation, infringement, and fraud across domains, social media, and the dark web.","CYFIRMA","false","false","2025-05-13","2025-12-13","security;identity-and-access-management;threat-protection;azureCertified;fromPublishingPortal;multiResourceSolution;readonlytemplate;virtualMachine;virtualMachine-Arm","CYFIRMA;DeCYFIR;f1de974b-f438-4719-b423-8bf704ba2aef;CYFIRMA Brand Intelligence","0.0","0.0","0","false","false","true","2026-04-02"
"Cyfirma Compromised Accounts","Cyfirma Compromised Accounts","https://github.com/Azure/Azure-Sentinel/blob/master/Solutions/Cyfirma%20Compromised%20Accounts","cyfirmaholdingspteltd1742879329545","azure-sentinel-solution-cyfirmacompromisedaccounts","2025-05-15","","3.0.0","CYFIRMA","Partner","https://www.cyfirma.com/contact-us/","Microsoft","domains","","https://raw.githubusercontent.com/Azure/Azure-Sentinel/master/Logos/Cyfirma_logo.svg","The CYFIRMA Compromised Accounts solution integrates with Microsoft Sentinel to provide timely intelligence on user accounts exposed through data breaches, stealer logs, and dark web forums. It helps organizations identify compromised credentials linked to corporate domains, reducing the risk of account takeover and unauthorized access. Enriched account breach data is ingested into Sentinel, enabling security teams to correlate with internal activity, trigger alerts, and automate remediation actions such as password resets and access revocation.","","true","false","","true","https://azuremarketplace.microsoft.com/en-us/marketplace/apps/cyfirmaholdingspteltd1742879329545.azure-sentinel-solution-cyfirmacompromisedaccounts","true","https://azuremarketplace.microsoft.com/en-us/marketplace/apps/cyfirmaholdingspteltd1742879329545.azure-sentinel-solution-cyfirmacompromisedaccounts","CYFIRMA Compromised Accounts","Monitor and respond to leaked credentials with real-time compromised account intelligence.","Get real-time alerts on compromised credentials linked to your organization from breaches, stealer logs, and the dark web—directly in Microsoft Sentinel for rapid response.","CYFIRMA","false","false","2025-06-18","2025-12-13","security;identity-and-access-management;threat-protection;azureCertified;fromPublishingPortal;multiResourceSolution;readonlytemplate;virtualMachine;virtualMachine-Arm","CYFIRMA;DeCYFIR;f1de974b-f438-4719-b423-8bf704ba2aef;CYFIRMA Compromised Accounts","0.462","0.0","0","false","false","true","2026-04-02"
"Cyfirma Cyber Intelligence","Cyfirma Cyber Intelligence","https://github.com/Azure/Azure-Sentinel/blob/master/Solutions/Cyfirma%20Cyber%20Intelligence","cyfirmaholdingspteltd1742879329545","azure-sentinel-solution-cyfirma-cyber-intelligence","2025-05-15","","3.0.0","CYFIRMA","Partner","https://www.cyfirma.com/contact-us/","Microsoft","domains","","https://raw.githubusercontent.com/Azure/Azure-Sentinel/master/Logos/Cyfirma_logo.svg","The CYFIRMA Cyber Intelligence solution integrates with Microsoft Sentinel to provide actionable intelligence on IOCs, threat actors, malicious campaigns, and malware. This integration enables security teams to detect, analyze, and respond to emerging threats by correlating external threat data with internal telemetry. By ingesting enriched threat intelligence into Sentinel, organizations gain visibility into malicious activity, track threat actor tactics, and automate defense mechanisms to mitigate risks proactively.","","true","false","","true","https://azuremarketplace.microsoft.com/en-us/marketplace/apps/cyfirmaholdingspteltd1742879329545.azure-sentinel-solution-cyfirma-cyber-intelligence","true","https://azuremarketplace.microsoft.com/en-us/marketplace/apps/cyfirmaholdingspteltd1742879329545.azure-sentinel-solution-cyfirma-cyber-intelligence","CYFIRMA Cyber Intelligence","Get real-time intel on IoCs, malware, campaigns, and threat actors targeting your organization.","Stay ahead of threats with real-time, contextual intelligence. The Cyfirma Cyber Intelligence Connector for Sentinel delivers insights on IoCs, malware, actors, and campaigns targeting your organization.","CYFIRMA","false","false","2025-06-18","2025-12-13","security;identity-and-access-management;threat-protection;azureCertified;fromPublishingPortal;multiResourceSolution;readonlytemplate;virtualMachine;virtualMachine-Arm","CYFIRMA;DeCYFIR;f1de974b-f438-4719-b423-8bf704ba2aef;CYFIRMA Cyber Intelligence","0.17","0.0","0","false","false","true","2026-04-02"
"Cyfirma Digital Risk","Cyfirma Digital Risk","https://github.com/Azure/Azure-Sentinel/blob/master/Solutions/Cyfirma%20Digital%20Risk","cyfirmaholdingspteltd1742879329545","azure-sentinel-solution-cyfirma-digital-risk","2025-03-27","","3.0.0","CYFIRMA","Partner","https://www.cyfirma.com/contact-us/","Microsoft","domains","","https://raw.githubusercontent.com/Azure/Azure-Sentinel/master/Logos/Cyfirma_logo.svg","The CYFIRMA Digital Risk solution integrates with Microsoft Sentinel to provide real-time intelligence on data exposures across dark web forums, ransomware groups, public sources, and code repositories. It enables organizations to detect leaked credentials, internal documents, source code, and PII/CIIs that could be exploited by threat actors. Enriched intelligence is ingested into Microsoft Sentinel, helping security teams correlate external threats with internal activity, detect compromised accounts, and automate incident response.","","true","false","","true","https://azuremarketplace.microsoft.com/en-us/marketplace/apps/cyfirmaholdingspteltd1742879329545.azure-sentinel-solution-cyfirma-digital-risk","true","https://azuremarketplace.microsoft.com/en-us/marketplace/apps/cyfirmaholdingspteltd1742879329545.azure-sentinel-solution-cyfirma-digital-risk","CYFIRMA Digital Risk","CYFIRMA detects data leaks and stolen credentials, helping prevent misuse and reputational damage.","CYFIRMA Digital Risk Intelligence monitors data breaches, ransomware threats, and dark web activities while detecting leaked credentials, source code, and PII to help organizations prevent data misuse and mitigate cyber risks.","CYFIRMA","false","false","2025-05-13","2025-12-13","security;identity-and-access-management;threat-protection;azureCertified;fromPublishingPortal;multiResourceSolution;readonlytemplate;virtualMachine;virtualMachine-Arm","CYFIRMA;DeCYFIR;f1de974b-f438-4719-b423-8bf704ba2aef;CYFIRMA Digital Risk","0.0","0.0","0","false","false","true","2026-04-02"
"Cyfirma Vulnerabilities Intel","Cyfirma Vulnerabilities Intel","https://github.com/Azure/Azure-Sentinel/blob/master/Solutions/Cyfirma%20Vulnerabilities%20Intel","cyfirmaholdingspteltd1742879329545","azure-sentinel-solution-cyfirma-vulnerabilities","2025-05-15","","3.0.0","CYFIRMA","Partner","https://www.cyfirma.com/contact-us/","Microsoft","domains","","https://raw.githubusercontent.com/Azure/Azure-Sentinel/master/Logos/Cyfirma_logo.svg","The CYFIRMA Vulnerability Intelligence solution integrates with Microsoft Sentinel to deliver real-time intelligence on exposed and vulnerable assets across internet-facing infrastructure. This includes open ports, outdated software, misconfigurations, and exploitable weaknesses linked to known vulnerabilities (CVEs). By ingesting asset-level vulnerability insights into Sentinel, security teams can prioritize remediation based on risk context, correlate exposures with active threat campaigns, and trigger automated responses using analytics rules and playbooks.","","true","false","","true","https://azuremarketplace.microsoft.com/en-us/marketplace/apps/cyfirmaholdingspteltd1742879329545.azure-sentinel-solution-cyfirma-vulnerabilities","true","https://azuremarketplace.microsoft.com/en-us/marketplace/apps/cyfirmaholdingspteltd1742879329545.azure-sentinel-solution-cyfirma-vulnerabilities","CYFIRMA Vulnerabilities Intelligence","Detect and prioritize real threats with enriched, real-time vulnerability intelligence.","Get real-time, contextual CVE intelligence with threat actor links, exploitability scores, and alerts—streamlined directly into Microsoft Sentinel for proactive vulnerability management.","CYFIRMA","false","false","2025-06-18","2025-12-13","security;identity-and-access-management;threat-protection;azureCertified;fromPublishingPortal;multiResourceSolution;readonlytemplate;virtualMachine;virtualMachine-Arm","CYFIRMA;DeCYFIR;f1de974b-f438-4719-b423-8bf704ba2aef;CYFIRMA Vulnerabilities Intelligence","0.0","0.0","0","false","false","true","2026-04-02"
"Cynerio","Cynerio","https://github.com/Azure/Azure-Sentinel/blob/master/Solutions/Cynerio","cynerio1681887657820","cynerio-medical-device-security-sentinel-connector","2023-03-29","2023-03-29","3.0.0","Cynerio","Partner","https://cynerio.com","micha@cynerio.co","domains","","https://raw.githubusercontent.com/Azure/Azure-Sentinel/master/Logos/Cynerio.svg","The [Cynerio](https://www.cynerio.com/) solution for Microsoft Sentinel enables you to ingest Cynerio Security Events to the Microsoft Sentinel platform, providing more insight into your organization network security posture and improving your security operation capabilities.","","true","false","","true","https://azuremarketplace.microsoft.com/en-us/marketplace/apps/cynerio1681887657820.cynerio-medical-device-security-sentinel-connector","true","https://azuremarketplace.microsoft.com/en-us/marketplace/apps/cynerio1681887657820.cynerio-medical-device-security-sentinel-connector","Cynerio Medical Device Security Sentinel Connector","The connector allows you to easily connect your Cynerio Security Events with MS Sentinel ","The Cynerio connector allows you to easily connect your Cynerio Security Events with Microsoft Sentinel, to view IDS Events. This gives you more insight into your organization's network security posture and improves your security ","Cynerio","false","false","2023-04-24","2025-12-13","internet-of-things-azure-apps;iot-security;security;threat-protection;azureCertified;fromPublishingPortal;multiResourceSolution;readonlytemplate;virtualMachine;virtualMachine-Arm;AzureSentinelSolution","IOT;Medical;f1de974b-f438-4719-b423-8bf704ba2aef;Cynerio Medical Device Security Sentinel Connector","0.0","5.0","1","false","false","true","2026-04-02"
"CyrenThreatIntelligence","CyrenThreatIntelligence","https://github.com/Azure/Azure-Sentinel/blob/master/Solutions/CyrenThreatIntelligence","data443riskmitigationinc1761580347231","azure-sentinel-solution-cyren-threat-intel","2025-11-16","","3.0.1","Data443 Risk Mitigation, Inc.","Partner","https://www.data443.com","Data443 Risk Mitigation, Inc. - support@data443.com","domains","Solutions/CyrenThreatIntelligence/README.md","https://raw.githubusercontent.com/Azure/Azure-Sentinel/master/Logos/cyren_logo.svg","The [Cyren Threat Intelligence](https://data443.com/cyren-threat-intelligence/) solution provides the capability to ingest Cyren IP reputation and malware URL threat intelligence into Microsoft Sentinel using the Codeless Connector Framework (CCF). This solution deploys REST API poller connectors, a custom log table, data collection rules, analytics rules, and visualization workbook to help security teams detect and investigate network-based threats.","","true","false","","true","https://azuremarketplace.microsoft.com/en-us/marketplace/apps/data443riskmitigationinc1761580347231.azure-sentinel-solution-cyren-threat-intel","true","https://azuremarketplace.microsoft.com/en-us/marketplace/apps/data443riskmitigationinc1761580347231.azure-sentinel-solution-cyren-threat-intel","Cyren Threat Intelligence for Microsoft Sentinel","Cyren Threat Intelligence solution for Microsoft Sentinel by Data443.","Cyren Threat Intelligence for Microsoft Sentinel provides a CCF-based data connector to ingest Cyren threat intelligence feeds into your Sentinel workspace for enhanced threat detection and analysis.","Data443","false","false","2026-02-09","2026-03-16","threat-protection;security;azureCertified;fromPublishingPortal;multiResourceSolution;readonlytemplate;virtualMachine;virtualMachine-Arm","f1de974b-f438-4719-b423-8bf704ba2aef;Microsoft Sentinel;Cyren, Threat Intelligence, CCF Data Connector;Cyren Threat Intelligence for Microsoft Sentinel","0.0","0.0","0","false","false","true","2026-04-02"
"Cyware","Cyware","https://github.com/Azure/Azure-Sentinel/blob/master/Solutions/Cyware","cywarelabsinc1709256751930","microsoft-sentinel-solution-cyware","2024-03-18","2024-03-18","3.0.0","Cyware","Partner","","Cyware - support@cyware.com","domains","","https://raw.githubusercontent.com/Azure/Azure-Sentinel/master/Logos/cyware-logo.svg","The Cyware solution for Microsoft Sentinel allows users to integrate Cyware and Microsoft Sentinel. Users can send events from Microsoft Sentinel to Cyware for further analysis. This solution also enables users to implement hunting queries that match events that are sent to Microsoft Sentinel from Cyware's Intel Exchange.","","false","false","","true","https://azuremarketplace.microsoft.com/en-us/marketplace/apps/cywarelabsinc1709256751930.microsoft-sentinel-solution-cyware","true","https://azuremarketplace.microsoft.com/en-us/marketplace/apps/cywarelabsinc1709256751930.microsoft-sentinel-solution-cyware","Cyware for Microsoft Sentinel","Cyware solution for Microsoft Sentinel","Leverage the Cyware solution to integrate Microsoft Sentinel directly with Cyware products for streamlined incident response, enhanced threat detection and automated actioning capabilities.","Cyware Labs, Inc.","false","false","2024-07-11","2025-12-13","security;threat-protection;azureCertified;fromPublishingPortal;multiResourceSolution;readonlytemplate;virtualMachine;virtualMachine-Arm;AzureSentinelSolution","cyware;security automation;f1de974b-f438-4719-b423-8bf704ba2aef;Cyware for Microsoft Sentinel","0.0","0.0","0","false","false","true","2026-04-02"
"DEV-0537DetectionandHunting","DEV-0537DetectionandHunting","https://github.com/Azure/Azure-Sentinel/blob/master/Solutions/DEV-0537DetectionandHunting","azuresentinel","azure-sentinel-solution-DEV-0537DetectionandHunting","2022-04-07","","2.0.0","Microsoft Corporation","Microsoft","https://support.microsoft.com","Microsoft - support@microsoft.com","domains","","https://raw.githubusercontent.com/Azure/Azure-Sentinel/master/Logos/Azure_Sentinel.svg","Microsoft Security teams have been actively tracking a large-scale social engineering and extortion campaign against multiple organizations with some seeing evidence of destructive elements. DEV-0537, also known as LAPSUS$ is known for using a pure extortion and destruction model without deploying ransomware payloads. For more technical and mitigation information, please read the [Microsoft Security blog ](https://www.microsoft.com/security/blog/2022/03/22/dev-0537-criminal-actor-targeting-organizations-for-data-exfiltration-and-destruction). As Microsoft continues to track DEV-0537’s tactics and techniques, we are also sharing guidance, detections and hunting queries to help our customers better defend against this threat through our security products.

Note: [Security Threat Essentials ](https://portal.azure.com/#create/azuresentinel.azure-sentinel-solution-securitythreatessentialsolazure-sentinel-solution-securitythreatessentialsol) contains security content that is relevant for DEV-0537, please install the solution to enhance your security posture.","","false","false","","true","","false","","","","","","","","","","","","","","","","","","2026-04-02"
"DNS Essentials","DNS Essentials","https://github.com/Azure/Azure-Sentinel/blob/master/Solutions/DNS%20Essentials","azuresentinel","azure-sentinel-solution-dns-domain","2023-01-14","","3.0.4","Microsoft Corporation","Microsoft","https://support.microsoft.com","Microsoft - support@microsoft.com","domains","","https://raw.githubusercontent.com/Azure/Azure-Sentinel/master/Logos/Azure_Sentinel.svg","This is a [domain solution](https://nam06.safelinks.protection.outlook.com/?url=https%3A%2F%2Fdocs.microsoft.com%2Fazure%2Fsentinel%2Fsentinel-solutions-catalog%23domain-solutions&data=05%7C01%7Ckavishbakshi%40microsoft.com%7Cbe2a496082b24caa4b8c08da9cefacca%7C72f988bf86f141af91ab2d7cd011db47%7C1%7C0%7C637994850502413731%7CUnknown%7CTWFpbGZsb3d8eyJWIjoiMC4wLjAwMDAiLCJQIjoiV2luMzIiLCJBTiI6Ik1haWwiLCJXVCI6Mn0%3D%7C3000%7C%7C%7C&sdata=OJegu%2B2EqD7rmYmK9pm9QniD6YWp5ooloZ6tHzcwVi0%3D&reserved=0) and does not include any data connectors. The content in this solution requires one of the product solutions below, as well as any other connector or data source normalized to the [ASIM](https://aka.ms/AboutASIM).

**Prerequisite :-**

 Install one or more of the listed solutions, or develop your custom ASIM parsers to unlock the value provided by this solution.
 1. Windows Server DNS 
 2. Azure Firewall 
 3. Cisco Umbrella 
 4. Corelight Zeek 
 5. Google Cloud Platform DNS 
 6. Infoblox NIOS 
 7. ISC Bind 
 8. Vectra AI 
 9. Zscaler Internet Access 

**Underlying Microsoft Technologies used:** 

This solution takes a dependency on the following technologies, and some of these dependencies either may be in Preview state or might result in additional ingestion or operational costs: 
 1. Product solutions as described above 
 2. Logic app for data summarization

**Recommendation :-**

It is highly recommended to use the **Summarize Data for DNS Essentials Solution** logic app playbook provided with this solution as it will significantly improve the performance of the Workbook, Analytic rules & Hunting queries.","","false","false","","true","https://azuremarketplace.microsoft.com/en-us/marketplace/apps/azuresentinel.azure-sentinel-solution-dns-domain","true","https://azuremarketplace.microsoft.com/en-us/marketplace/apps/azuresentinel.azure-sentinel-solution-dns-domain","DNS Essentials Solution for Microsoft Sentinel (Preview)","DNS Essentials Solution for Microsoft Sentinel","This is a domain solution and does not include any data connectors. The content in this solution requires one of the product solutions below , as well as any other connector or data source normalized to the ASIM.","Microsoft Sentinel, Microsoft Corporation","false","false","2023-04-18","2025-12-13","security;information-protection;threat-protection;azureCertified;fromPublishingPortal;multiResourceSolution;readonlytemplate;virtualMachine;virtualMachine-Arm","Microsoft Sentinel;f1de974b-f438-4719-b423-8bf704ba2aef;DNS Essentials Solution for Microsoft Sentinel;DNS Essentials Solution for Microsoft Sentinel (Preview)","0.742","0.0","0","false","false","true","2026-04-02"
"DORA Compliance","DORA Compliance","https://github.com/Azure/Azure-Sentinel/blob/master/Solutions/DORA%20Compliance","azuresentinel","azure-sentinel-solution-doracompliance","2025-10-08","","3.0.0","Microsoft Corporation","Microsoft","https://support.microsoft.com/","Microsoft - support@microsoft.com","domains","","https://raw.githubusercontent.com/Azure/Azure-Sentinel/master/Logos/Azure_Sentinel.svg","This Solution enables Microsoft Sentinel users to harness the power of their SIEM to assist in meeting DORA requirements. This Solution comes with pre-defined dashboards, visualizations, and reports, providing users with immediate insights in their DORA environment.","","false","false","","true","https://azuremarketplace.microsoft.com/en-us/marketplace/apps/azuresentinel.azure-sentinel-solution-doracompliance","true","https://azuremarketplace.microsoft.com/en-us/marketplace/apps/azuresentinel.azure-sentinel-solution-doracompliance","DORA Compliance","DORA Compliance solution for Sentinel","This Solution enables Microsoft Sentinel users to harness the power of their SIEM to assist in meeting DORA requirements.","Microsoft Sentinel, Microsoft Corporation","false","false","2026-02-27","2026-02-27","information-protection;threat-protection;security;azureCertified;fromPublishingPortal;multiResourceSolution;readonlytemplate;virtualMachine;virtualMachine-Arm","Microsoft Sentinel;f1de974b-f438-4719-b423-8bf704ba2aef;DORA Compliance;DORA Compliance","0.0","0.0","0","false","false","true","2026-04-02"
