"solution_name","solution_folder","solution_github_url","solution_publisher_id","solution_offer_id","solution_first_publish_date","solution_last_publish_date","solution_version","solution_support_name","solution_support_tier","solution_support_link","solution_author_name","solution_categories","solution_readme_file","solution_logo_url","solution_description","solution_dependencies","has_connectors","is_deprecated","deprecation_date","is_published","marketplace_url","mp_is_published","mp_url","mp_display_name","mp_summary","mp_long_summary","mp_publisher_display_name","mp_is_preview","mp_is_stop_sell","mp_creation_date","mp_last_modified_date","mp_categories","mp_keywords","mp_popularity","mp_rating_average","mp_rating_count","mp_is_free","mp_is_byol","mp_is_microsoft_product","mp_last_checked"
"ProofPointTap","ProofPointTap","https://github.com/Azure/Azure-Sentinel/blob/master/Solutions/ProofPointTap","proofpointinc1600438591120","azure-sentinel-proofpoint","2022-05-23","","3.1.2","Proofpoint, Inc.","Partner","https://proofpoint.my.site.com/community/s/","Proofpoint, Inc. - azure-support@proofpoint.com","domains","","https://raw.githubusercontent.com/Azure/Azure-Sentinel/master/Logos/PFPTLogo.svg","The [Proofpoint TAP](https://www.proofpoint.com/us/products/advanced-threat-protection/targeted-attack-protection) solution for Microsoft Sentinel enables you to ingest Proofpoint TAP logs into Microsoft Sentinel.

**Underlying Microsoft Technologies used:**

This solution takes a dependency on the following technologies, and some of these dependencies either may be in [Preview](https://azure.microsoft.com/support/legal/preview-supplemental-terms/) state or might result in additional ingestion or operational costs:

• [Microsoft Sentinel Codeless Connector Framework](https://aka.ms/Sentinel-CCP_Platform)","","true","false","","true","https://azuremarketplace.microsoft.com/en-us/marketplace/apps/proofpointinc1600438591120.azure-sentinel-proofpoint","true","https://azuremarketplace.microsoft.com/en-us/marketplace/apps/proofpointinc1600438591120.azure-sentinel-proofpoint","Proofpoint TAP for Sentinel","Proofpoint’s Nexus threat intelligence incorporated into Microsoft Sentinel via Proofpoint TAP.","Proofpoint’s Nexus threat intelligence incorporated into Microsoft Sentinel via Proofpoint Targeted Attack Protection (TAP) SIEM APIs. This allows Sentinel customers to seamlessly integrate Proofpoint’s threat intelligence and data into their analytics.","Proofpoint, Inc.","false","false","2025-09-10","2025-12-13","security;threat-protection;azureCertified;fromPublishingPortal;multiResourceSolution;readonlytemplate;virtualMachine;virtualMachine-Arm","f1de974b-f438-4719-b423-8bf704ba2aef;Proofpoint TAP for Microsoft Sentinel;Proofpoint TAP for Sentinel","0.0","0.0","0","false","false","true","2026-04-02"
"Proofpoint On demand(POD) Email Security","Proofpoint On demand(POD) Email Security","https://github.com/Azure/Azure-Sentinel/blob/master/Solutions/Proofpoint%20On%20demand%28POD%29%20Email%20Security","proofpointinc1600438591120","azure-sentinel-proofpointpod","2021-03-31","","3.1.2","Proofpoint, Inc.","Partner","https://proofpoint.my.site.com/community/s/","Proofpoint, Inc. - azure-support@proofpoint.com","domains","","https://raw.githubusercontent.com/Azure/Azure-Sentinel/master/Logos/PFPTLogo.svg","The [Proofpoint on Demand Email Security](https://www.proofpoint.com/us/products/email-security-and-protection/email-protection) solution for Microsoft Sentinel enables you to ingest Proofpoint on Demand Email Protection data and activity logs for monitoring email activity, events and threats in your organization.
  
  **Underlying Microsoft Technologies used:** 

 This solution takes a dependency on the following technologies, and some of these dependencies either may be in [Preview](https://azure.microsoft.com/support/legal/preview-supplemental-terms/) state or might result in additional ingestion or operational costs:

• [Microsoft Sentinel Codeless Connector Framework](https://aka.ms/Sentinel-CCP_Platform)","","true","false","","true","https://azuremarketplace.microsoft.com/en-us/marketplace/apps/proofpointinc1600438591120.azure-sentinel-proofpointpod","true","https://azuremarketplace.microsoft.com/en-us/marketplace/apps/proofpointinc1600438591120.azure-sentinel-proofpointpod","Proofpoint On Demand (POD) Email Security for Sentinel","Proofpoint on Demand Email Security classifies types of email, while detecting and blocking threats.","Proofpoint on Demand Email Security classifies types of email, while detecting and blocking threats.","Proofpoint, Inc.","false","false","2025-09-10","2025-12-23","security;threat-protection;azureCertified;fromPublishingPortal;multiResourceSolution;readonlytemplate;virtualMachine;virtualMachine-Arm","f1de974b-f438-4719-b423-8bf704ba2aef;Proofpoint POD for Microsoft Sentinel;Proofpoint On demand (POD) Email Security;Proofpoint On Demand (POD) Email Security for Sentinel","0.0","0.0","0","false","false","true","2026-04-02"
"Pulse Connect Secure","Pulse Connect Secure","https://github.com/Azure/Azure-Sentinel/blob/master/Solutions/Pulse%20Connect%20Secure","azuresentinel","azure-sentinel-solution-pulseconnectsecure","2022-05-02","","3.0.4","Microsoft Corporation","Microsoft","https://support.microsoft.com","Microsoft - support@microsoft.com","domains","","https://raw.githubusercontent.com/Azure/Azure-Sentinel/master/Logos/Azure_Sentinel.svg","The [Pulse Connect Secure](https://www.ivanti.com/products/connect-secure-vpn?psredirect) solution for Microsoft Sentinel enables you to ingest Pulse Connect Secure logs into Microsoft Sentinel.

This solution is dependent on the Syslog solution containing the Syslog via AMA connector to collect the logs. The Syslog  solution will be installed as part of this solution installation. 

 **NOTE**: Microsoft recommends installation of Syslog via AMA Connector. Legacy connector uses the Log Analytics agent which were deprecated on **Aug 31, 2024.** Using MMA and AMA on same machine can cause log duplication and extra ingestion cost [more details](https://learn.microsoft.com/en-us/azure/sentinel/ama-migrate).","azuresentinel.azure-sentinel-solution-syslog","true","false","","true","https://azuremarketplace.microsoft.com/en-us/marketplace/apps/azuresentinel.azure-sentinel-solution-pulseconnectsecure","true","https://azuremarketplace.microsoft.com/en-us/marketplace/apps/azuresentinel.azure-sentinel-solution-pulseconnectsecure","Pulse Connect Secure","Pulse Connect Secure","Pulse Connect Secure","Microsoft Sentinel, Microsoft Corporation","false","false","2023-03-28","2025-12-13","security;information-protection;threat-protection;azureCertified;fromPublishingPortal;multiResourceSolution;readonlytemplate;virtualMachine;virtualMachine-Arm","Microsoft Sentinel;f1de974b-f438-4719-b423-8bf704ba2aef;Pulse Connect Secure;Pulse Connect Secure","0.128","0.0","0","false","false","true","2026-04-02"
"Pure Storage","Pure Storage","https://github.com/Azure/Azure-Sentinel/blob/master/Solutions/Pure%20Storage","purestoragemarketplaceadmin","microsoft-sentinel-solution-purestorage","2024-02-05","","3.0.1","purestoragemarketplaceadmin","Partner","https://support.purestorage.com","Pure Storage - support@purestorage.com","domains","","https://raw.githubusercontent.com/Azure/Azure-Sentinel/master/Logos/purestorage_logo.svg","Solution for Microsoft Sentinel to ingest logs from PureStorage arrays","","false","false","","true","https://azuremarketplace.microsoft.com/en-us/marketplace/apps/purestoragemarketplaceadmin.microsoft-sentinel-solution-purestorage","true","https://azuremarketplace.microsoft.com/en-us/marketplace/apps/purestoragemarketplaceadmin.microsoft-sentinel-solution-purestorage","Pure Storage Solution for Microsoft Sentinel","Pure Storage Solution for Microsoft Sentinel helps to protect your array from security risks","Pure Storage Solution for Microsoft Sentinel helps to protect your array from security risks and perform automatic remediation actions.","Pure Storage, Inc.","false","false","2024-03-04","2025-12-13","security;information-protection;threat-protection;azureCertified;fromPublishingPortal;multiResourceSolution;readonlytemplate;virtualMachine;virtualMachine-Arm","Pure Storage;Microsoft Sentinel;f1de974b-f438-4719-b423-8bf704ba2aef;Pure Storage Solution for Microsoft Sentinel","0.684","0.0","0","false","false","true","2026-04-02"
"Qualys VM Knowledgebase","Qualys VM Knowledgebase","https://github.com/Azure/Azure-Sentinel/blob/master/Solutions/Qualys%20VM%20Knowledgebase","azuresentinel","azure-sentinel-solution-qualysvmknowledgebase","2022-05-17","","3.0.1","Microsoft Corporation","Microsoft","https://support.microsoft.com/","Microsoft - support@microsoft.com","domains","","https://raw.githubusercontent.com/Azure/Azure-Sentinel/master/Logos/qualys_logo.svg","The [Qualys Vulnerability Management](https://www.qualys.com/apps/vulnerability-management/) KB solution for Microsoft Sentinel enables you to ingest Qualys VM KB logs into Microsoft Sentinel.","","true","false","","true","https://azuremarketplace.microsoft.com/en-us/marketplace/apps/azuresentinel.azure-sentinel-solution-qualysvmknowledgebase","true","https://azuremarketplace.microsoft.com/en-us/marketplace/apps/azuresentinel.azure-sentinel-solution-qualysvmknowledgebase","Qualys VM Knowledgebase","Qualys VM Knowledgebase","The Qualys Vulnerability Management KB solution for Microsoft Sentinel enables you to ingest Qualys VM KB logs into Microsoft Sentinel.","Microsoft Sentinel, Microsoft Corporation","false","false","2023-03-28","2025-12-13","security;azureCertified;fromPublishingPortal;multiResourceSolution;readonlytemplate;virtualMachine;virtualMachine-Arm;AzureSentinelSolution","Microsoft Sentinel;f1de974b-f438-4719-b423-8bf704ba2aef;Qualys VM Knowledgebase;Qualys VM Knowledgebase","0.372","0.0","0","false","false","true","2026-04-02"
"QualysVM","QualysVM","https://github.com/Azure/Azure-Sentinel/blob/master/Solutions/QualysVM","azuresentinel","azure-sentinel-qualysvm","2020-12-14","2025-11-18","3.0.7","Microsoft Corporation","Microsoft","https://support.microsoft.com","Microsoft - support@microsoft.com","domains","","https://raw.githubusercontent.com/Azure/Azure-Sentinel/master/Logos/qualys_logo.svg","The [Qualys Vulnerability Management](https://www.qualys.com/apps/vulnerability-management-detection-response/) solution for Microsoft Sentinel enables you to ingest host vulnerability detection data into Microsoft Sentinel.

  **Underlying Microsoft Technologies used:** 

 This solution takes a dependency on the following technologies, and some of these dependencies either may be in [Preview](https://azure.microsoft.com/support/legal/preview-supplemental-terms/) state or might result in additional ingestion or operational costs:

• [Microsoft Sentinel Codeless Connector Framework](https://aka.ms/Sentinel-CCP_Platform)","","true","false","","true","https://azuremarketplace.microsoft.com/en-us/marketplace/apps/azuresentinel.azure-sentinel-qualysvm","true","https://azuremarketplace.microsoft.com/en-us/marketplace/apps/azuresentinel.azure-sentinel-qualysvm","Qualys VM Solution","Qualys VM provides global visibility into how to protect your IT assets.","The Qualys Vulnerability Management solution for Microsoft Sentinel enables you to ingest host vulnerability detection data into Microsoft Sentinel.","Microsoft Sentinel, Microsoft Corporation","false","false","2023-06-12","2025-12-13","security;threat-protection;azureCertified;fromPublishingPortal;multiResourceSolution;readonlytemplate;virtualMachine;virtualMachine-Arm;AzureSentinelSolution","Microsoft sentinel;f1de974b-f438-4719-b423-8bf704ba2aef;Qualys VM;Qualys VM Solution","0.901","0.0","0","false","false","true","2026-04-02"
"Quokka","Quokka","https://github.com/Azure/Azure-Sentinel/blob/master/Solutions/Quokka","quokka","azure-sentinel-solution-quokka","2025-10-30","","3.0.0","Quokka","Partner","https://www.quokka.io/contact-us#customer-support","Quokka - mvang@quokka.io","domains","","https://raw.githubusercontent.com/Azure/Azure-Sentinel/master/Logos/quokka_logo.svg","The Qscout CCF data connector ingest app events logs from Quokka Qscout platform","","true","false","","true","https://azuremarketplace.microsoft.com/en-us/marketplace/apps/quokka.azure-sentinel-solution-quokka","true","https://azuremarketplace.microsoft.com/en-us/marketplace/apps/quokka.azure-sentinel-solution-quokka","Quokka Q-scout for Microsoft Sentinel","Unified visibility into the risks of mobile apps installed across Intune-managed devices","Q-scout enables security teams to vet mobile apps used by employees. It provides the app risk intelligence needed to confidently approve or block apps, ensuring compliance, safeguarding privacy, and protecting organizational assets from mobile threats. ","Quokka","false","false","2025-11-25","2026-02-02","information-protection;threat-protection;security;azureCertified;fromPublishingPortal;multiResourceSolution;readonlytemplate;virtualMachine;virtualMachine-Arm","f1de974b-f438-4719-b423-8bf704ba2aef;Q-scout for Microsoft Sentinel;Quokka;Quokka Q-scout for Microsoft Sentinel","0.0","0.0","0","false","false","true","2026-04-02"
"RSA SecurID","RSA SecurID","https://github.com/Azure/Azure-Sentinel/blob/master/Solutions/RSA%20SecurID","azuresentinel","azure-sentinel-solution-securid","2021-09-07","","3.0.1","Microsoft Corporation","Microsoft","https://support.microsoft.com","Microsoft - support@microsoft.com","domains","","https://raw.githubusercontent.com/Azure/Azure-Sentinel/master/Logos/Azure_Sentinel.svg","The [RSA® SecurID Authentication Manager](https://www.securid.com) data connector provides the capability to ingest [RSA® SecurID Authentication Manager events](https://community.rsa.com/t5/rsa-authentication-manager/rsa-authentication-manager-log-messages/ta-p/630160) into Microsoft Sentinel. Refer to [RSA® SecurID Authentication Manager documentation](https://community.securid.com/t5/securid-authentication-manager/tkb-p/authentication-manager-documentation) for more information. 

This solution is dependent on the Syslog solution containing the Syslog via AMA connector to collect the logs. The Syslog  solution will be installed as part of this solution installation. 

 **NOTE**: Microsoft recommends installation of Syslog via AMA Connector. Legacy connector uses the Log Analytics agent which were deprecated on **Aug 31, 2024.** Using MMA and AMA on same machine can cause log duplication and extra ingestion cost [more details](https://learn.microsoft.com/en-us/azure/sentinel/ama-migrate).","azuresentinel.azure-sentinel-solution-syslog","true","false","","true","https://azuremarketplace.microsoft.com/en-us/marketplace/apps/azuresentinel.azure-sentinel-solution-securid","true","https://azuremarketplace.microsoft.com/en-us/marketplace/apps/azuresentinel.azure-sentinel-solution-securid","RSA SecurID Solution","SecurID is Trusted Identity Platform,  provides all the capabilities you need in a single solution.","SecurID provides powerful identity and access management capabilities to fully protect organizations in a perimeterless world—without compromising ease and convenience for users.","Microsoft Sentinel, Microsoft Corporation","false","false","2023-04-11","2025-12-13","security;information-protection;threat-protection;azureCertified;fromPublishingPortal;multiResourceSolution;readonlytemplate;virtualMachine;virtualMachine-Arm","Microsoft Sentinel;f1de974b-f438-4719-b423-8bf704ba2aef ;SecurID;RSA SecurID Solution","0.197","0.0","0","false","false","true","2026-04-02"
"RSAIDPlus_AdminLogs_Connector","RSAIDPlus_AdminLogs_Connector","https://github.com/Azure/Azure-Sentinel/blob/master/Solutions/RSAIDPlus_AdminLogs_Connector","rsasecurity1687281258544","azure-sentinel-solution-rsa_id_plus_admin_log","2025-10-14","","3.0.1","RSA Support Team","Partner","https://community.rsa.com/","RSA Security","domains,verticals","Solutions/RSAIDPlus_AdminLogs_Connector/README.md","https://raw.githubusercontent.com/Azure/Azure-Sentinel/master/Logos/RSA_IDPlus.svg","The RSA ID Plus Admin Logs Data Connector enables seamless integration between RSA ID Plus and Microsoft Sentinel. This connector ingests Admin Events logs from RSA ID Plus Cloud Administration Console using the RSA Admin API and stores them securely in your Azure Log Analytics (ALA) workspace. These logs can then be used for monitoring, analysis, and threat detection within Microsoft Sentinel.","","true","false","","true","https://azuremarketplace.microsoft.com/en-us/marketplace/apps/rsasecurity1687281258544.azure-sentinel-solution-rsa_id_plus_admin_log","true","https://azuremarketplace.microsoft.com/en-us/marketplace/apps/rsasecurity1687281258544.azure-sentinel-solution-rsa_id_plus_admin_log","RSA ID Plus Admin Logs Connector","RSA ID Plus Admin Connector monitors administrator activity within the customer’s ID Plus tenant","The RSA ID Plus Admin Connector monitors administrator activity within the customer’s ID Plus tenant. It analyzes admin event logs and automatically alerts security teams.","RSA Security","false","false","2025-10-27","2025-12-13","security;identity-and-access-management;information-protection;azureCertified;fromPublishingPortal;multiResourceSolution;readonlytemplate;virtualMachine;virtualMachine-Arm","f1de974b-f438-4719-b423-8bf704ba2aef;RSA ID Plus Admin Connector Sentinel;Microsoft Sentinel RSA ID Connector;RSA ID Plus Admin Logs Connector","0.0","0.0","0","false","false","true","2026-04-02"
"Radiflow","Radiflow","https://github.com/Azure/Azure-Sentinel/blob/master/Solutions/Radiflow","radiflow","azure-sentinel-solution-radiflow","2024-06-26","","3.0.0","Radiflow","Partner","https://www.radiflow.com","Radiflow - support@radiflow.com","domains","","https://raw.githubusercontent.com/Azure/Azure-Sentinel/master/Logos/Radiflow.svg","The [Radiflow](https://www.radiflow.com/) solution for Microsoft Sentinel enables ingestion of [iSID](https://www.radiflow.com/products/ot-visibility-and-anomaly-detection/) events into Microsoft Sentinel.

1. **Radiflow iSID via AMA** - This data connector helps in ingesting Radiflow logs into your Log Analytics Workspace using the new Azure Monitor Agent. Learn more about ingesting using the new Azure Monitor Agent [here](https://learn.microsoft.com/azure/sentinel/connect-cef-ama). **Microsoft recommends using this Data Connector**.","","true","false","","true","https://azuremarketplace.microsoft.com/en-us/marketplace/apps/radiflow.azure-sentinel-solution-radiflow","true","https://azuremarketplace.microsoft.com/en-us/marketplace/apps/radiflow.azure-sentinel-solution-radiflow","Radiflow OT/ICS Threat and Anomaly Detection Connector for Microsoft Sentinel","Radiflow OT/ICS Threat and Anomaly Detection Connector for Microsoft Sentinel","Radiflow is a cybersecurity platform providing advanced intrusion detection and risk management solutions specifically designed for operational technology (OT) and industrial control systems (ICS) environments.","Radiflow","false","false","2024-07-26","2025-12-12","security;threat-protection;azureCertified;fromPublishingPortal;multiResourceSolution;readonlytemplate;virtualMachine;virtualMachine-Arm;AzureSentinelSolution","Radiflow;iSID;f1de974b-f438-4719-b423-8bf704ba2aef;Radiflow OT/ICS Threat and Anomaly Detection Connector for Microsoft Sentinel","0.0","0.0","0","false","false","true","2026-04-02"
"Rapid7InsightVM","Rapid7InsightVM","https://github.com/Azure/Azure-Sentinel/blob/master/Solutions/Rapid7InsightVM","azuresentinel","azure-sentinel-solution-rapid7insightvm","2021-07-07","","3.1.1","Microsoft Corporation","Microsoft","https://support.microsoft.com","Microsoft - support@microsoft.com","domains","","https://raw.githubusercontent.com/Azure/Azure-Sentinel/master/Logos/Azure_Sentinel.svg","The [Rapid7 Insight platform](https://www.rapid7.com/products/insightvm/) brings together Rapid7’s library of vulnerability research, exploit knowledge, global attacker behavior, Internet-wide scanning data, exposure analytics, and real-time reporting to provide a fully available, scalable, and efficient way to collect your vulnerability data and turn it into answers. InsightVM leverages this platform for live vulnerability and endpoint analytics.
 
 **Underlying Microsoft Technologies used:**

This solution takes a dependency on the following technologies, and some of these dependencies either may be in [Preview](https://azure.microsoft.com/support/legal/preview-supplemental-terms/) state or might result in additional ingestion or operational costs: 
 
 a. [Azure Monitor HTTP Data Collector API](https://docs.microsoft.com/azure/azure-monitor/logs/data-collector-api) b. [Azure Functions ](https://azure.microsoft.com/services/functions/#overview)","","true","false","","true","https://azuremarketplace.microsoft.com/en-us/marketplace/apps/azuresentinel.azure-sentinel-solution-rapid7insightvm","true","https://azuremarketplace.microsoft.com/en-us/marketplace/apps/azuresentinel.azure-sentinel-solution-rapid7insightvm","InsightVM CloudAPI","InsightVM CloudAPI","The Rapid7 Insight platform brings together Rapid7’s library of vulnerability research, exploit knowledge, global attacker behavior, Internet-wide scanning data, exposure analytics, and real-time reporting to provide a fully available and scalable.","Microsoft Sentinel, Microsoft Corporation","false","false","2023-05-26","2025-12-13","security;information-protection;threat-protection;azureCertified;fromPublishingPortal;multiResourceSolution;readonlytemplate;virtualMachine;virtualMachine-Arm;AzureSentinelSolution","Microsoft Sentinel;f1de974b-f438-4719-b423-8bf704ba2aef ;InsightVM CloudAPI;InsightVM CloudAPI","0.71","0.0","0","false","false","true","2026-04-02"
"Recorded Future","Recorded Future","https://github.com/Azure/Azure-Sentinel/blob/master/Solutions/Recorded%20Future","recordedfuture1605638642586","recorded_future_sentinel_solution","2021-11-01","2023-09-19","3.2.17","Recorded Future Support Team","Partner","http://support.recordedfuture.com/","Recorded Future Premier Integrations - support@recordedfuture.com","domains","Solutions/Recorded%20Future/README.md","https://raw.githubusercontent.com/Azure/Azure-Sentinel/master/Logos/RecordedFuture.svg","[Recorded Future](https://www.recordedfuture.com/) is the worlds largest provider of intelligence for enterprise security. By combining persistent and pervasive automated data collection and analytics with human analysis, Recorded Future delivers intelligence that is timely, accurate, and actionable.

Underlying Microsoft Technologies used:
This solution depends on underlying Microsoft technologies. Some of these dependencies either may be in Preview state or might result in additional ingestion or operational costs:
* [Log Analytics](https://learn.microsoft.com/en-us/azure/azure-monitor/logs/workspace-design)
* [Logic apps](https://learn.microsoft.com/en-us/azure/logic-apps/logic-apps-pricing)
* [Threat Indicators](https://learn.microsoft.com/en-us/azure/sentinel/upload-indicators-api)
","","false","false","","true","https://azuremarketplace.microsoft.com/en-us/marketplace/apps/recordedfuture1605638642586.recorded_future_sentinel_solution","true","https://azuremarketplace.microsoft.com/en-us/marketplace/apps/recordedfuture1605638642586.recorded_future_sentinel_solution","Recorded Future Intelligence for Microsoft Sentinel","Faster threat detections and triage with threat intelligence when and where you need it ","Recorded Future’s unprecedented intelligence reduces security risk by automatically positioning threat intelligence data in your Microsoft Sentinel environment.","Recorded Future","false","false","2023-02-20","2025-12-13","security;threat-protection;azureCertified;fromPublishingPortal;multiResourceSolution;readonlytemplate;virtualMachine;virtualMachine-Arm;AzureSentinelSolution","f1de974b-f438-4719-b423-8bf704ba2aef;security intelligence;threat detection;Recorded Future Intelligence for Microsoft Sentinel","0.57","0.0","0","false","false","true","2026-04-02"
