"solution_name","solution_folder","solution_github_url","solution_publisher_id","solution_offer_id","solution_first_publish_date","solution_last_publish_date","solution_version","solution_support_name","solution_support_tier","solution_support_link","solution_author_name","solution_categories","solution_readme_file","solution_logo_url","solution_description","solution_dependencies","has_connectors","is_deprecated","deprecation_date","is_published","marketplace_url","mp_is_published","mp_url","mp_display_name","mp_summary","mp_long_summary","mp_publisher_display_name","mp_is_preview","mp_is_stop_sell","mp_creation_date","mp_last_modified_date","mp_categories","mp_keywords","mp_popularity","mp_rating_average","mp_rating_count","mp_is_free","mp_is_byol","mp_is_microsoft_product","mp_last_checked"
"Ivanti Unified Endpoint Management","Ivanti Unified Endpoint Management","https://github.com/Azure/Azure-Sentinel/blob/master/Solutions/Ivanti%20Unified%20Endpoint%20Management","azuresentinel","azure-sentinel-solution-ivantiuem","2022-07-05","","3.0.1","Microsoft Corporation","Microsoft","https://support.microsoft.com","Microsoft - support@microsoft.com","domains","","https://raw.githubusercontent.com/Azure/Azure-Sentinel/master/Logos/Azure_Sentinel.svg","The [Ivanti Unified Endpoint Management](https://www.ivanti.com/products/endpoint-manager) data connector provides the capability to ingest [Ivanti UEM Alerts](https://help.ivanti.com/ld/help/en_US/LDMS/11.0/Windows/alert-c-monitoring-overview.htm) into Microsoft Sentinel. 

This solution is dependent on the Syslog solution containing the Syslog via AMA connector to collect the logs. The Syslog  solution will be installed as part of this solution installation. 

 **NOTE**: Microsoft recommends installation of Syslog via AMA Connector.Legacy connector uses the Log Analytics agent which were deprecated on **Aug 31, 2024.** Using MMA and AMA on same machine can cause log duplication and extra ingestion cost [more details](https://learn.microsoft.com/en-us/azure/sentinel/ama-migrate).","azuresentinel.azure-sentinel-solution-syslog","true","false","","true","https://azuremarketplace.microsoft.com/en-us/marketplace/apps/azuresentinel.azure-sentinel-solution-ivantiuem","true","https://azuremarketplace.microsoft.com/en-us/marketplace/apps/azuresentinel.azure-sentinel-solution-ivantiuem","Ivanti Unified Endpoint Management","IvantiUEM gives you the ability to enforce policy and privileges everywhere in a few clicks.","The Ivanti Unified Endpoint Management gives you the ability to enforce policy and privileges everywhere in a few clicks, and discover and patch threats predictively and quickly.The result is better user experiences, and zero compromise on protection.","Microsoft Sentinel, Microsoft Corporation","false","false","2024-07-31","2025-12-13","security;information-protection;threat-protection;azureCertified;fromPublishingPortal;multiResourceSolution;readonlytemplate;virtualMachine;virtualMachine-Arm","Microsoft Sentinel;f1de974b-f438-4719-b423-8bf704ba2aef;Ivanti Unified Endpoint Management ;Ivanti Unified Endpoint Management","0.524","0.0","0","false","false","true","2026-04-02"
"JBoss","JBoss","https://github.com/Azure/Azure-Sentinel/blob/master/Solutions/JBoss","azuresentinel","azure-sentinel-solution-jboss","2021-10-20","","3.0.1","Microsoft Corporation","Microsoft","https://support.microsoft.com","Microsoft - support@microsoft.com","domains","","https://raw.githubusercontent.com/Azure/Azure-Sentinel/master/Logos/Azure_Sentinel.svg","The JBoss Enterprise Application Platform data connector provides the capability to ingest [JBoss](https://www.redhat.com/en/technologies/jboss-middleware/application-platform) events into Microsoft Sentinel. Refer to [Red Hat documentation](https://access.redhat.com/documentation/red_hat_jboss_enterprise_application_platform/7.0/html/configuration_guide/logging_with_jboss_eap) for more information.

 This solution is dependent on the Custom logs via AMA connector to collect the logs. The Custom logs solution will be installed as part of this solution installation.

 **NOTE**: Microsoft recommends installation of Custom logs via AMA Connector.Legacy connector uses the Log Analytics agent which were deprecated on **Aug 31, 2024.** Using MMA and AMA on same machine can cause log duplication and extra ingestion cost [more details](https://learn.microsoft.com/en-us/azure/sentinel/ama-migrate).","azuresentinel.azure-sentinel-solution-customlogsviaama","true","false","","true","https://azuremarketplace.microsoft.com/en-us/marketplace/apps/azuresentinel.azure-sentinel-solution-jboss","true","https://azuremarketplace.microsoft.com/en-us/marketplace/apps/azuresentinel.azure-sentinel-solution-jboss","JBoss","JBoss delivers enterprise-grade security, performance, and scalability in any environment.","JBoss delivers enterprise-grade security, performance, and scalability in any environment. Whether on-premise; virtual; or in private, public, or hybrid clouds, JBoss EAP can help you deliver apps faster, everywhere.","Microsoft Sentinel, Microsoft Corporation","false","false","2024-08-21","2025-12-13","security;information-protection;threat-protection;azureCertified;fromPublishingPortal;multiResourceSolution;readonlytemplate;virtualMachine;virtualMachine-Arm","Microsoft Sentinel;f1de974b-f438-4719-b423-8bf704ba2aef;JBoss;JBoss","0.214","0.0","0","false","false","true","2026-04-02"
"Jamf Protect","Jamf Protect","https://github.com/Azure/Azure-Sentinel/blob/master/Solutions/Jamf%20Protect","jamfsoftwareaustraliaptyltd1620360395539","jamf_protect","2022-10-10","2025-09-02","3.3.0","Jamf Software, LLC","Partner","https://www.jamf.com/support/","Thijs Xhaflaire - thijs.xhaflaire@jamf.com","domains","","https://raw.githubusercontent.com/Azure/Azure-Sentinel/master/Logos/jamf_logo.svg","The [Jamf Protect](https://www.jamf.com/solutions/threat-prevention-remediation/) solution for Microsoft Sentinel enables you to ingest [Jamf Protect events](https://docs.jamf.com/jamf-protect/documentation/Data_Forwarding_to_a_Third_Party_Storage_Solution.html#task-4227) forwarded into Microsoft Sentinel using the Microsoft Sentinel Analytics Workspace.","","true","false","","true","https://azuremarketplace.microsoft.com/en-us/marketplace/apps/jamfsoftwareaustraliaptyltd1620360395539.jamf_protect","true","https://azuremarketplace.microsoft.com/en-us/marketplace/apps/jamfsoftwareaustraliaptyltd1620360395539.jamf_protect","Jamf Protect for Microsoft Sentinel","Provide complete Apple Endpoint Security insights from Jamf Protect into Microsoft Sentinel.","Provide complete insight and visibility into your protected macOS endpoints, alongside other managed endpoints, all within a single Microsoft Sentinel workspace.
","Jamf Software, LLC","false","false","2023-02-21","2025-12-13","security;information-protection;threat-protection;compute-azure-apps;clientOS;azureCertified;fromPublishingPortal;multiResourceSolution;readonlytemplate;virtualMachine;virtualMachine-Arm","Apple Endpoint Security;Jamf Protect;f1de974b-f438-4719-b423-8bf704ba2aef;Jamf Protect for Microsoft Sentinel","0.838","4.858","2081","false","false","true","2026-04-02"
"JoeSandbox","JoeSandbox","https://github.com/Azure/Azure-Sentinel/blob/master/Solutions/JoeSandbox","joesecurity","azure-sentinel-solution-joesandbox","2025-09-12","","3.0.0","Stefan Bühlmann","Partner","https://www.joesecurity.org/support","Stefan Bühlmann","domains","Solutions/JoeSandbox/README.md","https://raw.githubusercontent.com/Azure/Azure-Sentinel/master/Logos/joesandbox.svg"," The JoeSandbox Connector for Microsoft Sentinel enhances security operations by providing enriched threat intelligence, enabling faster and more informed responses to security incidents. The integration has two main parts: first, URL detonation and enrichment, which provides detailed insights into suspicious URLs. Second, it automatically generates and feeds threat intelligence for all submissions to JoeSandbox, improving threat detection and incident response in Sentinel. This seamless integration empowers teams to proactively address emerging threats.","","true","false","","true","https://azuremarketplace.microsoft.com/en-us/marketplace/apps/joesecurity.azure-sentinel-solution-joesandbox","true","https://azuremarketplace.microsoft.com/en-us/marketplace/apps/joesecurity.azure-sentinel-solution-joesandbox","Joe Sandbox for Microsoft Sentinel","Integrates Joe Sandbox threat intelligence and sandbox analysis results into Microsoft Sentinel","Integrates Joe Sandbox with Microsoft Sentinel to ingest threat intelligence and sandbox analysis data for indicator enrichment and enhanced alert and incident investigation.","Joe Security","false","false","2026-02-10","2026-02-18","threat-protection;security;azureCertified;fromPublishingPortal;multiResourceSolution;readonlytemplate;virtualMachine;virtualMachine-Arm","Joe Sandbox;URL and File Analysis;f1de974b-f438-4719-b423-8bf704ba2aef;Joe Sandbox for Microsoft Sentinel","0.0","0.0","0","false","false","true","2026-04-02"
"Joshua-Cyberiskvision","Joshua-Cyberiskvision","https://github.com/Azure/Azure-Sentinel/blob/master/Solutions/Joshua-Cyberiskvision","almavivaspa1636563933762","joshua-cyberiskvision","2022-01-10","2022-01-10","2.0.0","Joshua Cyberiskvision","Partner","https://www.cyberiskvision.com/","Microsoft - support@microsoft.com","domains","","https://raw.githubusercontent.com/Azure/Azure-Sentinel/master/Logos/Azure_Sentinel.svg","[Joshua Cyberiskvision](https://www.cyberiskvision.com/) enables organizations to define, monitor, analyze, and improve their level of Global Cybersecurity following a predictive and context-aware approach that uses a broad spectrum cyber intelligence-driven logic. The Joshua Solution automates the ingest of Joshua Cyberiskvision threat indicators into the ThreatIntelligenceIndicator table of Microsoft Sentinel workspace.","","false","false","","true","https://azuremarketplace.microsoft.com/en-us/marketplace/apps/almavivaspa1636563933762.joshua-cyberiskvision","true","https://azuremarketplace.microsoft.com/en-us/marketplace/apps/almavivaspa1636563933762.joshua-cyberiskvision","Joshua Cyberisk Vision","Enabling actionable security data feed focused on NIS critical infrastructures","Joshua Cyberiskvision enables organizations to define, monitor, analyze and improve their level of Global Cybersecurity following a predictive and context-aware approach that uses a broad-spectrum cyber intelligence-driven logic.","Almaviva SpA","false","false","2024-11-08","2025-12-13","security;information-protection;threat-protection;firewalls;compute-azure-apps;networking;azureCertified;fromPublishingPortal;multiResourceSolution;readonlytemplate;virtualMachine;virtualMachine-Arm","azure sentinel;f1de974b-f438-4719-b423-8bf704ba2aef;Joshua Cyberiskvision;Joshua Cyberisk Vision","0.0","0.0","0","false","false","true","2026-04-02"
"Juniper SRX","Juniper SRX","https://github.com/Azure/Azure-Sentinel/blob/master/Solutions/Juniper%20SRX","azuresentinel","azure-sentinel-solution-junipersrx","2022-05-02","","3.0.2","Microsoft Corporation","Microsoft","https://support.microsoft.com","Microsoft - support@microsoft.com","domains","","https://raw.githubusercontent.com/Azure/Azure-Sentinel/master/Logos/Azure_Sentinel.svg","The [Juniper SRX](https://www.juniper.net/us/en/products/security/srx-series.html) solution for Microsoft Sentinel enables you to ingest Juniper SRX traffic and system logs into Microsoft Sentinel.

This solution is dependent on the Syslog solution containing the Syslog via AMA connector to collect the logs. The Syslog  solution will be installed as part of this solution installation. 

 **NOTE**: Microsoft recommends installation of Syslog via AMA Connector.Legacy connector uses the Log Analytics agent which were deprecated on **Aug 31, 2024.** Using MMA and AMA on same machine can cause log duplication and extra ingestion cost [more details](https://learn.microsoft.com/en-us/azure/sentinel/ama-migrate).","azuresentinel.azure-sentinel-solution-syslog","true","false","","true","https://azuremarketplace.microsoft.com/en-us/marketplace/apps/azuresentinel.azure-sentinel-solution-junipersrx","true","https://azuremarketplace.microsoft.com/en-us/marketplace/apps/azuresentinel.azure-sentinel-solution-junipersrx","Juniper SRX","Juniper SRX","The Juniper SRX solution for Microsoft Sentinel enables you to ingest Juniper SRX traffic and system logs into Microsoft Sentinel.","Microsoft Sentinel, Microsoft Corporation","false","false","2023-03-14","2025-12-13","security;information-protection;threat-protection;azureCertified;fromPublishingPortal;multiResourceSolution;readonlytemplate;virtualMachine;virtualMachine-Arm","Microsoft Sentinel;f1de974b-f438-4719-b423-8bf704ba2aef;Juniper SRX;Juniper SRX","0.821","0.0","0","false","false","true","2026-04-02"
"JuniperIDP","JuniperIDP","https://github.com/Azure/Azure-Sentinel/blob/master/Solutions/JuniperIDP","azuresentinel","azure-sentinel-solution-juniperidp","2021-03-31","","3.0.1","Microsoft Corporation","Microsoft","https://support.microsoft.com","Microsoft - support@microsoft.com","domains","","https://raw.githubusercontent.com/Azure/Azure-Sentinel/master/Logos/Azure_Sentinel.svg","The [Juniper](https://www.juniper.net/) IDP solution provides the capability to ingest [Juniper IDP](https://www.juniper.net/documentation/us/en/software/junos/idp-policy/topics/topic-map/security-idp-overview.html) events into Microsoft Sentinel.

 This solution is dependent on the Custom logs via AMA connector to collect the logs. The Custom logs solution will be installed as part of this solution installation.

 **NOTE**: Microsoft recommends installation of Custom logs via AMA Connector. Legacy connector uses the Log Analytics agent which were deprecated on **Aug 31, 2024.** Using MMA and AMA on same machine can cause log duplication and extra ingestion cost [more details](https://learn.microsoft.com/en-us/azure/sentinel/ama-migrate).","azuresentinel.azure-sentinel-solution-customlogsviaama","true","false","","true","https://azuremarketplace.microsoft.com/en-us/marketplace/apps/azuresentinel.azure-sentinel-solution-juniperidp","true","https://azuremarketplace.microsoft.com/en-us/marketplace/apps/azuresentinel.azure-sentinel-solution-juniperidp","Juniper IDP Solution","Monitor and analyze the events occurring in your network to detect and stop potential incidents.","The Juniper IDP solution provides the capability to ingest Juniper IDP events into Microsoft Sentinel.","Microsoft Sentinel, Microsoft Corporation","false","false","2024-08-20","2025-12-13","security;information-protection;threat-protection;azureCertified;fromPublishingPortal;multiResourceSolution;readonlytemplate;virtualMachine;virtualMachine-Arm;AzureSentinelSolution","Microsoft Sentinel;f1de974b-f438-4719-b423-8bf704ba2aef ;Juniper;Juniper IDP Solution","0.627","0.0","0","false","false","true","2026-04-02"
"KQL Training","KQL Training","https://github.com/Azure/Azure-Sentinel/blob/master/Solutions/KQL%20Training","microsoftsentinelcommunity","azure-sentinel-solution-kqltraining","2022-11-30","","3.0.1","Community","Community","https://github.com/Azure/Azure-Sentinel/issues","Community","domains","","https://raw.githubusercontent.com/Azure/Azure-Sentinel/master/Logos/Azure_Sentinel.svg","The KQL Training solution for Microsoft Sentinel contains resources that can help up – skill on understanding the fundamentals and using KQL in advanced scenarios like authoring effective and optimized queries used in Microsoft Sentinel Analytics, Hunting Queries, Workbooks, etc. 

All content packaged in this solution is built and supported by the Microsoft Sentinel community. For any support, please create an [issue](https://github.com/Azure/Azure-Sentinel/issues) on the Microsoft Sentinel GitHub repository.","","false","false","","true","https://azuremarketplace.microsoft.com/en-us/marketplace/apps/microsoftsentinelcommunity.azure-sentinel-solution-kqltraining","true","https://azuremarketplace.microsoft.com/en-us/marketplace/apps/microsoftsentinelcommunity.azure-sentinel-solution-kqltraining","KQL Training","KQL Training","The KQL Training solution for Microsoft Sentinel contains resources that can help up – skill on understanding the fundamentals and using KQL in advanced scenarios like authoring effective and optimized queries used in Sentinel Analytics, Hunting Queries.","Microsoft Sentinel Community, Microsoft Corporation","false","false","2023-09-12","2025-12-13","security;information-protection;threat-protection;azureCertified;fromPublishingPortal;multiResourceSolution;readonlytemplate;virtualMachine;virtualMachine-Arm","Microsoft Sentinel;f1de974b-f438-4719-b423-8bf704ba2aef;KQL Training;KQL Training","0.778","0.0","0","false","false","true","2026-04-02"
"Keeper Security","Keeper Security","https://github.com/Azure/Azure-Sentinel/blob/master/Solutions/Keeper%20Security","keepersecurity","keeper-security-integration","2025-06-03","2025-06-03","3.0.0","Keeper Security","Partner","https://www.keepersecurity.com","Joao Paulo Oliveira Santos - jsantos@keepersecurity.com","domains","","https://raw.githubusercontent.com/Azure/Azure-Sentinel/master/Logos/keeper_security.svg","The [Keeper Security](https://keepersecurity.com/) solution for Microsoft Sentinel enables you to ingest [Keeper Security](https://keepersecurity.com/) forwarded into Microsoft Sentinel using the Microsoft Sentinel Analytics Workspace.","","true","false","","true","https://azuremarketplace.microsoft.com/en-us/marketplace/apps/keepersecurity.keeper-security-integration","true","https://azuremarketplace.microsoft.com/en-us/marketplace/apps/keepersecurity.keeper-security-integration","Keeper Security SIEM integration with Microsoft Sentinel","Stream logs from Keeper Security into Microsoft Sentinel for Threat Detection and Response","The Keeper Security integration for Microsoft Sentinel streams privileged access, vault activity, and audit events into Sentinel. Security teams gain visibility to detect threats, investigate incidents, and automate responses using Sentinel’s analytics.","Keeper Security, Inc.","false","false","2025-06-30","2025-12-13","security;information-protection;threat-protection;azureCertified;fromPublishingPortal;multiResourceSolution;readonlytemplate;virtualMachine;virtualMachine-Arm","keeper;password;f1de974b-f438-4719-b423-8bf704ba2aef;Keeper Security SIEM integration with Microsoft Sentinel","0.898","0.0","0","false","false","true","2026-04-02"
"Lastpass Enterprise Activity Monitoring","LastPass","https://github.com/Azure/Azure-Sentinel/blob/master/Solutions/LastPass","thecollectiveconsultingbv1584980370320","lastpass-enterprise-monitoring-solution","2021-10-20","2022-01-12","2.0.1","The Collective Consulting","Partner","https://thecollective.eu","Thijs Lecomte - thijs.lecomte@thecollective.eu","domains","Solutions/LastPass/README.md","https://raw.githubusercontent.com/Azure/Azure-Sentinel/master/Logos/LastPass.svg","[Lastpass Enterprise Activity Monitoring ](https://www.lastpass.com/en/products/business) is a cloud password manager used by organizations to securely save and share passwords.

**Underlying Microsoft Technologies used:**

This solution takes a dependency on the following technologies, and some of these dependencies either may be in [Preview](https://azure.microsoft.com/support/legal/preview-supplemental-terms/) state or might result in additional ingestion or operational costs

 a. [Codeless Connector Platform/Native Sentinel Polling ](https://docs.microsoft.com/azure/sentinel/create-codeless-connector?tabs=deploy-via-arm-template%2Cconnect-via-the-azure-portal)","","true","false","","true","https://azuremarketplace.microsoft.com/en-us/marketplace/apps/thecollectiveconsultingbv1584980370320.lastpass-enterprise-monitoring-solution","true","https://azuremarketplace.microsoft.com/en-us/marketplace/apps/thecollectiveconsultingbv1584980370320.lastpass-enterprise-monitoring-solution","Lastpass Enterprise Activity Monitoring","LastPass Enterprise Activity Monitoring for Microsoft Sentinel","By leveraging Microsoft technologies, your LastPass Enterprise solution will be enriched with activity monitoring and alerts for a better password management and increased security posture.","The Collective Consulting BV","false","false","2024-11-08","2025-12-12","security;threat-protection;azureCertified;fromPublishingPortal;multiResourceSolution;readonlytemplate;virtualMachine;virtualMachine-Arm","LastPass;f1de974b-f438-4719-b423-8bf704ba2aef;Security;Lastpass Enterprise Activity Monitoring","0.717","1.0","1","false","false","true","2026-04-02"
"Legacy IOC based Threat Protection","Legacy IOC based Threat Protection","https://github.com/Azure/Azure-Sentinel/blob/master/Solutions/Legacy%20IOC%20based%20Threat%20Protection","azuresentinel","azure-sentinel-solution-ioclegacy","2022-12-19","","3.0.5","Microsoft Corporation","Microsoft","https://support.microsoft.com","Microsoft - support@microsoft.com","domains","","https://raw.githubusercontent.com/Azure/Azure-Sentinel/master/Logos/Azure_Sentinel.svg","Microsoft Security Research, based on ongoing trends and exploits creates content that help identify existence of known IOCs based on known prevalent attacks and threat actor tactics/techniques, such as Nobelium, Gallium, Solorigate, etc. This solution contains packaged content written on some legacy IOCs that have been prevalent in the past but may still be relevant.

**Pre-requisites:**

This is a [domain solution](https://learn.microsoft.com/azure/sentinel/sentinel-solutions-catalog#domain-solutions) and does not include any data connectors. The content in this solution supports the connectors listed below. Install one or more of the listed solutions, to unlock the value provided by this solution.

1. Squid Proxy

2. Windows Server DNS

3. Cisco ASA

4. Palo Alto Networks

5. Microsoft Defender XDR

6. Azure Firewall

7. ZScaler Internet Access

8. Infoblox NIOS

9. Google Cloud Platform DNS

10. NXLog DNS

11. Cisco Umbrella

12. Corelight 

13. Amazon Web Services

14. Windows Forwarded Events

15. Sysmon for Linux

16. Microsoft 365

17. Windows Security Events

18. Microsoft Entra ID

19. Azure Activity

20. F5 Advanced WAF

21. Fortinet FortiGate

22. Check Point

23. Common Event Format

24. Windows Firewall","azuresentinel.azure-sentinel-solution-squidproxy;azuresentinel.azure-sentinel-solution-dns;azuresentinel.azure-sentinel-solution-ciscoasa;azuresentinel.azure-sentinel-solution-paloaltopanos;azuresentinel.azure-sentinel-solution-microsoft365defender;sentinel4azurefirewall.sentinel4azurefirewall;zscaler1579058425289.zscaler_internet_access_mss;azuresentinel.azure-sentinel-solution-infobloxnios;azuresentinel.azure-sentinel-solution-gcpdns;nxlogltd1589381969261.nxlog_dns_logs;azuresentinel.azure-sentinel-solution-ciscoumbrella;corelightinc1584998267292.corelight-for-azure-sentinel;azuresentinel.azure-sentinel-solution-amazonwebservices;azuresentinel.azure-sentinel-solution-windowsforwardedevents;azuresentinel.azure-sentinel-solution-sysmonforlinux;azuresentinel.azure-sentinel-solution-office365;azuresentinel.azure-sentinel-solution-securityevents;azuresentinel.azure-sentinel-solution-azureactivedirectory;azuresentinel.azure-sentinel-solution-azureactivity;f5-networks.f5_bigip_mss;azuresentinel.azure-sentinel-solution-fortinetfortigate;checkpoint.checkpoint-sentinel-solutions;azuresentinel.azure-sentinel-solution-commoneventformat;azuresentinel.azure-sentinel-solution-windowsfirewall","false","false","","true","https://azuremarketplace.microsoft.com/en-us/marketplace/apps/azuresentinel.azure-sentinel-solution-ioclegacy","true","https://azuremarketplace.microsoft.com/en-us/marketplace/apps/azuresentinel.azure-sentinel-solution-ioclegacy","Legacy IOC based Threat Protection","Legacy IOC based Threat Protection","Microsoft Security Research, based on ongoing trends and exploits creates content that help identify existence of known IOCs based on known prevalent attacks and threat actor tactics/techniques, such as Nobelium, Gallium, Solorigate, etc.","Microsoft Sentinel, Microsoft Corporation","false","false","2023-02-23","2025-12-13","security;information-protection;threat-protection;azureCertified;fromPublishingPortal;multiResourceSolution;readonlytemplate;virtualMachine;virtualMachine-Arm","Microsoft Sentinel;f1de974b-f438-4719-b423-8bf704ba2aef;Legacy IOC based Threat Protection;Legacy IOC based Threat Protection","0.561","0.0","0","false","false","true","2026-04-02"
