[
  {
    "TenantId": "cc1bd33d-9555-48b2-9161-6d8ca52f65f8",
    "SourceSystem": "OpsManager",
    "MG": "00000000-0000-0000-0000-000000000002",
    "ManagementGroupName": "sysloger",
    "TimeGenerated [UTC]": "11/11/2020, 4:12:45.000 PM",
    "Computer": "sysloger",
    "RawData": "2020-11-11T16:11:55+00:00 julienc.alsid.app AlsidForAD[4]: \"1\" \"1\" \"Sulforest\" \"dc\" \"CN=tools-vm,CN=Computers,DC=alsid,DC=corp\" \"2162\" \"\" \"lastlogontimestamp\"=\"\"2020-11-11T16:11:54.2746219Z\"",
    "Type": "AlsidForADLog_CL",
    "_ResourceId": "/subscriptions/8c038010-3c7a-40c6-985f-db5e8a04e59f/resourcegroups/julien_clement-rg/providers/microsoft.compute/virtualmachines/sysloger"
  },
  {
    "TenantId": "cc1bd33d-9555-48b2-9161-6d8ca52f65f8",
    "SourceSystem": "OpsManager",
    "MG": "00000000-0000-0000-0000-000000000002",
    "ManagementGroupName": "sysloger",
    "TimeGenerated [UTC]": "11/11/2020, 4:12:45.000 PM",
    "Computer": "sysloger",
    "RawData": "2020-11-11T16:11:55+00:00 julienc.alsid.app AlsidForAD[4]: \"1\" \"1\" \"Sulforest\" \"dc\" \"CN=tools-vm,CN=Computers,DC=alsid,DC=corp\" \"2162\" \"\" \"usnchanged\"=\"60412",
    "Type": "AlsidForADLog_CL",
    "_ResourceId": "/subscriptions/8c038010-3c7a-40c6-985f-db5e8a04e59f/resourcegroups/julien_clement-rg/providers/microsoft.compute/virtualmachines/sysloger"
  },
  {
    "TenantId": "cc1bd33d-9555-48b2-9161-6d8ca52f65f8",
    "SourceSystem": "OpsManager",
    "MG": "00000000-0000-0000-0000-000000000002",
    "ManagementGroupName": "sysloger",
    "TimeGenerated [UTC]": "11/11/2020, 4:12:45.000 PM",
    "Computer": "sysloger",
    "RawData": "2020-11-11T16:11:55+00:00 julienc.alsid.app AlsidForAD[4]: \"1\" \"1\" \"Sulforest\" \"dc\" \"CN=tools-vm,CN=Computers,DC=alsid,DC=corp\" \"2162\" \"\" \"whenchanged\"=\"\"2020-11-11T16:11:54.0000000Z\"",
    "Type": "AlsidForADLog_CL",
    "_ResourceId": "/subscriptions/8c038010-3c7a-40c6-985f-db5e8a04e59f/resourcegroups/julien_clement-rg/providers/microsoft.compute/virtualmachines/sysloger"
  },
  {
    "TenantId": "cc1bd33d-9555-48b2-9161-6d8ca52f65f8",
    "SourceSystem": "OpsManager",
    "MG": "00000000-0000-0000-0000-000000000002",
    "ManagementGroupName": "sysloger",
    "TimeGenerated [UTC]": "11/11/2020, 10:11:40.000 PM",
    "Computer": "sysloger",
    "RawData": "2020-11-11T22:10:28+00:00 julienc.alsid.app AlsidForAD[4]: \"1\" \"1\" \"Sulforest\" \"dc\" \"CN=tools-vm,CN=Computers,DC=alsid,DC=corp\" \"2163\" \"\" \"pwdlastset\"=\"\"2020-11-11T22:10:27.7592910Z\"",
    "Type": "AlsidForADLog_CL",
    "_ResourceId": "/subscriptions/8c038010-3c7a-40c6-985f-db5e8a04e59f/resourcegroups/julien_clement-rg/providers/microsoft.compute/virtualmachines/sysloger"
  },
  {
    "TenantId": "cc1bd33d-9555-48b2-9161-6d8ca52f65f8",
    "SourceSystem": "OpsManager",
    "MG": "00000000-0000-0000-0000-000000000002",
    "ManagementGroupName": "sysloger",
    "TimeGenerated [UTC]": "11/11/2020, 10:11:40.000 PM",
    "Computer": "sysloger",
    "RawData": "2020-11-11T22:10:28+00:00 julienc.alsid.app AlsidForAD[4]: \"1\" \"1\" \"Sulforest\" \"dc\" \"CN=tools-vm,CN=Computers,DC=alsid,DC=corp\" \"2163\" \"\" \"whenchanged\"=\"\"2020-11-11T22:10:27.0000000Z\"",
    "Type": "AlsidForADLog_CL",
    "_ResourceId": "/subscriptions/8c038010-3c7a-40c6-985f-db5e8a04e59f/resourcegroups/julien_clement-rg/providers/microsoft.compute/virtualmachines/sysloger"
  },
  {
    "TenantId": "cc1bd33d-9555-48b2-9161-6d8ca52f65f8",
    "SourceSystem": "OpsManager",
    "MG": "00000000-0000-0000-0000-000000000002",
    "ManagementGroupName": "sysloger",
    "TimeGenerated [UTC]": "11/11/2020, 10:11:40.000 PM",
    "Computer": "sysloger",
    "RawData": "2020-11-11T22:10:28+00:00 julienc.alsid.app AlsidForAD[4]: \"1\" \"1\" \"Sulforest\" \"dc\" \"CN=tools-vm,CN=Computers,DC=alsid,DC=corp\" \"2163\" \"\" \"usnchanged\"=\"61746",
    "Type": "AlsidForADLog_CL",
    "_ResourceId": "/subscriptions/8c038010-3c7a-40c6-985f-db5e8a04e59f/resourcegroups/julien_clement-rg/providers/microsoft.compute/virtualmachines/sysloger"
  },
  {
    "TenantId": "cc1bd33d-9555-48b2-9161-6d8ca52f65f8",
    "SourceSystem": "OpsManager",
    "MG": "00000000-0000-0000-0000-000000000002",
    "ManagementGroupName": "sysloger",
    "TimeGenerated [UTC]": "11/12/2020, 3:15:01.000 AM",
    "Computer": "sysloger",
    "RawData": "2020-11-12T03:14:08+00:00 julienc.alsid.app AlsidForAD[4]: \"1\" \"1\" \"Sulforest\" \"dc\" \"CN=dc-vm,OU=Domain Controllers,DC=alsid,DC=corp\" \"2164\" \"\" \"usnchanged\"=\"62057",
    "Type": "AlsidForADLog_CL",
    "_ResourceId": "/subscriptions/8c038010-3c7a-40c6-985f-db5e8a04e59f/resourcegroups/julien_clement-rg/providers/microsoft.compute/virtualmachines/sysloger"
  },
  {
    "TenantId": "cc1bd33d-9555-48b2-9161-6d8ca52f65f8",
    "SourceSystem": "OpsManager",
    "MG": "00000000-0000-0000-0000-000000000002",
    "ManagementGroupName": "sysloger",
    "TimeGenerated [UTC]": "11/12/2020, 3:15:01.000 AM",
    "Computer": "sysloger",
    "RawData": "2020-11-12T03:14:08+00:00 julienc.alsid.app AlsidForAD[4]: \"1\" \"1\" \"Sulforest\" \"dc\" \"CN=dc-vm,OU=Domain Controllers,DC=alsid,DC=corp\" \"2164\" \"\" \"whenchanged\"=\"\"2020-11-12T03:14:07.0000000Z\"",
    "Type": "AlsidForADLog_CL",
    "_ResourceId": "/subscriptions/8c038010-3c7a-40c6-985f-db5e8a04e59f/resourcegroups/julien_clement-rg/providers/microsoft.compute/virtualmachines/sysloger"
  },
  {
    "TenantId": "cc1bd33d-9555-48b2-9161-6d8ca52f65f8",
    "SourceSystem": "OpsManager",
    "MG": "00000000-0000-0000-0000-000000000002",
    "ManagementGroupName": "sysloger",
    "TimeGenerated [UTC]": "11/12/2020, 3:15:01.000 AM",
    "Computer": "sysloger",
    "RawData": "2020-11-12T03:14:08+00:00 julienc.alsid.app AlsidForAD[4]: \"1\" \"1\" \"Sulforest\" \"dc\" \"CN=dc-vm,OU=Domain Controllers,DC=alsid,DC=corp\" \"2164\" \"\" \"pwdlastset\"=\"\"2020-11-12T03:14:07.6144505Z\"",
    "Type": "AlsidForADLog_CL",
    "_ResourceId": "/subscriptions/8c038010-3c7a-40c6-985f-db5e8a04e59f/resourcegroups/julien_clement-rg/providers/microsoft.compute/virtualmachines/sysloger"
  },
  {
    "TenantId": "cc1bd33d-9555-48b2-9161-6d8ca52f65f8",
    "SourceSystem": "OpsManager",
    "MG": "00000000-0000-0000-0000-000000000002",
    "ManagementGroupName": "sysloger",
    "TimeGenerated [UTC]": "11/3/2020, 12:29:21.000 PM",
    "Computer": "sysloger",
    "RawData": "2020-11-03T12:28:33+00:00 julienc.alsid.app AlsidForAD[4]: \"1\" \"1\" \"Sulforest\" \"dc\" \"CN=dcadmin,CN=Users,DC=alsid,DC=corp\" \"2151\" \"\" \"whenchanged\"=\"\"2020-11-03T12:28:32.0000000Z\"",
    "Type": "AlsidForADLog_CL",
    "_ResourceId": "/subscriptions/8c038010-3c7a-40c6-985f-db5e8a04e59f/resourcegroups/julien_clement-rg/providers/microsoft.compute/virtualmachines/sysloger"
  },
  {
    "TenantId": "cc1bd33d-9555-48b2-9161-6d8ca52f65f8",
    "SourceSystem": "OpsManager",
    "MG": "00000000-0000-0000-0000-000000000002",
    "ManagementGroupName": "sysloger",
    "TimeGenerated [UTC]": "11/3/2020, 12:29:21.000 PM",
    "Computer": "sysloger",
    "RawData": "2020-11-03T12:28:33+00:00 julienc.alsid.app AlsidForAD[4]: \"1\" \"1\" \"Sulforest\" \"dc\" \"CN=dcadmin,CN=Users,DC=alsid,DC=corp\" \"2151\" \"\" \"usnchanged\"=\"48588",
    "Type": "AlsidForADLog_CL",
    "_ResourceId": "/subscriptions/8c038010-3c7a-40c6-985f-db5e8a04e59f/resourcegroups/julien_clement-rg/providers/microsoft.compute/virtualmachines/sysloger"
  },
  {
    "TenantId": "cc1bd33d-9555-48b2-9161-6d8ca52f65f8",
    "SourceSystem": "OpsManager",
    "MG": "00000000-0000-0000-0000-000000000002",
    "ManagementGroupName": "sysloger",
    "TimeGenerated [UTC]": "11/3/2020, 12:29:21.000 PM",
    "Computer": "sysloger",
    "RawData": "2020-11-03T12:28:33+00:00 julienc.alsid.app AlsidForAD[4]: \"1\" \"1\" \"Sulforest\" \"dc\" \"CN=dcadmin,CN=Users,DC=alsid,DC=corp\" \"2151\" \"\" \"lastlogontimestamp\"=\"\"2020-11-03T12:28:32.8302502Z\"",
    "Type": "AlsidForADLog_CL",
    "_ResourceId": "/subscriptions/8c038010-3c7a-40c6-985f-db5e8a04e59f/resourcegroups/julien_clement-rg/providers/microsoft.compute/virtualmachines/sysloger"
  },
  {
    "TenantId": "cc1bd33d-9555-48b2-9161-6d8ca52f65f8",
    "SourceSystem": "OpsManager",
    "MG": "00000000-0000-0000-0000-000000000002",
    "ManagementGroupName": "sysloger",
    "TimeGenerated [UTC]": "11/3/2020, 12:29:21.000 PM",
    "Computer": "sysloger",
    "RawData": "2020-11-03T12:28:34+00:00 julienc.alsid.app AlsidForAD[4]: \"0\" \"2\" \"Sulforest\" \"dc\" \"C-ADM-ACC-USAGE\" \"medium\" \"CN=dcadmin,CN=Users,DC=alsid,DC=corp\" \"24\" \"1\" \"R-ADM-ACC-USAGE\" \"2151\" \"LastLogonTimestamp\"=\"2020-11-03T12:28:33.2591183Z",
    "Type": "AlsidForADLog_CL",
    "_ResourceId": "/subscriptions/8c038010-3c7a-40c6-985f-db5e8a04e59f/resourcegroups/julien_clement-rg/providers/microsoft.compute/virtualmachines/sysloger"
  },
  {
    "TenantId": "cc1bd33d-9555-48b2-9161-6d8ca52f65f8",
    "SourceSystem": "OpsManager",
    "MG": "00000000-0000-0000-0000-000000000002",
    "ManagementGroupName": "sysloger",
    "TimeGenerated [UTC]": "11/3/2020, 3:20:37.000 PM",
    "Computer": "sysloger",
    "RawData": "2020-11-03T15:18:38+00:00 julienc.alsid.app AlsidForAD[4]: \"0\" \"1\" \"test-forest\" \"test-directory\" \"test-checker-codename\" \"low\" \"DN/PATH\" \"devianceId\" \"profileId\" \"test-reason\" \"eventId\" \"test-attribute1\"=\"test-value1\" \"test-attribute2\"=\"test-value2",
    "Type": "AlsidForADLog_CL",
    "_ResourceId": "/subscriptions/8c038010-3c7a-40c6-985f-db5e8a04e59f/resourcegroups/julien_clement-rg/providers/microsoft.compute/virtualmachines/sysloger"
  },
  {
    "TenantId": "cc1bd33d-9555-48b2-9161-6d8ca52f65f8",
    "SourceSystem": "OpsManager",
    "MG": "00000000-0000-0000-0000-000000000002",
    "ManagementGroupName": "sysloger",
    "TimeGenerated [UTC]": "11/3/2020, 3:20:37.000 PM",
    "Computer": "sysloger",
    "RawData": "2020-11-03T15:18:39+00:00 julienc.alsid.app AlsidForAD[4]: \"0\" \"1\" \"test-forest\" \"test-directory\" \"test-checker-codename\" \"low\" \"DN/PATH\" \"devianceId\" \"profileId\" \"test-reason\" \"eventId\" \"test-attribute1\"=\"test-value1\" \"test-attribute2\"=\"test-value2",
    "Type": "AlsidForADLog_CL",
    "_ResourceId": "/subscriptions/8c038010-3c7a-40c6-985f-db5e8a04e59f/resourcegroups/julien_clement-rg/providers/microsoft.compute/virtualmachines/sysloger"
  },
  {
    "TenantId": "cc1bd33d-9555-48b2-9161-6d8ca52f65f8",
    "SourceSystem": "OpsManager",
    "MG": "00000000-0000-0000-0000-000000000002",
    "ManagementGroupName": "sysloger",
    "TimeGenerated [UTC]": "11/3/2020, 3:20:37.000 PM",
    "Computer": "sysloger",
    "RawData": "2020-11-03T15:18:40+00:00 julienc.alsid.app AlsidForAD[4]: \"0\" \"1\" \"test-forest\" \"test-directory\" \"test-checker-codename\" \"low\" \"DN/PATH\" \"devianceId\" \"profileId\" \"test-reason\" \"eventId\" \"test-attribute1\"=\"test-value1\" \"test-attribute2\"=\"test-value2",
    "Type": "AlsidForADLog_CL",
    "_ResourceId": "/subscriptions/8c038010-3c7a-40c6-985f-db5e8a04e59f/resourcegroups/julien_clement-rg/providers/microsoft.compute/virtualmachines/sysloger"
  },
  {
    "TenantId": "cc1bd33d-9555-48b2-9161-6d8ca52f65f8",
    "SourceSystem": "OpsManager",
    "MG": "00000000-0000-0000-0000-000000000002",
    "ManagementGroupName": "sysloger",
    "TimeGenerated [UTC]": "11/3/2020, 3:20:37.000 PM",
    "Computer": "sysloger",
    "RawData": "2020-11-03T15:18:42+00:00 julienc.alsid.app AlsidForAD[4]: \"0\" \"1\" \"test-forest\" \"test-directory\" \"test-checker-codename\" \"low\" \"DN/PATH\" \"devianceId\" \"profileId\" \"test-reason\" \"eventId\" \"test-attribute1\"=\"test-value1\" \"test-attribute2\"=\"test-value2",
    "Type": "AlsidForADLog_CL",
    "_ResourceId": "/subscriptions/8c038010-3c7a-40c6-985f-db5e8a04e59f/resourcegroups/julien_clement-rg/providers/microsoft.compute/virtualmachines/sysloger"
  },
  {
    "TenantId": "cc1bd33d-9555-48b2-9161-6d8ca52f65f8",
    "SourceSystem": "OpsManager",
    "MG": "00000000-0000-0000-0000-000000000002",
    "ManagementGroupName": "sysloger",
    "TimeGenerated [UTC]": "11/3/2020, 3:24:23.000 PM",
    "Computer": "sysloger",
    "RawData": "2020-11-03T15:22:39+00:00 julienc.alsid.app AlsidForAD[4]: \"0\" \"1\" \"test-forest\" \"test-directory\" \"test-checker-codename\" \"low\" \"DN/PATH\" \"devianceId\" \"profileId\" \"test-reason\" \"eventId\" \"test-attribute1\"=\"test-value1\" \"test-attribute2\"=\"test-value2",
    "Type": "AlsidForADLog_CL",
    "_ResourceId": "/subscriptions/8c038010-3c7a-40c6-985f-db5e8a04e59f/resourcegroups/julien_clement-rg/providers/microsoft.compute/virtualmachines/sysloger"
  },
  {
    "TenantId": "cc1bd33d-9555-48b2-9161-6d8ca52f65f8",
    "SourceSystem": "OpsManager",
    "MG": "00000000-0000-0000-0000-000000000002",
    "ManagementGroupName": "sysloger",
    "TimeGenerated [UTC]": "11/3/2020, 3:24:23.000 PM",
    "Computer": "sysloger",
    "RawData": "2020-11-03T15:22:40+00:00 julienc.alsid.app AlsidForAD[4]: \"0\" \"1\" \"test-forest\" \"test-directory\" \"test-checker-codename\" \"low\" \"DN/PATH\" \"devianceId\" \"profileId\" \"test-reason\" \"eventId\" \"test-attribute1\"=\"test-value1\" \"test-attribute2\"=\"test-value2",
    "Type": "AlsidForADLog_CL",
    "_ResourceId": "/subscriptions/8c038010-3c7a-40c6-985f-db5e8a04e59f/resourcegroups/julien_clement-rg/providers/microsoft.compute/virtualmachines/sysloger"
  },
  {
    "TenantId": "cc1bd33d-9555-48b2-9161-6d8ca52f65f8",
    "SourceSystem": "OpsManager",
    "MG": "00000000-0000-0000-0000-000000000002",
    "ManagementGroupName": "sysloger",
    "TimeGenerated [UTC]": "11/3/2020, 3:24:23.000 PM",
    "Computer": "sysloger",
    "RawData": "2020-11-03T15:22:41+00:00 julienc.alsid.app AlsidForAD[4]: \"0\" \"1\" \"test-forest\" \"test-directory\" \"test-checker-codename\" \"low\" \"DN/PATH\" \"devianceId\" \"profileId\" \"test-reason\" \"eventId\" \"test-attribute1\"=\"test-value1\" \"test-attribute2\"=\"test-value2",
    "Type": "AlsidForADLog_CL",
    "_ResourceId": "/subscriptions/8c038010-3c7a-40c6-985f-db5e8a04e59f/resourcegroups/julien_clement-rg/providers/microsoft.compute/virtualmachines/sysloger"
  },
  {
    "TenantId": "cc1bd33d-9555-48b2-9161-6d8ca52f65f8",
    "SourceSystem": "OpsManager",
    "MG": "00000000-0000-0000-0000-000000000002",
    "ManagementGroupName": "sysloger",
    "TimeGenerated [UTC]": "11/3/2020, 3:24:23.000 PM",
    "Computer": "sysloger",
    "RawData": "2020-11-03T15:22:42+00:00 julienc.alsid.app AlsidForAD[4]: \"0\" \"1\" \"test-forest\" \"test-directory\" \"test-checker-codename\" \"low\" \"DN/PATH\" \"devianceId\" \"profileId\" \"test-reason\" \"eventId\" \"test-attribute1\"=\"test-value1\" \"test-attribute2\"=\"test-value2",
    "Type": "AlsidForADLog_CL",
    "_ResourceId": "/subscriptions/8c038010-3c7a-40c6-985f-db5e8a04e59f/resourcegroups/julien_clement-rg/providers/microsoft.compute/virtualmachines/sysloger"
  },
  {
    "TenantId": "cc1bd33d-9555-48b2-9161-6d8ca52f65f8",
    "SourceSystem": "OpsManager",
    "MG": "00000000-0000-0000-0000-000000000002",
    "ManagementGroupName": "sysloger",
    "TimeGenerated [UTC]": "11/3/2020, 3:24:23.000 PM",
    "Computer": "sysloger",
    "RawData": "2020-11-03T15:22:43+00:00 julienc.alsid.app AlsidForAD[4]: \"0\" \"1\" \"test-forest\" \"test-directory\" \"test-checker-codename\" \"low\" \"DN/PATH\" \"devianceId\" \"profileId\" \"test-reason\" \"eventId\" \"test-attribute1\"=\"test-value1\" \"test-attribute2\"=\"test-value2",
    "Type": "AlsidForADLog_CL",
    "_ResourceId": "/subscriptions/8c038010-3c7a-40c6-985f-db5e8a04e59f/resourcegroups/julien_clement-rg/providers/microsoft.compute/virtualmachines/sysloger"
  },
  {
    "TenantId": "cc1bd33d-9555-48b2-9161-6d8ca52f65f8",
    "SourceSystem": "OpsManager",
    "MG": "00000000-0000-0000-0000-000000000002",
    "ManagementGroupName": "sysloger",
    "TimeGenerated [UTC]": "11/3/2020, 3:24:23.000 PM",
    "Computer": "sysloger",
    "RawData": "2020-11-03T15:22:43+00:00 julienc.alsid.app AlsidForAD[4]: \"0\" \"1\" \"test-forest\" \"test-directory\" \"test-checker-codename\" \"low\" \"DN/PATH\" \"devianceId\" \"profileId\" \"test-reason\" \"eventId\" \"test-attribute1\"=\"test-value1\" \"test-attribute2\"=\"test-value2",
    "Type": "AlsidForADLog_CL",
    "_ResourceId": "/subscriptions/8c038010-3c7a-40c6-985f-db5e8a04e59f/resourcegroups/julien_clement-rg/providers/microsoft.compute/virtualmachines/sysloger"
  },
  {
    "TenantId": "cc1bd33d-9555-48b2-9161-6d8ca52f65f8",
    "SourceSystem": "OpsManager",
    "MG": "00000000-0000-0000-0000-000000000002",
    "ManagementGroupName": "sysloger",
    "TimeGenerated [UTC]": "11/3/2020, 3:24:23.000 PM",
    "Computer": "sysloger",
    "RawData": "2020-11-03T15:22:44+00:00 julienc.alsid.app AlsidForAD[4]: \"0\" \"1\" \"test-forest\" \"test-directory\" \"test-checker-codename\" \"low\" \"DN/PATH\" \"devianceId\" \"profileId\" \"test-reason\" \"eventId\" \"test-attribute1\"=\"test-value1\" \"test-attribute2\"=\"test-value2",
    "Type": "AlsidForADLog_CL",
    "_ResourceId": "/subscriptions/8c038010-3c7a-40c6-985f-db5e8a04e59f/resourcegroups/julien_clement-rg/providers/microsoft.compute/virtualmachines/sysloger"
  },
  {
    "TenantId": "cc1bd33d-9555-48b2-9161-6d8ca52f65f8",
    "SourceSystem": "OpsManager",
    "MG": "00000000-0000-0000-0000-000000000002",
    "ManagementGroupName": "sysloger",
    "TimeGenerated [UTC]": "11/4/2020, 8:23:44.000 AM",
    "Computer": "sysloger",
    "RawData": "2020-11-04T08:22:01+00:00 julienc.alsid.app AlsidForAD[4]: \"0\" \"1\" \"test-forest\" \"test-directory\" \"test-checker-codename\" \"low\" \"DN/PATH\" \"devianceId\" \"profileId\" \"test-reason\" \"eventId\" \"test-attribute1\"=\"test-value1\" \"test-attribute2\"=\"test-value2",
    "Type": "AlsidForADLog_CL",
    "_ResourceId": "/subscriptions/8c038010-3c7a-40c6-985f-db5e8a04e59f/resourcegroups/julien_clement-rg/providers/microsoft.compute/virtualmachines/sysloger"
  },
  {
    "TenantId": "cc1bd33d-9555-48b2-9161-6d8ca52f65f8",
    "SourceSystem": "OpsManager",
    "MG": "00000000-0000-0000-0000-000000000002",
    "ManagementGroupName": "sysloger",
    "TimeGenerated [UTC]": "11/4/2020, 8:23:44.000 AM",
    "Computer": "sysloger",
    "RawData": "2020-11-04T08:22:02+00:00 julienc.alsid.app AlsidForAD[4]: \"0\" \"1\" \"test-forest\" \"test-directory\" \"test-checker-codename\" \"low\" \"DN/PATH\" \"devianceId\" \"profileId\" \"test-reason\" \"eventId\" \"test-attribute1\"=\"test-value1\" \"test-attribute2\"=\"test-value2",
    "Type": "AlsidForADLog_CL",
    "_ResourceId": "/subscriptions/8c038010-3c7a-40c6-985f-db5e8a04e59f/resourcegroups/julien_clement-rg/providers/microsoft.compute/virtualmachines/sysloger"
  },
  {
    "TenantId": "cc1bd33d-9555-48b2-9161-6d8ca52f65f8",
    "SourceSystem": "OpsManager",
    "MG": "00000000-0000-0000-0000-000000000002",
    "ManagementGroupName": "sysloger",
    "TimeGenerated [UTC]": "11/4/2020, 8:23:44.000 AM",
    "Computer": "sysloger",
    "RawData": "2020-11-04T08:22:03+00:00 julienc.alsid.app AlsidForAD[4]: \"0\" \"1\" \"test-forest\" \"test-directory\" \"test-checker-codename\" \"low\" \"DN/PATH\" \"devianceId\" \"profileId\" \"test-reason\" \"eventId\" \"test-attribute1\"=\"test-value1\" \"test-attribute2\"=\"test-value2",
    "Type": "AlsidForADLog_CL",
    "_ResourceId": "/subscriptions/8c038010-3c7a-40c6-985f-db5e8a04e59f/resourcegroups/julien_clement-rg/providers/microsoft.compute/virtualmachines/sysloger"
  },
  {
    "TenantId": "cc1bd33d-9555-48b2-9161-6d8ca52f65f8",
    "SourceSystem": "OpsManager",
    "MG": "00000000-0000-0000-0000-000000000002",
    "ManagementGroupName": "sysloger",
    "TimeGenerated [UTC]": "11/4/2020, 8:23:44.000 AM",
    "Computer": "sysloger",
    "RawData": "2020-11-04T08:22:04+00:00 julienc.alsid.app AlsidForAD[4]: \"0\" \"1\" \"test-forest\" \"test-directory\" \"test-checker-codename\" \"low\" \"DN/PATH\" \"devianceId\" \"profileId\" \"test-reason\" \"eventId\" \"test-attribute1\"=\"test-value1\" \"test-attribute2\"=\"test-value2",
    "Type": "AlsidForADLog_CL",
    "_ResourceId": "/subscriptions/8c038010-3c7a-40c6-985f-db5e8a04e59f/resourcegroups/julien_clement-rg/providers/microsoft.compute/virtualmachines/sysloger"
  },
  {
    "TenantId": "cc1bd33d-9555-48b2-9161-6d8ca52f65f8",
    "SourceSystem": "OpsManager",
    "MG": "00000000-0000-0000-0000-000000000002",
    "ManagementGroupName": "sysloger",
    "TimeGenerated [UTC]": "11/13/2020, 12:30:07.000 PM",
    "Computer": "sysloger",
    "RawData": "2020-11-13T12:28:45+00:00 julienc.alsid.app AlsidForAD[4]: \"1\" \"1\" \"Sulforest\" \"dc\" \"CN=dcadmin,CN=Users,DC=alsid,DC=corp\" \"2167\" \"\" \"whenchanged\"=\"\"2020-11-13T12:28:44.0000000Z\"",
    "Type": "AlsidForADLog_CL",
    "_ResourceId": "/subscriptions/8c038010-3c7a-40c6-985f-db5e8a04e59f/resourcegroups/julien_clement-rg/providers/microsoft.compute/virtualmachines/sysloger"
  },
  {
    "TenantId": "cc1bd33d-9555-48b2-9161-6d8ca52f65f8",
    "SourceSystem": "OpsManager",
    "MG": "00000000-0000-0000-0000-000000000002",
    "ManagementGroupName": "sysloger",
    "TimeGenerated [UTC]": "11/13/2020, 12:30:07.000 PM",
    "Computer": "sysloger",
    "RawData": "2020-11-13T12:28:45+00:00 julienc.alsid.app AlsidForAD[4]: \"1\" \"1\" \"Sulforest\" \"dc\" \"CN=dcadmin,CN=Users,DC=alsid,DC=corp\" \"2167\" \"\" \"usnchanged\"=\"64077",
    "Type": "AlsidForADLog_CL",
    "_ResourceId": "/subscriptions/8c038010-3c7a-40c6-985f-db5e8a04e59f/resourcegroups/julien_clement-rg/providers/microsoft.compute/virtualmachines/sysloger"
  },
  {
    "TenantId": "cc1bd33d-9555-48b2-9161-6d8ca52f65f8",
    "SourceSystem": "OpsManager",
    "MG": "00000000-0000-0000-0000-000000000002",
    "ManagementGroupName": "sysloger",
    "TimeGenerated [UTC]": "11/13/2020, 12:30:07.000 PM",
    "Computer": "sysloger",
    "RawData": "2020-11-13T12:28:45+00:00 julienc.alsid.app AlsidForAD[4]: \"1\" \"1\" \"Sulforest\" \"dc\" \"CN=dcadmin,CN=Users,DC=alsid,DC=corp\" \"2167\" \"\" \"lastlogontimestamp\"=\"\"2020-11-13T12:28:44.8372056Z\"",
    "Type": "AlsidForADLog_CL",
    "_ResourceId": "/subscriptions/8c038010-3c7a-40c6-985f-db5e8a04e59f/resourcegroups/julien_clement-rg/providers/microsoft.compute/virtualmachines/sysloger"
  },
  {
    "TenantId": "cc1bd33d-9555-48b2-9161-6d8ca52f65f8",
    "SourceSystem": "OpsManager",
    "MG": "00000000-0000-0000-0000-000000000002",
    "ManagementGroupName": "sysloger",
    "TimeGenerated [UTC]": "11/13/2020, 12:30:07.000 PM",
    "Computer": "sysloger",
    "RawData": "2020-11-13T12:28:45+00:00 julienc.alsid.app AlsidForAD[4]: \"0\" \"2\" \"Sulforest\" \"dc\" \"C-ADM-ACC-USAGE\" \"medium\" \"CN=dcadmin,CN=Users,DC=alsid,DC=corp\" \"25\" \"1\" \"R-ADM-ACC-USAGE\" \"2167\" \"LastLogonTimestamp\"=\"2020-11-13T12:28:45.1869142Z",
    "Type": "AlsidForADLog_CL",
    "_ResourceId": "/subscriptions/8c038010-3c7a-40c6-985f-db5e8a04e59f/resourcegroups/julien_clement-rg/providers/microsoft.compute/virtualmachines/sysloger"
  },
  {
    "TenantId": "cc1bd33d-9555-48b2-9161-6d8ca52f65f8",
    "SourceSystem": "OpsManager",
    "MG": "00000000-0000-0000-0000-000000000002",
    "ManagementGroupName": "sysloger",
    "TimeGenerated [UTC]": "11/12/2020, 10:02:08.000 PM",
    "Computer": "sysloger",
    "RawData": "2020-11-12T22:00:54+00:00 julienc.alsid.app AlsidForAD[4]: \"1\" \"1\" \"Sulforest\" \"dc\" \"CN=dc-vm,OU=Domain Controllers,DC=alsid,DC=corp\" \"2165\" \"\" \"whenchanged\"=\"\"2020-11-12T22:00:53.0000000Z\"",
    "Type": "AlsidForADLog_CL",
    "_ResourceId": "/subscriptions/8c038010-3c7a-40c6-985f-db5e8a04e59f/resourcegroups/julien_clement-rg/providers/microsoft.compute/virtualmachines/sysloger"
  },
  {
    "TenantId": "cc1bd33d-9555-48b2-9161-6d8ca52f65f8",
    "SourceSystem": "OpsManager",
    "MG": "00000000-0000-0000-0000-000000000002",
    "ManagementGroupName": "sysloger",
    "TimeGenerated [UTC]": "11/12/2020, 10:02:08.000 PM",
    "Computer": "sysloger",
    "RawData": "2020-11-12T22:00:54+00:00 julienc.alsid.app AlsidForAD[4]: \"1\" \"1\" \"Sulforest\" \"dc\" \"CN=dc-vm,OU=Domain Controllers,DC=alsid,DC=corp\" \"2165\" \"\" \"usnchanged\"=\"63199",
    "Type": "AlsidForADLog_CL",
    "_ResourceId": "/subscriptions/8c038010-3c7a-40c6-985f-db5e8a04e59f/resourcegroups/julien_clement-rg/providers/microsoft.compute/virtualmachines/sysloger"
  },
  {
    "TenantId": "cc1bd33d-9555-48b2-9161-6d8ca52f65f8",
    "SourceSystem": "OpsManager",
    "MG": "00000000-0000-0000-0000-000000000002",
    "ManagementGroupName": "sysloger",
    "TimeGenerated [UTC]": "11/12/2020, 10:02:08.000 PM",
    "Computer": "sysloger",
    "RawData": "2020-11-12T22:00:54+00:00 julienc.alsid.app AlsidForAD[4]: \"1\" \"1\" \"Sulforest\" \"dc\" \"CN=dc-vm,OU=Domain Controllers,DC=alsid,DC=corp\" \"2165\" \"\" \"lastlogontimestamp\"=\"\"2020-11-12T22:00:53.7703697Z\"",
    "Type": "AlsidForADLog_CL",
    "_ResourceId": "/subscriptions/8c038010-3c7a-40c6-985f-db5e8a04e59f/resourcegroups/julien_clement-rg/providers/microsoft.compute/virtualmachines/sysloger"
  },
  {
    "TenantId": "cc1bd33d-9555-48b2-9161-6d8ca52f65f8",
    "SourceSystem": "OpsManager",
    "MG": "00000000-0000-0000-0000-000000000002",
    "ManagementGroupName": "sysloger",
    "TimeGenerated [UTC]": "11/16/2020, 8:53:08.000 AM",
    "Computer": "sysloger",
    "RawData": "2020-11-16T08:51:41+00:00 julienc.alsid.app AlsidForAD[4]: \"0\" \"4\" \"MyForest\" \"MyDomain\" \"C-LAPS-UNSECURE-CONFIG\" \"medium\" \"CN=Schema,CN=Configuration,DC=alsid,DC=corp\" \"44\" \"1\" \"R-LAPS-MISSING-SCHEMA-EXTENSION\" \"4286",
    "Type": "AlsidForADLog_CL",
    "_ResourceId": "/subscriptions/8c038010-3c7a-40c6-985f-db5e8a04e59f/resourcegroups/julien_clement-rg/providers/microsoft.compute/virtualmachines/sysloger"
  },
  {
    "TenantId": "cc1bd33d-9555-48b2-9161-6d8ca52f65f8",
    "SourceSystem": "OpsManager",
    "MG": "00000000-0000-0000-0000-000000000002",
    "ManagementGroupName": "sysloger",
    "TimeGenerated [UTC]": "11/16/2020, 8:53:08.000 AM",
    "Computer": "sysloger",
    "RawData": "2020-11-16T08:51:41+00:00 julienc.alsid.app AlsidForAD[4]: \"0\" \"4\" \"MyForest\" \"MyDomain\" \"C-PASSWORD-DONT-EXPIRE\" \"medium\" \"CN=svc.alsid,CN=Managed Service Accounts,DC=alsid,DC=corp\" \"45\" \"1\" \"R-DONT-EXPIRE-SET\" \"4725\" \"Cn\"=\"svc.alsid",
    "Type": "AlsidForADLog_CL",
    "_ResourceId": "/subscriptions/8c038010-3c7a-40c6-985f-db5e8a04e59f/resourcegroups/julien_clement-rg/providers/microsoft.compute/virtualmachines/sysloger"
  },
  {
    "TenantId": "cc1bd33d-9555-48b2-9161-6d8ca52f65f8",
    "SourceSystem": "OpsManager",
    "MG": "00000000-0000-0000-0000-000000000002",
    "ManagementGroupName": "sysloger",
    "TimeGenerated [UTC]": "11/16/2020, 8:53:08.000 AM",
    "Computer": "sysloger",
    "RawData": "2020-11-16T08:51:41+00:00 julienc.alsid.app AlsidForAD[4]: \"0\" \"4\" \"MyForest\" \"MyDomain\" \"C-USERS-CAN-JOIN-COMPUTERS\" \"medium\" \"DC=alsid,DC=corp\" \"47\" \"1\" \"R-USERS-CAN-JOIN-COMPUTERS-IN-DOMAIN\" \"4259\" \"MachineAccountQuota\"=\"10",
    "Type": "AlsidForADLog_CL",
    "_ResourceId": "/subscriptions/8c038010-3c7a-40c6-985f-db5e8a04e59f/resourcegroups/julien_clement-rg/providers/microsoft.compute/virtualmachines/sysloger"
  },
  {
    "TenantId": "cc1bd33d-9555-48b2-9161-6d8ca52f65f8",
    "SourceSystem": "OpsManager",
    "MG": "00000000-0000-0000-0000-000000000002",
    "ManagementGroupName": "sysloger",
    "TimeGenerated [UTC]": "11/16/2020, 8:53:08.000 AM",
    "Computer": "sysloger",
    "RawData": "2020-11-16T08:51:41+00:00 julienc.alsid.app AlsidForAD[4]: \"0\" \"4\" \"MyForest\" \"MyDomain\" \"C-UNCONST-DELEG\" \"critical\" \"CN=dcadmin,CN=Users,DC=alsid,DC=corp\" \"50\" \"1\" \"R-DELEG-PRIVUSERS-NOT-PROTECTED\" \"4257\" \"Cn\"=\"dcadmin\" \"PrivilegesPath\"=\"CN=Administrators,CN=Builtin,DC=alsid,DC=corp",
    "Type": "AlsidForADLog_CL",
    "_ResourceId": "/subscriptions/8c038010-3c7a-40c6-985f-db5e8a04e59f/resourcegroups/julien_clement-rg/providers/microsoft.compute/virtualmachines/sysloger"
  },
  {
    "TenantId": "cc1bd33d-9555-48b2-9161-6d8ca52f65f8",
    "SourceSystem": "OpsManager",
    "MG": "00000000-0000-0000-0000-000000000002",
    "ManagementGroupName": "sysloger",
    "TimeGenerated [UTC]": "11/16/2020, 8:53:08.000 AM",
    "Computer": "sysloger",
    "RawData": "2020-11-16T08:51:41+00:00 julienc.alsid.app AlsidForAD[4]: \"0\" \"4\" \"MyForest\" \"MyDomain\" \"C-CLEARTEXT-PASSWORD\" \"high\" \"CN=Windows Authorization Access Group,CN=Builtin,DC=alsid,DC=corp\" \"49\" \"1\" \"R-POTENTIAL-CLEARTEXT-PWD-IN-READABLE-FIELDS\" \"4395\" \"AttributeName\"=\"description\" \"PasswordCandidate\"=\"tokenGroupsGlobalAndUniversal",
    "Type": "AlsidForADLog_CL",
    "_ResourceId": "/subscriptions/8c038010-3c7a-40c6-985f-db5e8a04e59f/resourcegroups/julien_clement-rg/providers/microsoft.compute/virtualmachines/sysloger"
  },
  {
    "TenantId": "cc1bd33d-9555-48b2-9161-6d8ca52f65f8",
    "SourceSystem": "OpsManager",
    "MG": "00000000-0000-0000-0000-000000000002",
    "ManagementGroupName": "sysloger",
    "TimeGenerated [UTC]": "11/16/2020, 8:53:08.000 AM",
    "Computer": "sysloger",
    "RawData": "2020-11-16T08:51:41+00:00 julienc.alsid.app AlsidForAD[4]: \"0\" \"4\" \"MyForest\" \"MyDomain\" \"C-ADM-ACC-USAGE\" \"medium\" \"CN=dcadmin,CN=Users,DC=alsid,DC=corp\" \"48\" \"1\" \"R-ADM-ACC-USAGE\" \"4257\" \"LastLogonTimestamp\"=\"2020-11-13T12:28:44.8372056Z",
    "Type": "AlsidForADLog_CL",
    "_ResourceId": "/subscriptions/8c038010-3c7a-40c6-985f-db5e8a04e59f/resourcegroups/julien_clement-rg/providers/microsoft.compute/virtualmachines/sysloger"
  },
  {
    "TenantId": "cc1bd33d-9555-48b2-9161-6d8ca52f65f8",
    "SourceSystem": "OpsManager",
    "MG": "00000000-0000-0000-0000-000000000002",
    "ManagementGroupName": "sysloger",
    "TimeGenerated [UTC]": "11/16/2020, 8:53:08.000 AM",
    "Computer": "sysloger",
    "RawData": "2020-11-16T08:51:41+00:00 julienc.alsid.app AlsidForAD[4]: \"0\" \"4\" \"MyForest\" \"MyDomain\" \"C-PROTECTED-USERS-GROUP-UNUSED\" \"high\" \"CN=Protected Users,CN=Users,DC=alsid,DC=corp\" \"46\" \"1\" \"R-PROTECTED-USERS-GROUP-UNUSED\" \"4423\" \"SID\"=\"S-1-5-21-4005652508-1286318552-3886753630-525",
    "Type": "AlsidForADLog_CL",
    "_ResourceId": "/subscriptions/8c038010-3c7a-40c6-985f-db5e8a04e59f/resourcegroups/julien_clement-rg/providers/microsoft.compute/virtualmachines/sysloger"
  },
  {
    "TenantId": "cc1bd33d-9555-48b2-9161-6d8ca52f65f8",
    "SourceSystem": "OpsManager",
    "MG": "00000000-0000-0000-0000-000000000002",
    "ManagementGroupName": "sysloger",
    "TimeGenerated [UTC]": "11/16/2020, 8:53:08.000 AM",
    "Computer": "sysloger",
    "RawData": "2020-11-16T08:51:41+00:00 julienc.alsid.app AlsidForAD[4]: \"0\" \"4\" \"MyForest\" \"MyDomain\" \"C-PASSWORD-POLICY\" \"critical\" \"\\\\alsid.corp\\sysvol\\alsid.corp\\Policies\\{31B2F340-016D-11D2-945F-00C04FB984F9}\\MACHINE\\Microsoft\\Windows NT\\SecEdit\\GptTmpl.inf\" \"51\" \"1\" \"R-LOCAL-ACCOUNTS-MAX-PWD-AGE-TOO-OLD\" \"4545\" \"GpoPath\"=\"Default Domain Policy\" \"MaximumPasswordAge\"=\"365\" \"OptionMaxPasswordRenewalAgeInDays\"=\"180\" \"ComputerCn\"=\"tools-vm",
    "Type": "AlsidForADLog_CL",
    "_ResourceId": "/subscriptions/8c038010-3c7a-40c6-985f-db5e8a04e59f/resourcegroups/julien_clement-rg/providers/microsoft.compute/virtualmachines/sysloger"
  },
  {
    "TenantId": "cc1bd33d-9555-48b2-9161-6d8ca52f65f8",
    "SourceSystem": "OpsManager",
    "MG": "00000000-0000-0000-0000-000000000002",
    "ManagementGroupName": "sysloger",
    "TimeGenerated [UTC]": "11/16/2020, 8:53:08.000 AM",
    "Computer": "sysloger",
    "RawData": "2020-11-16T08:51:41+00:00 julienc.alsid.app AlsidForAD[4]: \"0\" \"4\" \"MyForest\" \"MyDomain\" \"C-PASSWORD-POLICY\" \"critical\" \"\\\\alsid.corp\\sysvol\\alsid.corp\\Policies\\{31B2F340-016D-11D2-945F-00C04FB984F9}\\MACHINE\\Microsoft\\Windows NT\\SecEdit\\GptTmpl.inf\" \"52\" \"1\" \"R-LOCAL-ACCOUNTS-PWD-HIST-TOO-SMALL\" \"4545\" \"GpoPath\"=\"Default Domain Policy\" \"PasswordHistorySize\"=\"1\" \"OptionPasswordHistoryLength\"=\"5\" \"ComputerCn\"=\"dc-vm",
    "Type": "AlsidForADLog_CL",
    "_ResourceId": "/subscriptions/8c038010-3c7a-40c6-985f-db5e8a04e59f/resourcegroups/julien_clement-rg/providers/microsoft.compute/virtualmachines/sysloger"
  },
  {
    "TenantId": "cc1bd33d-9555-48b2-9161-6d8ca52f65f8",
    "SourceSystem": "OpsManager",
    "MG": "00000000-0000-0000-0000-000000000002",
    "ManagementGroupName": "sysloger",
    "TimeGenerated [UTC]": "11/16/2020, 8:53:08.000 AM",
    "Computer": "sysloger",
    "RawData": "2020-11-16T08:51:41+00:00 julienc.alsid.app AlsidForAD[4]: \"0\" \"4\" \"MyForest\" \"MyDomain\" \"C-PASSWORD-POLICY\" \"critical\" \"\\\\alsid.corp\\sysvol\\alsid.corp\\Policies\\{31B2F340-016D-11D2-945F-00C04FB984F9}\\MACHINE\\Microsoft\\Windows NT\\SecEdit\\GptTmpl.inf\" \"53\" \"1\" \"R-LOCAL-ACCOUNTS-PWD-HIST-TOO-SMALL\" \"4545\" \"GpoPath\"=\"Default Domain Policy\" \"PasswordHistorySize\"=\"1\" \"OptionPasswordHistoryLength\"=\"5\" \"ComputerCn\"=\"tools-vm",
    "Type": "AlsidForADLog_CL",
    "_ResourceId": "/subscriptions/8c038010-3c7a-40c6-985f-db5e8a04e59f/resourcegroups/julien_clement-rg/providers/microsoft.compute/virtualmachines/sysloger"
  },
  {
    "TenantId": "cc1bd33d-9555-48b2-9161-6d8ca52f65f8",
    "SourceSystem": "OpsManager",
    "MG": "00000000-0000-0000-0000-000000000002",
    "ManagementGroupName": "sysloger",
    "TimeGenerated [UTC]": "11/16/2020, 8:53:08.000 AM",
    "Computer": "sysloger",
    "RawData": "2020-11-16T08:51:41+00:00 julienc.alsid.app AlsidForAD[4]: \"0\" \"4\" \"MyForest\" \"MyDomain\" \"C-PASSWORD-POLICY\" \"critical\" \"\\\\alsid.corp\\sysvol\\alsid.corp\\Policies\" \"57\" \"1\" \"R-PSO-DONT-EXIST\" \"4531\" \"DomainName\"=\"MyDomain",
    "Type": "AlsidForADLog_CL",
    "_ResourceId": "/subscriptions/8c038010-3c7a-40c6-985f-db5e8a04e59f/resourcegroups/julien_clement-rg/providers/microsoft.compute/virtualmachines/sysloger"
  },
  {
    "TenantId": "cc1bd33d-9555-48b2-9161-6d8ca52f65f8",
    "SourceSystem": "OpsManager",
    "MG": "00000000-0000-0000-0000-000000000002",
    "ManagementGroupName": "sysloger",
    "TimeGenerated [UTC]": "11/16/2020, 8:53:08.000 AM",
    "Computer": "sysloger",
    "RawData": "2020-11-16T08:51:41+00:00 julienc.alsid.app AlsidForAD[4]: \"0\" \"4\" \"MyForest\" \"MyDomain\" \"C-PASSWORD-POLICY\" \"critical\" \"\\\\alsid.corp\\sysvol\\alsid.corp\\Policies\\{31B2F340-016D-11D2-945F-00C04FB984F9}\\MACHINE\\Microsoft\\Windows NT\\SecEdit\\GptTmpl.inf\" \"55\" \"1\" \"R-LOCAL-ACCOUNTS-MAX-PWD-AGE-TOO-OLD\" \"4545\" \"GpoPath\"=\"Default Domain Policy\" \"MaximumPasswordAge\"=\"365\" \"OptionMaxPasswordRenewalAgeInDays\"=\"180\" \"ComputerCn\"=\"dc-vm",
    "Type": "AlsidForADLog_CL",
    "_ResourceId": "/subscriptions/8c038010-3c7a-40c6-985f-db5e8a04e59f/resourcegroups/julien_clement-rg/providers/microsoft.compute/virtualmachines/sysloger"
  },
  {
    "TenantId": "cc1bd33d-9555-48b2-9161-6d8ca52f65f8",
    "SourceSystem": "OpsManager",
    "MG": "00000000-0000-0000-0000-000000000002",
    "ManagementGroupName": "sysloger",
    "TimeGenerated [UTC]": "11/16/2020, 8:53:08.000 AM",
    "Computer": "sysloger",
    "RawData": "2020-11-16T08:51:41+00:00 julienc.alsid.app AlsidForAD[4]: \"0\" \"4\" \"MyForest\" \"MyDomain\" \"C-PASSWORD-DONT-EXPIRE\" \"medium\" \"CN=test test,CN=Users,DC=alsid,DC=corp\" \"54\" \"1\" \"R-DONT-EXPIRE-SET\" \"4732\" \"Cn\"=\"test test",
    "Type": "AlsidForADLog_CL",
    "_ResourceId": "/subscriptions/8c038010-3c7a-40c6-985f-db5e8a04e59f/resourcegroups/julien_clement-rg/providers/microsoft.compute/virtualmachines/sysloger"
  },
  {
    "TenantId": "cc1bd33d-9555-48b2-9161-6d8ca52f65f8",
    "SourceSystem": "OpsManager",
    "MG": "00000000-0000-0000-0000-000000000002",
    "ManagementGroupName": "sysloger",
    "TimeGenerated [UTC]": "11/16/2020, 8:53:08.000 AM",
    "Computer": "sysloger",
    "RawData": "2020-11-16T08:51:41+00:00 julienc.alsid.app AlsidForAD[4]: \"0\" \"4\" \"MyForest\" \"MyDomain\" \"C-PASSWORD-POLICY\" \"critical\" \"\\\\alsid.corp\\sysvol\\alsid.corp\\Policies\\{31B2F340-016D-11D2-945F-00C04FB984F9}\\MACHINE\\Microsoft\\Windows NT\\SecEdit\\GptTmpl.inf\" \"56\" \"1\" \"R-LOCAL-ACCOUNTS-PWD-LOCK-THRESHOLD\" \"4545\" \"GpoPath\"=\"Default Domain Policy\" \"LockoutBadCount\"=\"0\" \"OptionLockoutThreshold\"=\"999\" \"ComputerCn\"=\"tools-vm",
    "Type": "AlsidForADLog_CL",
    "_ResourceId": "/subscriptions/8c038010-3c7a-40c6-985f-db5e8a04e59f/resourcegroups/julien_clement-rg/providers/microsoft.compute/virtualmachines/sysloger"
  },
  {
    "TenantId": "cc1bd33d-9555-48b2-9161-6d8ca52f65f8",
    "SourceSystem": "OpsManager",
    "MG": "00000000-0000-0000-0000-000000000002",
    "ManagementGroupName": "sysloger",
    "TimeGenerated [UTC]": "11/16/2020, 8:53:08.000 AM",
    "Computer": "sysloger",
    "RawData": "2020-11-16T08:51:41+00:00 julienc.alsid.app AlsidForAD[4]: \"0\" \"4\" \"MyForest\" \"MyDomain\" \"C-PASSWORD-POLICY\" \"critical\" \"\\\\alsid.corp\\sysvol\\alsid.corp\\Policies\\{31B2F340-016D-11D2-945F-00C04FB984F9}\\MACHINE\\Microsoft\\Windows NT\\SecEdit\\GptTmpl.inf\" \"58\" \"1\" \"R-LOCAL-ACCOUNTS-PWD-LOCK-THRESHOLD\" \"4545\" \"GpoPath\"=\"Default Domain Policy\" \"LockoutBadCount\"=\"0\" \"OptionLockoutThreshold\"=\"999\" \"ComputerCn\"=\"dc-vm",
    "Type": "AlsidForADLog_CL",
    "_ResourceId": "/subscriptions/8c038010-3c7a-40c6-985f-db5e8a04e59f/resourcegroups/julien_clement-rg/providers/microsoft.compute/virtualmachines/sysloger"
  },
  {
    "TenantId": "cc1bd33d-9555-48b2-9161-6d8ca52f65f8",
    "SourceSystem": "OpsManager",
    "MG": "00000000-0000-0000-0000-000000000002",
    "ManagementGroupName": "sysloger",
    "TimeGenerated [UTC]": "11/16/2020, 8:53:08.000 AM",
    "Computer": "sysloger",
    "RawData": "2020-11-16T08:51:41+00:00 julienc.alsid.app AlsidForAD[4]: \"0\" \"4\" \"MyForest\" \"MyDomain\" \"C-GPO-HARDENING\" \"medium\" \"\\\\alsid.corp\\sysvol\\alsid.corp\\Policies\" \"59\" \"1\" \"R-ALLOW-NTLM-PROTO-FOR-POLICIES-FOLDER\" \"4531\" \"DomainName\"=\"MyDomain",
    "Type": "AlsidForADLog_CL",
    "_ResourceId": "/subscriptions/8c038010-3c7a-40c6-985f-db5e8a04e59f/resourcegroups/julien_clement-rg/providers/microsoft.compute/virtualmachines/sysloger"
  },
  {
    "TenantId": "cc1bd33d-9555-48b2-9161-6d8ca52f65f8",
    "SourceSystem": "OpsManager",
    "MG": "00000000-0000-0000-0000-000000000002",
    "ManagementGroupName": "sysloger",
    "TimeGenerated [UTC]": "11/16/2020, 8:53:08.000 AM",
    "Computer": "sysloger",
    "RawData": "2020-11-16T08:51:41+00:00 julienc.alsid.app AlsidForAD[4]: \"0\" \"4\" \"MyForest\" \"MyDomain\" \"C-GPO-HARDENING\" \"medium\" \"\\\\alsid.corp\\sysvol\\alsid.corp\\Policies\" \"60\" \"1\" \"R-ALLOW-SMBV1-PROTO-FOR-POLICIES-FOLDER\" \"4531\" \"DomainName\"=\"MyDomain",
    "Type": "AlsidForADLog_CL",
    "_ResourceId": "/subscriptions/8c038010-3c7a-40c6-985f-db5e8a04e59f/resourcegroups/julien_clement-rg/providers/microsoft.compute/virtualmachines/sysloger"
  },
  {
    "TenantId": "cc1bd33d-9555-48b2-9161-6d8ca52f65f8",
    "SourceSystem": "OpsManager",
    "MG": "00000000-0000-0000-0000-000000000002",
    "ManagementGroupName": "sysloger",
    "TimeGenerated [UTC]": "11/16/2020, 8:53:08.000 AM",
    "Computer": "sysloger",
    "RawData": "2020-11-16T08:51:41+00:00 julienc.alsid.app AlsidForAD[4]: \"0\" \"4\" \"MyForest\" \"MyDomain\" \"C-LAPS-UNSECURE-CONFIG\" \"medium\" \"\\\\alsid.corp\\sysvol\\alsid.corp\\Policies\" \"61\" \"1\" \"R-LAPS-GPO-FILE-NOT-DEPLOYED\" \"4531\" \"DomainName\"=\"MyDomain",
    "Type": "AlsidForADLog_CL",
    "_ResourceId": "/subscriptions/8c038010-3c7a-40c6-985f-db5e8a04e59f/resourcegroups/julien_clement-rg/providers/microsoft.compute/virtualmachines/sysloger"
  },
  {
    "TenantId": "cc1bd33d-9555-48b2-9161-6d8ca52f65f8",
    "SourceSystem": "OpsManager",
    "MG": "00000000-0000-0000-0000-000000000002",
    "ManagementGroupName": "sysloger",
    "TimeGenerated [UTC]": "11/1/2020, 4:07:51.000 PM",
    "Computer": "sysloger",
    "RawData": "2020-11-01T16:06:18+00:00 julienc.alsid.app AlsidForAD[4]: \"1\" \"1\" \"Sulforest\" \"dc\" \"CN=tools-vm,CN=Computers,DC=alsid,DC=corp\" \"2148\" \"\" \"lastlogontimestamp\"=\"\"2020-11-01T16:06:17.4073599Z\"",
    "Type": "AlsidForADLog_CL",
    "_ResourceId": "/subscriptions/8c038010-3c7a-40c6-985f-db5e8a04e59f/resourcegroups/julien_clement-rg/providers/microsoft.compute/virtualmachines/sysloger"
  },
  {
    "TenantId": "cc1bd33d-9555-48b2-9161-6d8ca52f65f8",
    "SourceSystem": "OpsManager",
    "MG": "00000000-0000-0000-0000-000000000002",
    "ManagementGroupName": "sysloger",
    "TimeGenerated [UTC]": "11/1/2020, 4:07:51.000 PM",
    "Computer": "sysloger",
    "RawData": "2020-11-01T16:06:18+00:00 julienc.alsid.app AlsidForAD[4]: \"1\" \"1\" \"Sulforest\" \"dc\" \"CN=tools-vm,CN=Computers,DC=alsid,DC=corp\" \"2148\" \"\" \"whenchanged\"=\"\"2020-11-01T16:06:17.0000000Z\"",
    "Type": "AlsidForADLog_CL",
    "_ResourceId": "/subscriptions/8c038010-3c7a-40c6-985f-db5e8a04e59f/resourcegroups/julien_clement-rg/providers/microsoft.compute/virtualmachines/sysloger"
  },
  {
    "TenantId": "cc1bd33d-9555-48b2-9161-6d8ca52f65f8",
    "SourceSystem": "OpsManager",
    "MG": "00000000-0000-0000-0000-000000000002",
    "ManagementGroupName": "sysloger",
    "TimeGenerated [UTC]": "11/1/2020, 4:07:51.000 PM",
    "Computer": "sysloger",
    "RawData": "2020-11-01T16:06:18+00:00 julienc.alsid.app AlsidForAD[4]: \"1\" \"1\" \"Sulforest\" \"dc\" \"CN=tools-vm,CN=Computers,DC=alsid,DC=corp\" \"2148\" \"\" \"usnchanged\"=\"45909",
    "Type": "AlsidForADLog_CL",
    "_ResourceId": "/subscriptions/8c038010-3c7a-40c6-985f-db5e8a04e59f/resourcegroups/julien_clement-rg/providers/microsoft.compute/virtualmachines/sysloger"
  },
  {
    "TenantId": "cc1bd33d-9555-48b2-9161-6d8ca52f65f8",
    "SourceSystem": "OpsManager",
    "MG": "00000000-0000-0000-0000-000000000002",
    "ManagementGroupName": "sysloger",
    "TimeGenerated [UTC]": "11/2/2020, 1:33:04.000 AM",
    "Computer": "sysloger",
    "RawData": "2020-11-02T01:31:04+00:00 julienc.alsid.app AlsidForAD[4]: \"1\" \"1\" \"Sulforest\" \"dc\" \"CN=dc-vm,OU=Domain Controllers,DC=alsid,DC=corp\" \"2149\" \"\" \"lastlogontimestamp\"=\"\"2020-11-02T01:31:04.0333473Z\"",
    "Type": "AlsidForADLog_CL",
    "_ResourceId": "/subscriptions/8c038010-3c7a-40c6-985f-db5e8a04e59f/resourcegroups/julien_clement-rg/providers/microsoft.compute/virtualmachines/sysloger"
  },
  {
    "TenantId": "cc1bd33d-9555-48b2-9161-6d8ca52f65f8",
    "SourceSystem": "OpsManager",
    "MG": "00000000-0000-0000-0000-000000000002",
    "ManagementGroupName": "sysloger",
    "TimeGenerated [UTC]": "11/2/2020, 1:33:04.000 AM",
    "Computer": "sysloger",
    "RawData": "2020-11-02T01:31:04+00:00 julienc.alsid.app AlsidForAD[4]: \"1\" \"1\" \"Sulforest\" \"dc\" \"CN=dc-vm,OU=Domain Controllers,DC=alsid,DC=corp\" \"2149\" \"\" \"usnchanged\"=\"46477",
    "Type": "AlsidForADLog_CL",
    "_ResourceId": "/subscriptions/8c038010-3c7a-40c6-985f-db5e8a04e59f/resourcegroups/julien_clement-rg/providers/microsoft.compute/virtualmachines/sysloger"
  },
  {
    "TenantId": "cc1bd33d-9555-48b2-9161-6d8ca52f65f8",
    "SourceSystem": "OpsManager",
    "MG": "00000000-0000-0000-0000-000000000002",
    "ManagementGroupName": "sysloger",
    "TimeGenerated [UTC]": "11/2/2020, 1:33:04.000 AM",
    "Computer": "sysloger",
    "RawData": "2020-11-02T01:31:04+00:00 julienc.alsid.app AlsidForAD[4]: \"1\" \"1\" \"Sulforest\" \"dc\" \"CN=dc-vm,OU=Domain Controllers,DC=alsid,DC=corp\" \"2149\" \"\" \"whenchanged\"=\"\"2020-11-02T01:31:04.0000000Z\"",
    "Type": "AlsidForADLog_CL",
    "_ResourceId": "/subscriptions/8c038010-3c7a-40c6-985f-db5e8a04e59f/resourcegroups/julien_clement-rg/providers/microsoft.compute/virtualmachines/sysloger"
  },
  {
    "TenantId": "cc1bd33d-9555-48b2-9161-6d8ca52f65f8",
    "SourceSystem": "OpsManager",
    "MG": "00000000-0000-0000-0000-000000000002",
    "ManagementGroupName": "sysloger",
    "TimeGenerated [UTC]": "11/5/2020, 4:38:58.000 PM",
    "Computer": "sysloger",
    "RawData": "2020-11-05T16:38:16+00:00 julienc.alsid.app AlsidForAD[4]: \"1\" \"1\" \"Sulforest\" \"dc\" \"CN=ok ok. ok,CN=Users,DC=alsid,DC=corp\" \"2158\" \"\" \"useraccountcontrol\"=\"\"NORMAL \"",
    "Type": "AlsidForADLog_CL",
    "_ResourceId": "/subscriptions/8c038010-3c7a-40c6-985f-db5e8a04e59f/resourcegroups/julien_clement-rg/providers/microsoft.compute/virtualmachines/sysloger"
  },
  {
    "TenantId": "cc1bd33d-9555-48b2-9161-6d8ca52f65f8",
    "SourceSystem": "OpsManager",
    "MG": "00000000-0000-0000-0000-000000000002",
    "ManagementGroupName": "sysloger",
    "TimeGenerated [UTC]": "11/5/2020, 4:38:58.000 PM",
    "Computer": "sysloger",
    "RawData": "2020-11-05T16:38:16+00:00 julienc.alsid.app AlsidForAD[4]: \"1\" \"1\" \"Sulforest\" \"dc\" \"CN=ok ok. ok,CN=Users,DC=alsid,DC=corp\" \"2158\" \"\" \"usnchanged\"=\"51748",
    "Type": "AlsidForADLog_CL",
    "_ResourceId": "/subscriptions/8c038010-3c7a-40c6-985f-db5e8a04e59f/resourcegroups/julien_clement-rg/providers/microsoft.compute/virtualmachines/sysloger"
  },
  {
    "TenantId": "cc1bd33d-9555-48b2-9161-6d8ca52f65f8",
    "SourceSystem": "OpsManager",
    "MG": "00000000-0000-0000-0000-000000000002",
    "ManagementGroupName": "sysloger",
    "TimeGenerated [UTC]": "11/5/2020, 4:38:58.000 PM",
    "Computer": "sysloger",
    "RawData": "2020-11-05T16:38:17+00:00 julienc.alsid.app AlsidForAD[4]: \"1\" \"1\" \"Sulforest\" \"dc\" \"CN=ok ok. ok,CN=Users,DC=alsid,DC=corp\" \"2153\" \"New object\" \"objectclass\"=\"[\"top\",\"person\",\"organizationalPerson\",\"user\"]",
    "Type": "AlsidForADLog_CL",
    "_ResourceId": "/subscriptions/8c038010-3c7a-40c6-985f-db5e8a04e59f/resourcegroups/julien_clement-rg/providers/microsoft.compute/virtualmachines/sysloger"
  },
  {
    "TenantId": "cc1bd33d-9555-48b2-9161-6d8ca52f65f8",
    "SourceSystem": "OpsManager",
    "MG": "00000000-0000-0000-0000-000000000002",
    "ManagementGroupName": "sysloger",
    "TimeGenerated [UTC]": "11/5/2020, 4:38:58.000 PM",
    "Computer": "sysloger",
    "RawData": "2020-11-05T16:38:17+00:00 julienc.alsid.app AlsidForAD[4]: \"1\" \"1\" \"Sulforest\" \"dc\" \"CN=ok ok. ok,CN=Users,DC=alsid,DC=corp\" \"2153\" \"New object\" \"badpwdcount\"=\"0",
    "Type": "AlsidForADLog_CL",
    "_ResourceId": "/subscriptions/8c038010-3c7a-40c6-985f-db5e8a04e59f/resourcegroups/julien_clement-rg/providers/microsoft.compute/virtualmachines/sysloger"
  },
  {
    "TenantId": "cc1bd33d-9555-48b2-9161-6d8ca52f65f8",
    "SourceSystem": "OpsManager",
    "MG": "00000000-0000-0000-0000-000000000002",
    "ManagementGroupName": "sysloger",
    "TimeGenerated [UTC]": "11/5/2020, 4:38:58.000 PM",
    "Computer": "sysloger",
    "RawData": "2020-11-05T16:38:17+00:00 julienc.alsid.app AlsidForAD[4]: \"1\" \"1\" \"Sulforest\" \"dc\" \"CN=ok ok. ok,CN=Users,DC=alsid,DC=corp\" \"2153\" \"New object\" \"accountexpires\"=\"\"NEVER\"",
    "Type": "AlsidForADLog_CL",
    "_ResourceId": "/subscriptions/8c038010-3c7a-40c6-985f-db5e8a04e59f/resourcegroups/julien_clement-rg/providers/microsoft.compute/virtualmachines/sysloger"
  },
  {
    "TenantId": "cc1bd33d-9555-48b2-9161-6d8ca52f65f8",
    "SourceSystem": "OpsManager",
    "MG": "00000000-0000-0000-0000-000000000002",
    "ManagementGroupName": "sysloger",
    "TimeGenerated [UTC]": "11/5/2020, 4:38:58.000 PM",
    "Computer": "sysloger",
    "RawData": "2020-11-05T16:38:17+00:00 julienc.alsid.app AlsidForAD[4]: \"1\" \"1\" \"Sulforest\" \"dc\" \"CN=ok ok. ok,CN=Users,DC=alsid,DC=corp\" \"2153\" \"New object\" \"pwdlastset\"=\"\"1601-01-01T00:00:00.0000000Z\"",
    "Type": "AlsidForADLog_CL",
    "_ResourceId": "/subscriptions/8c038010-3c7a-40c6-985f-db5e8a04e59f/resourcegroups/julien_clement-rg/providers/microsoft.compute/virtualmachines/sysloger"
  },
  {
    "TenantId": "cc1bd33d-9555-48b2-9161-6d8ca52f65f8",
    "SourceSystem": "OpsManager",
    "MG": "00000000-0000-0000-0000-000000000002",
    "ManagementGroupName": "sysloger",
    "TimeGenerated [UTC]": "11/5/2020, 4:38:58.000 PM",
    "Computer": "sysloger",
    "RawData": "2020-11-05T16:38:17+00:00 julienc.alsid.app AlsidForAD[4]: \"1\" \"1\" \"Sulforest\" \"dc\" \"CN=ok ok. ok,CN=Users,DC=alsid,DC=corp\" \"2153\" \"New object\" \"useraccountcontrol\"=\"\"DISABLE PASSWD_NOTREQD NORMAL \"",
    "Type": "AlsidForADLog_CL",
    "_ResourceId": "/subscriptions/8c038010-3c7a-40c6-985f-db5e8a04e59f/resourcegroups/julien_clement-rg/providers/microsoft.compute/virtualmachines/sysloger"
  },
  {
    "TenantId": "cc1bd33d-9555-48b2-9161-6d8ca52f65f8",
    "SourceSystem": "OpsManager",
    "MG": "00000000-0000-0000-0000-000000000002",
    "ManagementGroupName": "sysloger",
    "TimeGenerated [UTC]": "11/5/2020, 4:38:58.000 PM",
    "Computer": "sysloger",
    "RawData": "2020-11-05T16:38:17+00:00 julienc.alsid.app AlsidForAD[4]: \"1\" \"1\" \"Sulforest\" \"dc\" \"CN=ok ok. ok,CN=Users,DC=alsid,DC=corp\" \"2153\" \"New object\" \"instancetype\"=\"4",
    "Type": "AlsidForADLog_CL",
    "_ResourceId": "/subscriptions/8c038010-3c7a-40c6-985f-db5e8a04e59f/resourcegroups/julien_clement-rg/providers/microsoft.compute/virtualmachines/sysloger"
  },
  {
    "TenantId": "cc1bd33d-9555-48b2-9161-6d8ca52f65f8",
    "SourceSystem": "OpsManager",
    "MG": "00000000-0000-0000-0000-000000000002",
    "ManagementGroupName": "sysloger",
    "TimeGenerated [UTC]": "11/5/2020, 4:38:58.000 PM",
    "Computer": "sysloger",
    "RawData": "2020-11-05T16:38:17+00:00 julienc.alsid.app AlsidForAD[4]: \"1\" \"1\" \"Sulforest\" \"dc\" \"CN=ok ok. ok,CN=Users,DC=alsid,DC=corp\" \"2153\" \"New object\" \"primarygroupid\"=\"513",
    "Type": "AlsidForADLog_CL",
    "_ResourceId": "/subscriptions/8c038010-3c7a-40c6-985f-db5e8a04e59f/resourcegroups/julien_clement-rg/providers/microsoft.compute/virtualmachines/sysloger"
  },
  {
    "TenantId": "cc1bd33d-9555-48b2-9161-6d8ca52f65f8",
    "SourceSystem": "OpsManager",
    "MG": "00000000-0000-0000-0000-000000000002",
    "ManagementGroupName": "sysloger",
    "TimeGenerated [UTC]": "11/5/2020, 4:38:58.000 PM",
    "Computer": "sysloger",
    "RawData": "2020-11-05T16:38:17+00:00 julienc.alsid.app AlsidForAD[4]: \"1\" \"1\" \"Sulforest\" \"dc\" \"CN=ok ok. ok,CN=Users,DC=alsid,DC=corp\" \"2153\" \"New object\" \"displayname\"=\"\"ok ok. ok\"",
    "Type": "AlsidForADLog_CL",
    "_ResourceId": "/subscriptions/8c038010-3c7a-40c6-985f-db5e8a04e59f/resourcegroups/julien_clement-rg/providers/microsoft.compute/virtualmachines/sysloger"
  },
  {
    "TenantId": "cc1bd33d-9555-48b2-9161-6d8ca52f65f8",
    "SourceSystem": "OpsManager",
    "MG": "00000000-0000-0000-0000-000000000002",
    "ManagementGroupName": "sysloger",
    "TimeGenerated [UTC]": "11/5/2020, 4:38:58.000 PM",
    "Computer": "sysloger",
    "RawData": "2020-11-05T16:38:17+00:00 julienc.alsid.app AlsidForAD[4]: \"1\" \"1\" \"Sulforest\" \"dc\" \"CN=ok ok. ok,CN=Users,DC=alsid,DC=corp\" \"2153\" \"New object\" \"distinguishedname\"=\"\"CN=ok ok. ok,CN=Users,DC=alsid,DC=corp\"",
    "Type": "AlsidForADLog_CL",
    "_ResourceId": "/subscriptions/8c038010-3c7a-40c6-985f-db5e8a04e59f/resourcegroups/julien_clement-rg/providers/microsoft.compute/virtualmachines/sysloger"
  },
  {
    "TenantId": "cc1bd33d-9555-48b2-9161-6d8ca52f65f8",
    "SourceSystem": "OpsManager",
    "MG": "00000000-0000-0000-0000-000000000002",
    "ManagementGroupName": "sysloger",
    "TimeGenerated [UTC]": "11/5/2020, 4:38:58.000 PM",
    "Computer": "sysloger",
    "RawData": "2020-11-05T16:38:17+00:00 julienc.alsid.app AlsidForAD[4]: \"1\" \"1\" \"Sulforest\" \"dc\" \"CN=ok ok. ok,CN=Users,DC=alsid,DC=corp\" \"2153\" \"New object\" \"usnchanged\"=\"51743",
    "Type": "AlsidForADLog_CL",
    "_ResourceId": "/subscriptions/8c038010-3c7a-40c6-985f-db5e8a04e59f/resourcegroups/julien_clement-rg/providers/microsoft.compute/virtualmachines/sysloger"
  },
  {
    "TenantId": "cc1bd33d-9555-48b2-9161-6d8ca52f65f8",
    "SourceSystem": "OpsManager",
    "MG": "00000000-0000-0000-0000-000000000002",
    "ManagementGroupName": "sysloger",
    "TimeGenerated [UTC]": "11/5/2020, 4:38:58.000 PM",
    "Computer": "sysloger",
    "RawData": "2020-11-05T16:38:17+00:00 julienc.alsid.app AlsidForAD[4]: \"1\" \"1\" \"Sulforest\" \"dc\" \"CN=ok ok. ok,CN=Users,DC=alsid,DC=corp\" \"2153\" \"New object\" \"objectsid\"=\"\"S-1-5-21-4005652508-1286318552-3886753630-1213\"",
    "Type": "AlsidForADLog_CL",
    "_ResourceId": "/subscriptions/8c038010-3c7a-40c6-985f-db5e8a04e59f/resourcegroups/julien_clement-rg/providers/microsoft.compute/virtualmachines/sysloger"
  },
  {
    "TenantId": "cc1bd33d-9555-48b2-9161-6d8ca52f65f8",
    "SourceSystem": "OpsManager",
    "MG": "00000000-0000-0000-0000-000000000002",
    "ManagementGroupName": "sysloger",
    "TimeGenerated [UTC]": "11/5/2020, 4:38:58.000 PM",
    "Computer": "sysloger",
    "RawData": "2020-11-05T16:38:17+00:00 julienc.alsid.app AlsidForAD[4]: \"1\" \"1\" \"Sulforest\" \"dc\" \"CN=ok ok. ok,CN=Users,DC=alsid,DC=corp\" \"2153\" \"New object\" \"objectguid\"=\"\"bd77dba2-c672-46d6-87ba-51be0e92a1f4\"",
    "Type": "AlsidForADLog_CL",
    "_ResourceId": "/subscriptions/8c038010-3c7a-40c6-985f-db5e8a04e59f/resourcegroups/julien_clement-rg/providers/microsoft.compute/virtualmachines/sysloger"
  },
  {
    "TenantId": "cc1bd33d-9555-48b2-9161-6d8ca52f65f8",
    "SourceSystem": "OpsManager",
    "MG": "00000000-0000-0000-0000-000000000002",
    "ManagementGroupName": "sysloger",
    "TimeGenerated [UTC]": "11/5/2020, 4:38:58.000 PM",
    "Computer": "sysloger",
    "RawData": "2020-11-05T16:38:17+00:00 julienc.alsid.app AlsidForAD[4]: \"1\" \"1\" \"Sulforest\" \"dc\" \"CN=ok ok. ok,CN=Users,DC=alsid,DC=corp\" \"2153\" \"New object\" \"userprincipalname\"=\"\"okok@alsid.corp\"",
    "Type": "AlsidForADLog_CL",
    "_ResourceId": "/subscriptions/8c038010-3c7a-40c6-985f-db5e8a04e59f/resourcegroups/julien_clement-rg/providers/microsoft.compute/virtualmachines/sysloger"
  },
  {
    "TenantId": "cc1bd33d-9555-48b2-9161-6d8ca52f65f8",
    "SourceSystem": "OpsManager",
    "MG": "00000000-0000-0000-0000-000000000002",
    "ManagementGroupName": "sysloger",
    "TimeGenerated [UTC]": "11/5/2020, 4:38:58.000 PM",
    "Computer": "sysloger",
    "RawData": "2020-11-05T16:38:17+00:00 julienc.alsid.app AlsidForAD[4]: \"1\" \"1\" \"Sulforest\" \"dc\" \"CN=ok ok. ok,CN=Users,DC=alsid,DC=corp\" \"2153\" \"New object\" \"usncreated\"=\"51742",
    "Type": "AlsidForADLog_CL",
    "_ResourceId": "/subscriptions/8c038010-3c7a-40c6-985f-db5e8a04e59f/resourcegroups/julien_clement-rg/providers/microsoft.compute/virtualmachines/sysloger"
  },
  {
    "TenantId": "cc1bd33d-9555-48b2-9161-6d8ca52f65f8",
    "SourceSystem": "OpsManager",
    "MG": "00000000-0000-0000-0000-000000000002",
    "ManagementGroupName": "sysloger",
    "TimeGenerated [UTC]": "11/5/2020, 4:38:58.000 PM",
    "Computer": "sysloger",
    "RawData": "2020-11-05T16:38:17+00:00 julienc.alsid.app AlsidForAD[4]: \"1\" \"1\" \"Sulforest\" \"dc\" \"CN=ok ok. ok,CN=Users,DC=alsid,DC=corp\" \"2153\" \"New object\" \"ntsecuritydescriptor\"=\"\"O:S-1-5-21-4005652508-1286318552-3886753630-512G:S-1-5-21-4005652508-1286318552-3886753630-512D:AI(OA;;RP;4c164200-20c0-11d0-a768-00aa006e0529;;S-1-5-21-4005652508-1286318552-3886753630-553)(OA;;RP;5f202010-79a5-11d0-9020-00c04fc2d4cf;;S-1-5-21-4005652508-1286318552-3886753630-553)(OA;;RP;bc0ac240-79a9-11d0-9020-00c04fc2d4cf;;S-1-5-21-4005652508-1286318552-3886753630-553)(OA;;RP;037088f8-0ae1-11d2-b422-00a0c968f939;;S-1-5-21-4005652508-1286318552-3886753630-553)(OA;;RPWP;bf967a7f-0de6-11d0-a285-00aa003049e2;;S-1-5-21-4005652508-1286318552-3886753630-517)(OA;;RP;46a9b11d-60ae-405a-b7e8-ff8a58d456d2;;S-1-5-32-560)(OA;;RPWP;6db69a1c-9422-11d1-aebd-0000f80367c1;;S-1-5-32-561)(OA;;RPWP;5805bc62-bdc9-4428-a5e2-856a0f4c185e;;S-1-5-32-561)(OA;;CR;ab721a53-1e2f-11d0-9819-00aa0040529b;;S-1-1-0)(OA;;CR;ab721a53-1e2f-11d0-9819-00aa0040529b;;S-1-5-10)(OA;;CR;ab721a54-1e2f-11d0-9819-00aa0040529b;;S-1-5-10)(OA;;CR;ab721a56-1e2f-11d0-9819-00aa0040529b;;S-1-5-10)(OA;;RP;59ba2f42-79a2-11d0-9020-00c04fc2d3cf;;S-1-5-11)(OA;;RP;e48d0154-bcf8-11d1-8702-00c04fb96050;;S-1-5-11)(OA;;RP;77b5b886-944a-11d1-aebd-0000f80367c1;;S-1-5-11)(OA;;RP;e45795b3-9455-11d1-aebd-0000f80367c1;;S-1-5-11)(OA;;RPWP;77b5b886-944a-11d1-aebd-0000f80367c1;;S-1-5-10)(OA;;RPWP;e45795b2-9455-11d1-aebd-0000f80367c1;;S-1-5-10)(OA;;RPWP;e45795b3-9455-11d1-aebd-0000f80367c1;;S-1-5-10)(A;;CCDCLCSWRPWPDTLOCRSDRCWDWO;;;S-1-5-21-4005652508-1286318552-3886753630-512)(A;;CCDCLCSWRPWPDTLOCRSDRCWDWO;;;S-1-5-32-548)(A;;RC;;;S-1-5-11)(A;;LCRPLORC;;;S-1-5-10)(A;;CCDCLCSWRPWPDTLOCRSDRCWDWO;;;S-1-5-18)(OA;CIIOID;RP;4c164200-20c0-11d0-a768-00aa006e0529;4828cc14-1437-45bc-9b07-ad6f015e5f28;S-1-5-32-554)(OA;CIID;RP;4c164200-20c0-11d0-a768-00aa006e0529;bf967aba-0de6-11d0-a285-00aa003049e2;S-1-5-32-554)(OA;CIIOID;RP;5f202010-79a5-11d0-9020-00c04fc2d4cf;4828cc14-1437-45bc-9b07-ad6f015e5f28;S-1-5-32-554)(OA;CIID;RP;5f202010-79a5-11d0-9020-00c04fc2d4cf;bf967aba-0de6-11d0-a285-00aa003049e2;S-1-5-32-554)(OA;CIIOID;RP;bc0ac240-79a9-11d0-9020-00c04fc2d4cf;4828cc14-1437-45bc-9b07-ad6f015e5f28;S-1-5-32-554)(OA;CIID;RP;bc0ac240-79a9-11d0-9020-00c04fc2d4cf;bf967aba-0de6-11d0-a285-00aa003049e2;S-1-5-32-554)(OA;CIIOID;RP;59ba2f42-79a2-11d0-9020-00c04fc2d3cf;4828cc14-1437-45bc-9b07-ad6f015e5f28;S-1-5-32-554)(OA;CIID;RP;59ba2f42-79a2-11d0-9020-00c04fc2d3cf;bf967aba-0de6-11d0-a285-00aa003049e2;S-1-5-32-554)(OA;CIIOID;RP;037088f8-0ae1-11d2-b422-00a0c968f939;4828cc14-1437-45bc-9b07-ad6f015e5f28;S-1-5-32-554)(OA;CIID;RP;037088f8-0ae1-11d2-b422-00a0c968f939;bf967aba-0de6-11d0-a285-00aa003049e2;S-1-5-32-554)(OA;CIID;RPWP;5b47d60f-6090-40b2-9f37-2a4de88f3063;;S-1-5-21-4005652508-1286318552-3886753630-526)(OA;CIID;RPWP;5b47d60f-6090-40b2-9f37-2a4de88f3063;;S-1-5-21-4005652508-1286318552-3886753630-527)(OA;CIIOID;SW;9b026da6-0d3c-465c-8bee-5199d7165cba;bf967a86-0de6-11d0-a285-00aa003049e2;S-1-3-0)(OA;CIIOID;SW;9b026da6-0d3c-465c-8bee-5199d7165cba;bf967a86-0de6-11d0-a285-00aa003049e2;S-1-5-10)(OA;CIIOID;RP;b7c69e6d-2cc7-11d2-854e-00a0c983f608;bf967a86-0de6-11d0-a285-00aa003049e2;S-1-5-9)(OA;CIIOID;RP;b7c69e6d-2cc7-11d2-854e-00a0c983f608;bf967a9c-0de6-11d0-a285-00aa003049e2;S-1-5-9)(OA;CIID;RP;b7c69e6d-2cc7-11d2-854e-00a0c983f608;bf967aba-0de6-11d0-a285-00aa003049e2;S-1-5-9)(OA;CIIOID;WP;ea1b7b93-5e48-46d5-bc6c-4df4fda78a35;bf967a86-0de6-11d0-a285-00aa003049e2;S-1-5-10)(OA;CIIOID;LCRPLORC;;4828cc14-1437-45bc-9b07-ad6f015e5f28;S-1-5-32-554)(OA;CIIOID;LCRPLORC;;bf967a9c-0de6-11d0-a285-00aa003049e2;S-1-5-32-554)(OA;CIID;LCRPLORC;;bf967aba-0de6-11d0-a285-00aa003049e2;S-1-5-32-554)(OA;OICIID;RPWP;3f78c3e5-f79a-46bd-a0b8-9d18116ddc79;;S-1-5-10)(OA;CIID;RPWPCR;91e647de-d96f-4b70-9557-d63ff4f3ccd8;;S-1-5-10)(A;CIID;CCDCLCSWRPWPDTLOCRSDRCWDWO;;;S-1-5-21-4005652508-1286318552-3886753630-519)(A;CIID;LC;;;S-1-5-32-554)(A;CIID;CCLCSWRPWPLOCRSDRCWDWO;;;S-1-5-32-544)\"",
    "Type": "AlsidForADLog_CL",
    "_ResourceId": "/subscriptions/8c038010-3c7a-40c6-985f-db5e8a04e59f/resourcegroups/julien_clement-rg/providers/microsoft.compute/virtualmachines/sysloger"
  },
  {
    "TenantId": "cc1bd33d-9555-48b2-9161-6d8ca52f65f8",
    "SourceSystem": "OpsManager",
    "MG": "00000000-0000-0000-0000-000000000002",
    "ManagementGroupName": "sysloger",
    "TimeGenerated [UTC]": "11/5/2020, 4:38:58.000 PM",
    "Computer": "sysloger",
    "RawData": "2020-11-05T16:38:17+00:00 julienc.alsid.app AlsidForAD[4]: \"1\" \"1\" \"Sulforest\" \"dc\" \"CN=ok ok. ok,CN=Users,DC=alsid,DC=corp\" \"2153\" \"New object\" \"badpasswordtime\"=\"\"1601-01-01T00:00:00.0000000Z\"",
    "Type": "AlsidForADLog_CL",
    "_ResourceId": "/subscriptions/8c038010-3c7a-40c6-985f-db5e8a04e59f/resourcegroups/julien_clement-rg/providers/microsoft.compute/virtualmachines/sysloger"
  },
  {
    "TenantId": "cc1bd33d-9555-48b2-9161-6d8ca52f65f8",
    "SourceSystem": "OpsManager",
    "MG": "00000000-0000-0000-0000-000000000002",
    "ManagementGroupName": "sysloger",
    "TimeGenerated [UTC]": "11/5/2020, 4:38:58.000 PM",
    "Computer": "sysloger",
    "RawData": "2020-11-05T16:38:17+00:00 julienc.alsid.app AlsidForAD[4]: \"1\" \"1\" \"Sulforest\" \"dc\" \"CN=ok ok. ok,CN=Users,DC=alsid,DC=corp\" \"2153\" \"New object\" \"samaccountname\"=\"\"okok\"",
    "Type": "AlsidForADLog_CL",
    "_ResourceId": "/subscriptions/8c038010-3c7a-40c6-985f-db5e8a04e59f/resourcegroups/julien_clement-rg/providers/microsoft.compute/virtualmachines/sysloger"
  },
  {
    "TenantId": "cc1bd33d-9555-48b2-9161-6d8ca52f65f8",
    "SourceSystem": "OpsManager",
    "MG": "00000000-0000-0000-0000-000000000002",
    "ManagementGroupName": "sysloger",
    "TimeGenerated [UTC]": "11/5/2020, 4:38:58.000 PM",
    "Computer": "sysloger",
    "RawData": "2020-11-05T16:38:17+00:00 julienc.alsid.app AlsidForAD[4]: \"1\" \"1\" \"Sulforest\" \"dc\" \"CN=ok ok. ok,CN=Users,DC=alsid,DC=corp\" \"2153\" \"New object\" \"whencreated\"=\"\"2020-11-05T16:38:15.0000000Z\"",
    "Type": "AlsidForADLog_CL",
    "_ResourceId": "/subscriptions/8c038010-3c7a-40c6-985f-db5e8a04e59f/resourcegroups/julien_clement-rg/providers/microsoft.compute/virtualmachines/sysloger"
  },
  {
    "TenantId": "cc1bd33d-9555-48b2-9161-6d8ca52f65f8",
    "SourceSystem": "OpsManager",
    "MG": "00000000-0000-0000-0000-000000000002",
    "ManagementGroupName": "sysloger",
    "TimeGenerated [UTC]": "11/5/2020, 4:38:58.000 PM",
    "Computer": "sysloger",
    "RawData": "2020-11-05T16:38:17+00:00 julienc.alsid.app AlsidForAD[4]: \"1\" \"1\" \"Sulforest\" \"dc\" \"CN=ok ok. ok,CN=Users,DC=alsid,DC=corp\" \"2153\" \"New object\" \"samaccounttype\"=\"\"SAM_NORMAL_USER_ACCOUNT\"",
    "Type": "AlsidForADLog_CL",
    "_ResourceId": "/subscriptions/8c038010-3c7a-40c6-985f-db5e8a04e59f/resourcegroups/julien_clement-rg/providers/microsoft.compute/virtualmachines/sysloger"
  },
  {
    "TenantId": "cc1bd33d-9555-48b2-9161-6d8ca52f65f8",
    "SourceSystem": "OpsManager",
    "MG": "00000000-0000-0000-0000-000000000002",
    "ManagementGroupName": "sysloger",
    "TimeGenerated [UTC]": "11/5/2020, 4:38:58.000 PM",
    "Computer": "sysloger",
    "RawData": "2020-11-05T16:38:17+00:00 julienc.alsid.app AlsidForAD[4]: \"1\" \"1\" \"Sulforest\" \"dc\" \"CN=ok ok. ok,CN=Users,DC=alsid,DC=corp\" \"2153\" \"New object\" \"cn\"=\"\"ok ok. ok\"",
    "Type": "AlsidForADLog_CL",
    "_ResourceId": "/subscriptions/8c038010-3c7a-40c6-985f-db5e8a04e59f/resourcegroups/julien_clement-rg/providers/microsoft.compute/virtualmachines/sysloger"
  },
  {
    "TenantId": "cc1bd33d-9555-48b2-9161-6d8ca52f65f8",
    "SourceSystem": "OpsManager",
    "MG": "00000000-0000-0000-0000-000000000002",
    "ManagementGroupName": "sysloger",
    "TimeGenerated [UTC]": "11/5/2020, 4:38:58.000 PM",
    "Computer": "sysloger",
    "RawData": "2020-11-05T16:38:17+00:00 julienc.alsid.app AlsidForAD[4]: \"1\" \"1\" \"Sulforest\" \"dc\" \"CN=ok ok. ok,CN=Users,DC=alsid,DC=corp\" \"2153\" \"New object\" \"whenchanged\"=\"\"2020-11-05T16:38:15.0000000Z\"",
    "Type": "AlsidForADLog_CL",
    "_ResourceId": "/subscriptions/8c038010-3c7a-40c6-985f-db5e8a04e59f/resourcegroups/julien_clement-rg/providers/microsoft.compute/virtualmachines/sysloger"
  },
  {
    "TenantId": "cc1bd33d-9555-48b2-9161-6d8ca52f65f8",
    "SourceSystem": "OpsManager",
    "MG": "00000000-0000-0000-0000-000000000002",
    "ManagementGroupName": "sysloger",
    "TimeGenerated [UTC]": "11/5/2020, 4:38:58.000 PM",
    "Computer": "sysloger",
    "RawData": "2020-11-05T16:38:17+00:00 julienc.alsid.app AlsidForAD[4]: \"1\" \"1\" \"Sulforest\" \"dc\" \"CN=RID Set,CN=dc-vm,OU=Domain Controllers,DC=alsid,DC=corp\" \"2154\" \"\" \"ridnextrid\"=\"1213",
    "Type": "AlsidForADLog_CL",
    "_ResourceId": "/subscriptions/8c038010-3c7a-40c6-985f-db5e8a04e59f/resourcegroups/julien_clement-rg/providers/microsoft.compute/virtualmachines/sysloger"
  },
  {
    "TenantId": "cc1bd33d-9555-48b2-9161-6d8ca52f65f8",
    "SourceSystem": "OpsManager",
    "MG": "00000000-0000-0000-0000-000000000002",
    "ManagementGroupName": "sysloger",
    "TimeGenerated [UTC]": "11/5/2020, 4:38:58.000 PM",
    "Computer": "sysloger",
    "RawData": "2020-11-05T16:38:17+00:00 julienc.alsid.app AlsidForAD[4]: \"1\" \"1\" \"Sulforest\" \"dc\" \"CN=ok ok. ok,CN=Users,DC=alsid,DC=corp\" \"2156\" \"\" \"pwdlastset\"=\"\"1601-01-01T00:00:00.0000000Z\"",
    "Type": "AlsidForADLog_CL",
    "_ResourceId": "/subscriptions/8c038010-3c7a-40c6-985f-db5e8a04e59f/resourcegroups/julien_clement-rg/providers/microsoft.compute/virtualmachines/sysloger"
  },
  {
    "TenantId": "cc1bd33d-9555-48b2-9161-6d8ca52f65f8",
    "SourceSystem": "OpsManager",
    "MG": "00000000-0000-0000-0000-000000000002",
    "ManagementGroupName": "sysloger",
    "TimeGenerated [UTC]": "11/5/2020, 4:38:58.000 PM",
    "Computer": "sysloger",
    "RawData": "2020-11-05T16:38:17+00:00 julienc.alsid.app AlsidForAD[4]: \"1\" \"1\" \"Sulforest\" \"dc\" \"CN=ok ok. ok,CN=Users,DC=alsid,DC=corp\" \"2156\" \"\" \"usnchanged\"=\"51746",
    "Type": "AlsidForADLog_CL",
    "_ResourceId": "/subscriptions/8c038010-3c7a-40c6-985f-db5e8a04e59f/resourcegroups/julien_clement-rg/providers/microsoft.compute/virtualmachines/sysloger"
  },
  {
    "TenantId": "cc1bd33d-9555-48b2-9161-6d8ca52f65f8",
    "SourceSystem": "OpsManager",
    "MG": "00000000-0000-0000-0000-000000000002",
    "ManagementGroupName": "sysloger",
    "TimeGenerated [UTC]": "11/5/2020, 4:38:58.000 PM",
    "Computer": "sysloger",
    "RawData": "2020-11-05T16:38:17+00:00 julienc.alsid.app AlsidForAD[4]: \"1\" \"1\" \"Sulforest\" \"dc\" \"CN=ok ok. ok,CN=Users,DC=alsid,DC=corp\" \"2155\" \"\" \"usnchanged\"=\"51745",
    "Type": "AlsidForADLog_CL",
    "_ResourceId": "/subscriptions/8c038010-3c7a-40c6-985f-db5e8a04e59f/resourcegroups/julien_clement-rg/providers/microsoft.compute/virtualmachines/sysloger"
  },
  {
    "TenantId": "cc1bd33d-9555-48b2-9161-6d8ca52f65f8",
    "SourceSystem": "OpsManager",
    "MG": "00000000-0000-0000-0000-000000000002",
    "ManagementGroupName": "sysloger",
    "TimeGenerated [UTC]": "11/5/2020, 4:38:58.000 PM",
    "Computer": "sysloger",
    "RawData": "2020-11-05T16:38:17+00:00 julienc.alsid.app AlsidForAD[4]: \"1\" \"1\" \"Sulforest\" \"dc\" \"CN=ok ok. ok,CN=Users,DC=alsid,DC=corp\" \"2155\" \"\" \"pwdlastset\"=\"\"2020-11-05T16:38:15.6232144Z\"",
    "Type": "AlsidForADLog_CL",
    "_ResourceId": "/subscriptions/8c038010-3c7a-40c6-985f-db5e8a04e59f/resourcegroups/julien_clement-rg/providers/microsoft.compute/virtualmachines/sysloger"
  },
  {
    "TenantId": "cc1bd33d-9555-48b2-9161-6d8ca52f65f8",
    "SourceSystem": "OpsManager",
    "MG": "00000000-0000-0000-0000-000000000002",
    "ManagementGroupName": "sysloger",
    "TimeGenerated [UTC]": "11/5/2020, 4:38:58.000 PM",
    "Computer": "sysloger",
    "RawData": "2020-11-05T16:38:17+00:00 julienc.alsid.app AlsidForAD[4]: \"1\" \"1\" \"Sulforest\" \"dc\" \"CN=ok ok. ok,CN=Users,DC=alsid,DC=corp\" \"2157\" \"\" \"useraccountcontrol\"=\"\"DISABLE NORMAL \"",
    "Type": "AlsidForADLog_CL",
    "_ResourceId": "/subscriptions/8c038010-3c7a-40c6-985f-db5e8a04e59f/resourcegroups/julien_clement-rg/providers/microsoft.compute/virtualmachines/sysloger"
  },
  {
    "TenantId": "cc1bd33d-9555-48b2-9161-6d8ca52f65f8",
    "SourceSystem": "OpsManager",
    "MG": "00000000-0000-0000-0000-000000000002",
    "ManagementGroupName": "sysloger",
    "TimeGenerated [UTC]": "11/5/2020, 4:38:58.000 PM",
    "Computer": "sysloger",
    "RawData": "2020-11-05T16:38:17+00:00 julienc.alsid.app AlsidForAD[4]: \"1\" \"1\" \"Sulforest\" \"dc\" \"CN=ok ok. ok,CN=Users,DC=alsid,DC=corp\" \"2157\" \"\" \"usnchanged\"=\"51747\"",
    "Type": "AlsidForADLog_CL",
    "_ResourceId": "/subscriptions/8c038010-3c7a-40c6-985f-db5e8a04e59f/resourcegroups/julien_clement-rg/providers/microsoft.compute/virtualmachines/sysloger"
  },
  {
    "TenantId": "cc1bd33d-9555-48b2-9161-6d8ca52f65f8",
    "SourceSystem": "OpsManager",
    "MG": "00000000-0000-0000-0000-000000000002",
    "ManagementGroupName": "sysloger",
    "TimeGenerated [UTC]": "03/03/2021, 7:38:08.000 AM",
    "Computer": "sysloger",
    "RawData": "2021-03-03T07:37:51+00:00 julienc.alsid.app AlsidForAD[4]: \"2\" \"0\" \"Sulforest\" \"dc\" \"DC Sync\" \"medium\" \"yoda.alsid.corp\" \"10.0.0.1\" \"x1x.alsid.corp\" \"10.1.0.1\" \"user\"=\"Gustavo Fring\" \"dc_name\"=\"MyDC\"",
    "Type": "AlsidForADLog_CL",
    "_ResourceId": "/subscriptions/8c038010-3c7a-40c6-985f-db5e8a04e59f/resourcegroups/julien_clement-rg/providers/microsoft.compute/virtualmachines/sysloger"
  },
  {
    "TenantId": "cc1bd33d-9555-48b2-9161-6d8ca52f65f8",
    "SourceSystem": "OpsManager",
    "MG": "00000000-0000-0000-0000-000000000002",
    "ManagementGroupName": "sysloger",
    "TimeGenerated [UTC]": "03/03/2021, 7:38:08.000 AM",
    "Computer": "sysloger",
    "RawData": "2021-03-03T07:37:51+00:00 julienc.alsid.app AlsidForAD[4]: \"2\" \"0\" \"Sulforest\" \"dc\" \"DC Sync\" \"medium\" \"yoda.alsid.corp\" \"10.0.0.1\" \"x1x.alsid.corp\" \"10.1.0.1\" \"user\"=\"Gustavo Fring\" \"dc_name\"=\"MyDC\"",
    "Type": "AlsidForADLog_CL",
    "_ResourceId": "/subscriptions/8c038010-3c7a-40c6-985f-db5e8a04e59f/resourcegroups/julien_clement-rg/providers/microsoft.compute/virtualmachines/sysloger"
  },
  {
    "TenantId": "cc1bd33d-9555-48b2-9161-6d8ca52f65f8",
    "SourceSystem": "OpsManager",
    "MG": "00000000-0000-0000-0000-000000000002",
    "ManagementGroupName": "sysloger",
    "TimeGenerated [UTC]": "03/03/2021, 7:38:08.000 AM",
    "Computer": "sysloger",
    "RawData": "2021-03-03T07:37:52+00:00 julienc.alsid.app AlsidForAD[4]: \"2\" \"0\" \"Sulforest\" \"dc\" \"DC Sync\" \"medium\" \"yoda.alsid.corp\" \"10.0.0.1\" \"x1x.alsid.corp\" \"10.1.0.1\" \"user\"=\"Gustavo Fring\" \"dc_name\"=\"MyDC\"",
    "Type": "AlsidForADLog_CL",
    "_ResourceId": "/subscriptions/8c038010-3c7a-40c6-985f-db5e8a04e59f/resourcegroups/julien_clement-rg/providers/microsoft.compute/virtualmachines/sysloger"
  }
]
